html_url,id,names.types.ror_display,status,types,names.types.alias,names.types.label,names.types.acronym,links.type.website,links.type.wikipedia,domains,established,external_ids.type.fundref.all,external_ids.type.fundref.preferred,external_ids.type.grid.all,external_ids.type.grid.preferred,external_ids.type.isni.all,external_ids.type.isni.preferred,external_ids.type.wikidata.all,external_ids.type.wikidata.preferred,city,country,locations.geonames_id,parent_relationships,comment
,https://ror.org/03re1b483,Unidade Local de Saúde do Médio Ave*pt,active,healthcare,,Unidade Local de Saúde do Médio Ave*pt,,https://www.ulsmave.min-saude.pt,,ulsmave.min-saude.pt,,,,,,0000 0005 1445 0667,0000 0005 1445 0667,Q124774178,Q124774178,Santo Tirso,Portugal,2734570,,
,https://ror.org/05eqpgf47,Unidade Local de Saúde do Médio Tejo*pt,active,healthcare,,Unidade Local de Saúde do Médio Tejo*pt,,https://www.chmt.min-saude.pt,,chmt.min-saude.pt,,,,,,0000 0005 1445 3243,0000 0005 1445 3243,Q124819348,Q124819348,Tomar,Portugal,2262644,,
,https://ror.org/05x24c339,Unidade Local de Saúde do Norte Alentejano EPE*pt,active,healthcare,,Unidade Local de Saúde do Norte Alentejano EPE*pt,ULSNA*pt,https://www.ulsna.min-saude.pt,,ulsna.min-saude.pt,,,,,,0000 0004 5914 0809,0000 0004 5914 0809,,,Portalegre,Portugal,2264507,,
,https://ror.org/0328djp07,Unidade Local de Saúde do Oeste*pt,active,healthcare,,Unidade Local de Saúde do Oeste*pt,,https://www.choeste.min-saude.pt,,choeste.min-saude.pt,,,,,,0000 0005 1445 3235,0000 0005 1445 3235,Q124812826,Q124812826,Caldas da Rainha,Portugal,2270437,,
,https://ror.org/05h34sh86,Unidade Local de Saúde Gaia/Espinho*pt,active,healthcare,,Unidade Local de Saúde Gaia/Espinho*pt,,https://www.ulsge.min-saude.pt,,ulsge.min-saude.pt,,,,,,0000 0005 1445 0675,0000 0005 1445 0675,,,Vila Nova de Gaia,Portugal,2732544,,
,https://ror.org/0300gbr82,Unilabs (Portugal)*pt,active,company,,Unilabs (Portugal)*pt,,https://www.unilabs.pt,,unilabs.pt,,,,,,0000 0004 7480 3535,0000 0004 7480 3535,,,Porto,Portugal,2735943,,
,https://ror.org/01w6ghb32,Unilever FIMA (Portugal)*pt;,active,company,Unilever Jerónimo Martins*pt,Unilever FIMA (Portugal)*pt;,,https://www.unilever-fima.com,,unilever-fima.com,,,,,,0000 0004 0454 3897,0000 0004 0454 3897,,,Lisboa,Portugal,2267057,,
,https://ror.org/029frk090,Centro de Estudos das Migrações e das Relações Interculturais*pt,active,education,Universidade Aberta Centro de Estudos das Migrações e das Relações Interculturais*pt,Centro de Estudos das Migrações e das Relações Interculturais*pt,CEMRI*pt,https://cemri.uab.pt,,cemri.uab.pt,,,,,,0000 0001 1959 7781,0000 0001 1959 7781,,,Lisboa,Portugal,2267057,https://ror.org/02rv3w387,
,https://ror.org/03k0aef63,Centro de Estudos Globais*pt,active,education,Universidade Aberta Centro de Estudos Globais*pt,Centro de Estudos Globais*pt,CEG*pt,https://ceg.uab.pt,,ceg.uab.pt,,,,,,0000 0005 0832 0807,0000 0005 0832 0807,,,Lisboa,Portugal,2267057,https://ror.org/02rv3w387,
,https://ror.org/009gp5h03,Unidade Móvel de Investigação em Estudos do Local*pt,active,education,Universidade Aberta Unidade Móvel de Investigação em Estudos do Local*pt,Unidade Móvel de Investigação em Estudos do Local*pt,ELO*pt,,,,,,,,,0000 0004 6419 8319,0000 0004 6419 8319,,,Lisboa,Portugal,2267057,https://ror.org/02rv3w387,"Active, Website not loading"
,https://ror.org/05w0yf696,Observatório de Relações Exteriores*pt,active,education,Universidade Autónoma de Lisboa Observatório de Relações Exteriores*pt,Observatório de Relações Exteriores*pt,OBSERVARE*pt,https://observare.autonoma.pt,,observare.autonoma.pt,,,,,,0000 0004 5897 203X,0000 0004 5897 203X,,,Lisboa,Portugal,2267057,https://ror.org/01ryrwk91,
,https://ror.org/04871v221,Centro de Estudos de Gestão e Economia Aplicada*pt,active,education,Universidade Católica Portuguesa Centro de Estudos de Gestão e Economia Aplicada*pt,Centro de Estudos de Gestão e Economia Aplicada*pt,CEGEA*pt,https://ciencia.ucp.pt/pt/organisations/centro-de-estudos-de-gest%C3%A3o-e-economia-aplicada,,,,,,,,0000 0004 5928 1118,0000 0004 5928 1118,,,Porto,Portugal,2735943,https://ror.org/03b9snr86,
,https://ror.org/0497rkw71,Centro de Estudos de Religiões e Culturas Cardeal Höffner*pt,inactive,education,Universidade Católica Portuguesa Centro de Estudos de Religiões e Culturas Cardeal Höffner*pt,Centro de Estudos de Religiões e Culturas Cardeal Höffner*pt,CERC*pt,https://ciencia.ucp.pt/pt/organisations/research-centre-for-theology-and-religious-studies-citer,,,,,,,,0000 0004 5927 9798,0000 0004 5927 9798,,,Lisboa,Portugal,2267057,https://ror.org/03b9snr86,"Add as Inactive, succeeded by (https://ror.org/00zgs5r70)"
,https://ror.org/04rnk9665,Centro de Ética Económica e Empresarial*pt,active,education,Universidade Católica Portuguesa Centro de Ética Económica e Empresarial*pt,Centro de Ética Económica e Empresarial*pt,CEBE*pt,https://www.clsbe.lisboa.ucp.pt/pt-pt/center-ethics-business-and-economics/center-ethics-business-and-economics,,,,,,,,0000 0004 6439 8062,0000 0004 6439 8062,,,Lisboa,Portugal,2267057,https://ror.org/03b9snr86,
,https://ror.org/016z31q49,Centro de Investigação Interdisciplinar em Saúde Centro Regional de Viseu*pt,active,education,Universidade Católica Portuguesa Centro de Investigação Interdisciplinar em Saúde Centro Regional de Viseu*pt,Centro de Investigação Interdisciplinar em Saúde Centro Regional de Viseu*pt; Center for Ethics in Business and Economics*en,,,,,,,,,,0000 0005 1091 1040,0000 0005 1091 1040,,,Viseu,Portugal,2732264,https://ror.org/03b9snr86,
,https://ror.org/05acdb150,Centro de Investigação Interdisciplinar em Saúde Centro Regional do Porto*pt,active,education,Universidade Católica Portuguesa Centro de Investigação Interdisciplinar em Saúde Centro Regional do Porto*pt,Centro de Investigação Interdisciplinar em Saúde Centro Regional do Porto*pt,,,,,,,,,,0000 0005 1091 1008,0000 0005 1091 1008,,,Porto,Portugal,2735943,https://ror.org/03b9snr86,
,https://ror.org/03wcn8b34,Unidade de Investigação em Gestão e Economia*pt,active,education,Universidade Católica Portuguesa Unidade de Investigação em Gestão e Economia*pt,Unidade de Investigação em Gestão e Economia*pt; CATÓLICA-LISBON Research Unit in Business and Economics*en,CUBE*pt,https://clsbe.lisboa.ucp.pt/research/about-cube,,,,,,,,0000 0004 5896 1648,0000 0004 5896 1648,,,Lisboa,Portugal,2267057,https://ror.org/03b9snr86,
,https://ror.org/0525jbb43,Centro de Tecnologia da Linguagem Humana e Bioinformática*pt,active,education,Universidade da Beira Interior Centro de Tecnologia da Linguagem Humana e Bioinformática*pt,Centro de Tecnologia da Linguagem Humana e Bioinformática*pt; Center for Human Language Technology and Bioinformatics*en,HULTIG*pt,https://hultig.ubi.pt,,hultig.ubi.pt,,,,,,0000 0004 6416 4901,0000 0004 6416 4901,,,Covilhã,Portugal,2740313,https://ror.org/03nf36p02,
,https://ror.org/04ycf0k71,Centro de Ciências Matemáticas*pt,active,education,Universidade da Madeira Centro de Ciências Matemáticas*pt,Centro de Ciências Matemáticas*pt,CCM*pt,http://ccm.uma.pt,,ccm.uma.pt,,,,,,0000 0004 5928 1652,0000 0004 5928 1652,,,Funchal,Portugal,2267827,https://ror.org/0442zbe52,
,https://ror.org/01551d523,Centro de Investigação em Estudos Regionais e Locais*pt,active,education,Universidade da Madeira Centro de Investigação em Estudos Regionais e Locais*pt,Centro de Investigação em Estudos Regionais e Locais*pt,CIERL*pt,https://cierl.uma.pt,,cierl.uma.pt,2007,,,,,0000 0004 6413 8957,0000 0004 6413 8957,,,Funchal,Portugal,2267827,https://ror.org/0442zbe52,
,https://ror.org/01tgdcv71,Centro de Química da Madeira*pt,active,education,Universidade da Madeira Centro de Química da Madeira*pt,Centro de Química da Madeira*pt; Madeira Chemistry Research Centre*en,CQM*pt,https://cqm.uma.pt,,cqm.uma.pt,,,,,,0000 0004 4903 245X,0000 0004 4903 245X,,,Funchal,Portugal,2267827,https://ror.org/0442zbe52,
,https://ror.org/01hbpef95,Grupo de Astronomia*pt,active,education,Universidade da Madeira Grupo de Astronomia*pt,Grupo de Astronomia*pt,GAUMa*pt,https://astro.web.uma.pt/Grupo/index.htm,,,,,,,,0000 0004 6471 8118,0000 0004 6471 8118,,,Funchal,Portugal,2267827,https://ror.org/0442zbe52,
,https://ror.org/02c4ps936,ISOPlexis Banco de Germoplasma*pt,active,education,Universidade da Madeira ISOPlexis Banco de Germoplasma*pt,ISOPlexis Banco de Germoplasma*pt,,https://isoplexis.uma.pt/gringlobal/search.aspx,,,,,,,,0000 0004 5928 1628,0000 0004 5928 1628,,,Funchal,Portugal,2267827,https://ror.org/0442zbe52,
,https://ror.org/00wx08c65,Associação para a Formação Profissional e Investigação*pt,active,education,Universidade de Aveiro Associação para a Formação Profissional e Investigação*pt,Associação para a Formação Profissional e Investigação*pt,UNAVE*pt,https://www.unave.pt,,unave.pt,,,,,,0000 0005 1089 1860,0000 0005 1089 1860,,,Aveiro,Portugal,2742611,https://ror.org/00nt41z93,
,https://ror.org/020mkze41,Centro de Estudos e Peritagem em Auditoria e Contabilidade*pt,active,education,Universidade de Aveiro Centro de Estudos e Peritagem em Auditoria e Contabilidade*pt,Centro de Estudos e Peritagem em Auditoria e Contabilidade*pt,CEPAC*pt,,,,,,,,,0000 0004 5928 1679,0000 0004 5928 1679,,,Aveiro,Portugal,2742611,https://ror.org/00nt41z93,"Active, Website not loading/found"
,https://ror.org/02g50ac66,Unidade de Transferência de Tecnologia*pt,inactive,education,Universidade de Aveiro Unidade de Transferência de Tecnologia*pt,Unidade de Transferência de Tecnologia*pt,TEC*pt,,,,,,,,,0000 0005 0633 1465,0000 0005 0633 1465,,,Aveiro,Portugal,2742611,https://ror.org/00nt41z93,"Add as Inactive, according to https://www.ua.pt/pt/uacoopera it was succeeded by UACOOPERA (https://ror.org/0412bhr24)"
,https://ror.org/04d9egb29,Centro de Estudos de Linguística Geral e Aplicada*pt,active,education,Universidade de Coimbra Centro de Estudos de Linguística Geral e Aplicada*pt,Centro de Estudos de Linguística Geral e Aplicada*pt,CELGA*pt,https://celga-iltec.uc.pt,,celga-iltec.uc.pt,,,,,,0000 0004 0393 7915,0000 0004 0393 7915,,,Coimbra,Portugal,2740637,https://ror.org/04z8k9a98,
,https://ror.org/03bm2y510,Universidade de Coimbra Ius Gentium Conimbrigae Centro de Direitos Humanos*pt,active,education,Universidade de Coimbra Ius Gentium Conimbrigae Centro de Direitos Humanos*pt,Universidade de Coimbra Ius Gentium Conimbrigae Centro de Direitos Humanos*pt; Human Rights Centre*en,IGC CDH*pt,https://igc.fd.uc.pt,,igc.fd.uc.pt,,,,,,0000 0004 6418 2827,0000 0004 6418 2827,,,Coimbra,Portugal,2740637,https://ror.org/04z8k9a98,
,https://ror.org/03a78xy24,Universidade de Coimbra Museu da Ciência*pt,active,other,,Universidade de Coimbra Museu da Ciência*pt,,http://www.museudaciencia.pt,,museudaciencia.pt,,,,,,0000 0001 2113 265X,0000 0001 2113 265X,,,Coimbra,Portugal,2740637,https://ror.org/04z8k9a98,
,https://ror.org/00cs0m088,Universidade de Coimbra Unidade de Investigação e Desenvolvimento Química-Física Molecular*pt,active,education,Universidade de Coimbra Unidade de Investigação e Desenvolvimento Química-Física Molecular*pt,Universidade de Coimbra Unidade de Investigação e Desenvolvimento Química-Física Molecular*pt,QFM*pt,https://qfm.uc.pt/index.html/,,,,,,,,0000 0004 5897 2056,0000 0004 5897 2056,,,Coimbra,Portugal,2740637,https://ror.org/04z8k9a98,
,https://ror.org/02dfn9z13,Centro de Investigação em Sociologia e Antropologia Augusto da Silva*pt,active,education,Universidade de Évora Centro de Investigação em Sociologia e Antropologia Augusto da Silva*pt,Centro de Investigação em Sociologia e Antropologia Augusto da Silva*pt,CISA-AS*pt,http://www.cisa-as.uevora.pt,,cisa-as.uevora.pt,,,,,,0000 0004 6413 9001,0000 0004 6413 9001,,,Évora,Portugal,2268406,https://ror.org/02gyps716,
,https://ror.org/044zx7719,Centro de Química de Évora*pt,active,education,Universidade de Évora Centro de Química de Évora*pt,Centro de Química de Évora*pt,CQE*pt,http://www.cqe.uevora.pt,,cqe.uevora.pt,,,,,,0000 0004 4903 2425,0000 0004 4903 2425,,,Évora,Portugal,2268406,https://ror.org/02gyps716,
,https://ror.org/053j74t32,Biblioteca Noronha Feio*pt,active,archive,Universidade de Lisboa Biblioteca Noronha Feio*pt,Biblioteca Noronha Feio*pt,,https://www.fmh.ulisboa.pt/servicos/biblioteca,,,,,,,,0000 0004 7414 6731,0000 0004 7414 6731,,,Cruz Quebrada,Portugal,2268791,https://ror.org/01c27hj86,
,https://ror.org/04nvdxw11,Centro de Estudos Clássicos*pt,active,education,Universidade de Lisboa Centro de Estudos Clássicos*pt,Centro de Estudos Clássicos*pt,,https://centroclassicos.letras.ulisboa.pt,,centroclassicos.letras.ulisboa.pt,,,,,,0000 0001 2206 8573,0000 0001 2206 8573,,,Lisboa,Portugal,2267057,https://ror.org/01c27hj86,
,https://ror.org/04dnsak29,Centro de Estudos Comparatistas*pt,active,education,Universidade de Lisboa Centro de Estudos Comparatistas*pt,Centro de Estudos Comparatistas*pt,CEC*pt,https://cecomp.letras.ulisboa.pt,,cecomp.letras.ulisboa.pt,,,,,,0000 0001 0387 9979,0000 0001 0387 9979,,,Lisboa,Portugal,2267057,https://ror.org/01c27hj86,
,https://ror.org/01mvyk241,Centro de Estudos de Medicina Baseada na Evidência*pt,active,education,Universidade de Lisboa Centro de Estudos de Medicina Baseada na Evidência*pt,Centro de Estudos de Medicina Baseada na Evidência*pt,CEMBE*pt,https://www.medicina.ulisboa.pt/centro-de-estudos-de-medicina-baseada-na-evidencia-cembe,,,,,,,,0000 0004 6410 903X,0000 0004 6410 903X,,,Lisboa,Portugal,2267057,https://ror.org/01c27hj86,
,https://ror.org/05fyyyx53,Centro de Estudos de Teatro*pt,active,education,Universidade de Lisboa Centro de Estudos de Teatro*pt,Centro de Estudos de Teatro*pt,CET*pt; CETEATRO*pt,https://ceteatro.pt,,ceteatro.pt,,,,,,0000 0001 2303 0382,0000 0001 2303 0382,,,Lisboa,Portugal,2267057,https://ror.org/01c27hj86,
,https://ror.org/057et8d07,Centro de Estudos sobre África e do Desenvolvimento*pt,active,education,Universidade de Lisboa Centro de Estudos sobre África e do Desenvolvimento*pt,Centro de Estudos sobre África e do Desenvolvimento*pt,CESA*pt,https://cesa.rc.iseg.ulisboa.pt,,cesa.rc.iseg.ulisboa.pt,,,,,,0000 0004 4678 9174,0000 0004 4678 9174,,,Lisboa,Portugal,2267057,https://ror.org/01c27hj86,
,https://ror.org/00n1yyc49,Centro de Filosofia das Ciências*pt,active,education,Universidade de Lisboa Centro de Filosofia das Ciências*pt,Centro de Filosofia das Ciências*pt,CFCUL*pt,https://cfcul.ciencias.ulisboa.pt,,cfcul.ciencias.ulisboa.pt,,,,,,0000 0000 9830 5793,0000 0000 9830 5793,,,Lisboa,Portugal,2267057,https://ror.org/01c27hj86,
,https://ror.org/03xkvz448,Centro de Investigação de Direito Público*pt,active,education,Universidade de Lisboa Centro de Investigação de Direito Público*pt,Centro de Investigação de Direito Público*pt; Lisbon Public Law Research Centre*en,LPL*pt,https://lisbonpubliclaw.pt,,lisbonpubliclaw.pt,,,,,,0000 0004 5895 0981,0000 0004 5895 0981,,,Lisboa,Portugal,2267057,https://ror.org/01c27hj86,
,https://ror.org/037kpn189,Centro de Investigação e de Estudos em Belas-Artes*pt,active,education,Universidade de Lisboa Centro de Investigação e de Estudos em Belas-Artes*pt,Centro de Investigação e de Estudos em Belas-Artes*pt,CIEBA*pt,https://cieba.belasartes.ulisboa.pt,,cieba.belasartes.ulisboa.pt,,,,,,0000 0004 5897 5767,0000 0004 5897 5767,,,Lisboa,Portugal,2267057,https://ror.org/01c27hj86,
,https://ror.org/05afnvy09,Centro de Linguística*pt,active,education,Universidade de Lisboa Centro de Linguística*pt,Centro de Linguística*pt,CLUL*pt,https://www.clul.ulisboa.pt,,clul.ulisboa.pt,,,,,,0000 0001 2174 850X,0000 0001 2174 850X,,,Lisboa,Portugal,2267057,https://ror.org/01c27hj86,
,https://ror.org/004yecm09,Centro de Literaturas e Culturas Lusófonas e Europeias*pt,active,education,Universidade de Lisboa Centro de Literaturas e Culturas Lusófonas e Europeias*pt,Centro de Literaturas e Culturas Lusófonas e Europeias*pt,CLEPUL*pt,https://clepul.letras.ulisboa.pt,https://pt.wikipedia.org/wiki/Centro_de_Literaturas_e_Culturas_Lus%C3%B3fonas_e_Europeias,clepul.letras.ulisboa.pt,,,,,,0000 0004 5896 0127,0000 0004 5896 0127,,,Lisboa,Portugal,2267057,https://ror.org/01c27hj86,
,https://ror.org/05hqp1023,Centro de Química Estrutural*pt,active,education,Universidade de Lisboa Centro de Química Estrutural*pt,Centro de Química Estrutural*pt,CQE*pt,https://cqe.tecnico.ulisboa.pt,,cqe.tecnico.ulisboa.pt,,,,,,0000 0004 4903 1318,0000 0004 4903 1318,,,Lisboa,Portugal,2267057,https://ror.org/01c27hj86,
,https://ror.org/00ww2r127,Clínica Universitária de Cardiologia*pt,active,education,Universidade de Lisboa Clínica Universitária de Cardiologia*pt,Clínica Universitária de Cardiologia*pt; University Clinic of Cardiology*en,,https://www.medicina.ulisboa.pt/clinica-universitaria-de-cardiologia,,,,,,,,0000 0004 6471 7852,0000 0004 6471 7852,,,Lisboa,Portugal,2267057,https://ror.org/01c27hj86,
,https://ror.org/02r6xw279,Clínica Universitária de Obstetrícia e Ginecologia*pt,active,education,Universidade de Lisboa Clínica Universitária de Obstetrícia e Ginecologia*pt,Clínica Universitária de Obstetrícia e Ginecologia*pt,,https://www.medicina.ulisboa.pt/clinica-universitaria-de-obstetricia-e-ginecologia,,,,,,,,0000 0004 6416 5453,0000 0004 6416 5453,,,Lisboa,Portugal,2267057,https://ror.org/01c27hj86,
,https://ror.org/03gwskq53,Clínica Universitária de Pneumologia*pt,active,education,Universidade de Lisboa Clínica Universitária de Pneumologia*pt,Clínica Universitária de Pneumologia*pt; University Clinic of Pulmonolog*en,,https://www.medicina.ulisboa.pt/clinica-universitaria-de-pneumologia,,,,,,,,0000 0004 6471 8126,0000 0004 6471 8126,,,Lisboa,Portugal,2267057,https://ror.org/01c27hj86,
,https://ror.org/02zbqp516,Grupo de Física Matemática*pt,active,education,Universidade de Lisboa Grupo de Física Matemática*pt,Grupo de Física Matemática*pt; Group of Mathematical Physics*en,GFM*pt,http://gfm.cii.fc.ul.pt,,gfm.cii.fc.ul.pt,,,,,,0000 0004 5897 0448,0000 0004 5897 0448,,,Lisboa,Portugal,2267057,https://ror.org/01c27hj86,
,https://ror.org/03actwe44,Instituto de Histologia e Biologia do Desenvolvimento*pt,active,education,Universidade de Lisboa Instituto de Histologia e Biologia do Desenvolvimento*pt,Instituto de Histologia e Biologia do Desenvolvimento*pt,,https://www.medicina.ulisboa.pt/instituto-de-histologia-e-biologia-do-desenvolvimento,,,,,,,,0000 0004 0486 7250,0000 0004 0486 7250,,,Lisboa,Portugal,2267057,https://ror.org/01c27hj86,
,https://ror.org/028mw1j46,Universidade de Lisboa Instituto do Oriente*pt,active,education,Universidade de Lisboa Instituto do Oriente*pt,Universidade de Lisboa Instituto do Oriente*pt,ISCSP*pt,https://ioriente.iscsp.ulisboa.pt/index.php/pt/,,,1989,,,,,0000 0001 2116 8724,0000 0001 2116 8724,,,Lisboa,Portugal,2267057,https://ror.org/01c27hj86,
,https://ror.org/05y50ps96,Laboratório de Ergonomia*pt,active,education,Universidade de Lisboa Laboratório de Ergonomia*pt,Laboratório de Ergonomia*pt,ERGOLAB*pt,https://ergolab.fmh.ulisboa.pt,,ergolab.fmh.ulisboa.pt,,,,,,0000 0004 6471 8089,0000 0004 6471 8089,,,Oeiras,Portugal,2265464,https://ror.org/01c27hj86,
,https://ror.org/04nhye957,Laboratório de Farmacologia Clínica e Terapêutica*pt,active,education,Universidade de Lisboa Laboratório de Farmacologia Clínica e Terapêutica*pt,Laboratório de Farmacologia Clínica e Terapêutica*pt,,https://www.medicina.ulisboa.pt/laboratorio-de-farmacologia-clinica-e-terapeutica,,,,,,,,0000 0004 6418 1998,0000 0004 6418 1998,,,Lisboa,Portugal,2267057,https://ror.org/01c27hj86,
,https://ror.org/02y82bt96,Laboratório de Genética*pt,active,education,Universidade de Lisboa Laboratório de Genética*pt,Laboratório de Genética*pt,,https://www.medicina.ulisboa.pt/laboratorio-de-genetica,,,,,,,,0000 0004 6418 200X,0000 0004 6418 200X,,,Lisboa,Portugal,2267057,https://ror.org/01c27hj86,
,https://ror.org/00zxx1774,Laboratório de Instrumentação Engenharia Biomédica e Física da Radiação*pt,active,education,Universidade de Lisboa Laboratório de Instrumentação Engenharia Biomédica e Física da Radiação*pt,"Laboratório de Instrumentação Engenharia Biomédica e Física da Radiação*pt; Laboratory for Instrumentation, Biomedical Engineering and Radiation Physics*en",LIBPHYS*pt,https://libphys.pt,,libphys.pt,,,,,,0000 0004 6471 8046,0000 0004 6471 8046,,,Lisboa,Portugal,2267057,https://ror.org/01c27hj86,
,https://ror.org/006p6tf90,Laboratório de Medidas Eléctricas*pt,active,education,Universidade de Lisboa Laboratório de Medidas Eléctricas*pt,Laboratório de Medidas Eléctricas*pt,,https://www.dee.isep.ipp.pt/index.php?page=LabI308,,,,,,,,0000 0004 7664 2181,0000 0004 7664 2181,,,Lisboa,Portugal,2267057,https://ror.org/01c27hj86,
,https://ror.org/0198g6d77,Laboratório de Métodos Matemáticos*pt,active,education,Universidade de Lisboa Laboratório de Métodos Matemáticos*pt,Laboratório de Métodos Matemáticos*pt,,https://labmm.fmh.ulisboa.pt,,labmm.fmh.ulisboa.pt,,,,,,0000 0004 6471 8097,0000 0004 6471 8097,,,Oeiras,Portugal,2265464,https://ror.org/01c27hj86,
,https://ror.org/032v56e13,Laboratório de Microbiologia*pt,active,education,Universidade de Lisboa Laboratório de Microbiologia*pt,Laboratório de Microbiologia*pt,,https://fenix.ciencias.ulisboa.pt/courses/lm-i-2-1973404328526072,,,,,,,,0000 0004 7713 9238,0000 0004 7713 9238,,,Lisboa,Portugal,2267057,https://ror.org/01c27hj86,
,https://ror.org/00h4pdn80,Teoria e História do Direito*pt,active,education,Universidade de Lisboa Teoria e História do Direito*pt,Teoria e História do Direito*pt,THD*pt,https://www.iuris.edu.pt/pt/publicacoes/teoria-e-historia-do-direito/142/,,,,,,,,0000 0004 5897 2128,0000 0004 5897 2128,,,Lisboa,Portugal,2267057,https://ror.org/01c27hj86,
,https://ror.org/00ap6k638,Unidade Tecnológica de Radioesterilização*pt,active,education,Universidade de Lisboa Unidade Tecnológica de Radioesterilização*pt,Unidade Tecnológica de Radioesterilização*pt; Technological Unit for Radiosterilization*en,UTR*pt,http://utr.ctn.tecnico.ulisboa.pt,,utr.ctn.tecnico.ulisboa.pt,,,,,,0000 0004 5927 9763,0000 0004 5927 9763,,,Bobadela,Portugal,8013554,https://ror.org/01c27hj86,
,https://ror.org/021n2yg11,Centro de Ciência Animal e Veterinária*pt,active,education,Universidade de Trás-os-Montes e Alto Douro Centro de Ciência Animal e Veterinária*pt,Centro de Ciência Animal e Veterinária*pt; Animal and Veterinary Research Centre*en,CECAV*pt,https://cecav.pt,,cecav.pt,,,,,,0000 0004 5896 3264,0000 0004 5896 3264,,,Vila Real,Portugal,2732438,https://ror.org/03qc8vh97,
,https://ror.org/03f99ad09,Centro de Investigacao em Quimica do Algarve*pt,active,education,Universidade do Algarve Centro de Investigacao em Quimica do Algarve*pt,Centro de Investigacao em Quimica do Algarve*pt; Algarve Chemistry Research Centre*en,CIQA*pt,https://ciqaualg.wordpress.com,,ciqaualg.wordpress.com,,,,,,0000 0004 8033 6267,0000 0004 8033 6267,,,Faro,Portugal,2268337,https://ror.org/014g34x36,
,https://ror.org/03ppr9618,Centro de Estudos em Direito da União Europeia*pt,active,education,Universidade do Minho Centro de Estudos em Direito da União Europeia*pt,Centro de Estudos em Direito da União Europeia*pt,CEDU*pt,"http://www.cedu.direito.uminho.pt/#:~:text=Centro%20de%20Estudos%20em%20Direito%20da%20Uni%C3%A3o%20Europeia%20%2D%20Universidade%20do%20Minho&text=O%20Centro%20de%20Estudos%20em,iniciativas%20editoriais%2C%20incluindo%20publica%C3%A7%C3%B5es%20peri%C3%B3dicas.",,cedu.direito.uminho.pt,,,,,,0000 0004 5928 1919,0000 0004 5928 1919,,,Braga,Portugal,2742032,https://ror.org/037wpkx04,
,https://ror.org/02yqx2d54,Centro de Estudos Humanísticos*pt,active,education,Universidade do Minho Centro de Estudos Humanísticos*pt,Centro de Estudos Humanísticos*pt,CEHUM*pt,https://cehum.elach.uminho.pt,,cehum.elach.uminho.pt,,,,,,0000 0001 2174 1682,0000 0001 2174 1682,,,Braga,Portugal,2742032,https://ror.org/037wpkx04,
,https://ror.org/02bwcre44,Centro de Investigação em Educação*pt,active,education,Universidade do Minho Centro de Investigação em Educação*pt,Centro de Investigação em Educação*pt,CIED*pt,https://cied.uminho.pt,,cied.uminho.pt,,,,,,0000 0004 0393 778X,0000 0004 0393 778X,,,Braga,Portugal,2742032,https://ror.org/037wpkx04,
,https://ror.org/043zrmk48,Centro de Investigação em Enfermagem*pt,active,education,Universidade do Minho Centro de Investigação em Enfermagem*pt,Centro de Investigação em Enfermagem*pt; Center for Research in Nursing*en,CIENF*pt,https://www.ese.uminho.pt/pt/Investigar/Paginas/cienf.aspx,,,,,,,,0000 0005 0986 8276,0000 0005 0986 8276,,,Braga,Portugal,2742032,https://ror.org/037wpkx04,
,https://ror.org/03116sx88,Centro IDEA*pt,active,education,Universidade do Minho Centro IDEA*pt,Centro IDEA*pt,,https://idea.uminho.pt,,idea.uminho.pt,,,,,,0000 0005 0840 3477,0000 0005 0840 3477,,,Braga,Portugal,2742032,https://ror.org/037wpkx04,
,https://ror.org/02ygkva69,Labbels*pt,active,education,Universidade do Minho Labbels*pt,Labbels*pt,,http://www.labbels.uminho.pt,,labbels.uminho.pt,,,,,,0000 0004 5897 2267,0000 0004 5897 2267,,,Braga,Portugal,2742032,https://ror.org/037wpkx04,
,https://ror.org/04w01dm88,Laboratório de Paisagens Património e Território*pt,active,education,Universidade do Minho Laboratório de Paisagens Património e Território*pt,"Laboratório de Paisagens Património e Território*pt; andscapes, Heritage and Territory Laboratory*en",LAB2PT*pt,https://lab2pt.net,,lab2pt.net,,,,,,0000 0004 5897 1299,0000 0004 5897 1299,,,Guimarães,Portugal,2738752,https://ror.org/037wpkx04,
