html_url,id,names.types.ror_display,status,types,names.types.alias,names.types.label,names.types.acronym,links.type.website,links.type.wikipedia,domains,established,external_ids.type.fundref.all,external_ids.type.fundref.preferred,external_ids.type.grid.all,external_ids.type.grid.preferred,external_ids.type.isni.all,external_ids.type.isni.preferred,external_ids.type.wikidata.all,external_ids.type.wikidata.preferred,city,country,locations.geonames_id,
https://github.com/ror-community/ror-updates/issues/22976,https://ror.org/026hpqj41,Simprints Technology Limited*en,active,nonprofit,Simprints*en,Simprints Technology Limited*en,,https://www.simprints.com,https://en.wikipedia.org/wiki/Simprints,simprints.com,2014,,,,,,,Q55633222,Q55633222,Cambridge,United Kingdom,2653941,
https://github.com/ror-community/ror-updates/issues/22983,https://ror.org/021jtqj22,Weimar University*en,active,education,Weimar Institute*en; Weimar College*en; Weimar Center of Health & Education*en,Weimar University*en,,https://weimar.edu,https://en.wikipedia.org/wiki/Weimar_University,weimar.edu,1978,,,,,0000 0004 0486 2601,0000 0004 0486 2601,Q7980210,Q7980210,"Weimar, CA",United States,5407715,
https://github.com/ror-community/ror-updates/issues/22973,https://ror.org/05xmrvj69,HuisartsenOrganisatie Oost-Gelderland*nl,active,healthcare,Multicenter General Practitioners Organisation*en; Multicenter General Practitioners Organisation 'HuisartsenOrganisatie Oost-Gelderland',HuisartsenOrganisatie Oost-Gelderland*nl,HOOG*nl,https://www.hoogzorg.nl,,hoogzorg.nl,,,,,,,,,,Apeldoorn,The Netherlands,2759705,
https://github.com/ror-community/ror-updates/issues/22995,https://ror.org/01wnq5g69,Micro-Intelligence (China)*en,active,company,微亿*zh; MICRO-I*en,"Micro-Intelligence (China)*en; Micro-Intelligence*en; 微亿智造*zh; 常州微亿智造科技有限公司*zh; Changzhou MICRO-I Co., Ltd.*en",,https://www.microintelligence.com.cn,,micro-i.com.cn; microintelligence.com.cn,2018,,,,,,,,,Changzhou,China,1815454,
https://github.com/ror-community/ror-updates/issues/23938,https://ror.org/02panqy83,National Hospital of Acupuncture*en,active,healthcare,,National Hospital of Acupuncture*en; Bệnh viện Châm cứu Trung ương*vi,NHA*en,https://benhvienchamcuu.com,https://vi.wikipedia.org/wiki/B%E1%BB%87nh_vi%E1%BB%87n_Ch%C3%A2m_c%E1%BB%A9u_Trung_%C6%B0%C6%A1ng,benhvienchamcuu.com,1982,,,,,,,Q61132644,Q61132644,Hanoi,Vietnam,1581130,
https://github.com/ror-community/ror-updates/issues/22998,https://ror.org/05ettq389,Jardin botanique Jean-Marie-Pelt*fr,active,archive,Nancy Botanical Garden*en; Jardin botanique du Montet*fr,Jardin botanique Jean-Marie-Pelt*fr,NCY*fr,https://www.jardinbotaniquedenancy.eu/en/jardin-botanique-jean-marie-pelt,https://fr.wikipedia.org/wiki/Jardin_botanique_Jean-Marie-Pelt,grandnancy.eu; jardinbotaniquedenancy.eu,1976,,,,,,,Q3162424,Q3162424,Nancy,France,2990999,
https://github.com/ror-community/ror-updates/issues/23940,https://ror.org/05ncw0t52,Métropole du Grand Nancy*fr,active,government,Grand Nancy*fr; Urban Community of Greater Nancy*en; Communauté urbaine du Grand Nancy*fr,Métropole du Grand Nancy*fr,,https://www.grandnancy.eu,https://fr.wikipedia.org/wiki/M%C3%A9tropole_du_Grand_Nancy,grandnancy.eu,1996,,,,,0000 0005 1090 9418,0000 0005 1090 9418,Q2989397,Q2989397,Nancy,France,2990999,
https://github.com/ror-community/ror-updates/issues/23939,https://ror.org/05kxdq627,Jardins botaniques du Grand Nancy et de l'Université de Lorraine*fr,active,archive,Conservatory and Botanical Gardens of Nancy*en; Botanical Gardens of Greater Nancy and the University of Lorraine*en; Conservatoire et Jardins botaniques de Nancy*fr,Jardins botaniques du Grand Nancy et de l'Université de Lorraine*fr,JBGNUL*fr,https://www.jardinbotaniquedenancy.eu,https://fr.wikipedia.org/wiki/Jardins_botaniques_du_Grand_Nancy_et_de_l%27Universit%C3%A9_de_Lorraine,jardinbotaniquedenancy.eu,1976,,,,,,,Q2994525,Q2994525,Nancy,France,2990999,
https://github.com/ror-community/ror-updates/issues/23942,https://ror.org/05035yq23,Jardin d’altitude du Haut Chitelet*fr,active,archive,Jardin du Chitelet*fr; Jardin du Haut Chitelet*fr,Jardin d’altitude du Haut Chitelet*fr,,https://www.jardinbotaniquedenancy.eu/jardin-du-haut-chitelet,https://fr.wikipedia.org/wiki/Jardin_d%27altitude_du_Haut_Chitelet,,1969,,,,,,,Q3162440,Q3162440,Xonrupt-Longemer,France,2967263,
https://github.com/ror-community/ror-updates/issues/22999,https://ror.org/001kwz481,European Research Institute for Gas and Energy Innovation*en,active,nonprofit,ERIG European Research Institute for Gas and Energy Innovation*en,European Research Institute for Gas and Energy Innovation*en; ERIG a.i.s.b.l.*en,ERIG*en,https://erig.eu,,erig.eu,,,,,,,,,,Brussels,Belgium,2800866,
https://github.com/ror-community/ror-updates/issues/23000,https://ror.org/05f2bpr74,World Federation of Engineering Organizations*en,active,nonprofit,,World Federation of Engineering Organizations*en; Fédération Mondiale des Organisations d'Ingénieurs*fr,WFEO*en,https://www.wfeo.org,https://fr.wikipedia.org/wiki/World_Federation_of_Engineering_Organizations,wfeo.org,1968,,,,,0000 0001 2289 0989,0000 0001 2289 0989,Q8035715,Q8035715,Paris,France,2988507,
https://github.com/ror-community/ror-updates/issues/23945,https://ror.org/03ybxbt61,Université de Garoua*fr,active,education,,Université de Garoua*fr; University of Garoua*en,,https://univ-garoua.cm,https://fr.wikipedia.org/wiki/Universit%C3%A9_de_Garoua,univ-garoua.cm,2022,,,,,,,Q115681308,Q115681308,Garoua,Cameroon,2231320,
https://github.com/ror-community/ror-updates/issues/23951,https://ror.org/0391zf918,1854 Treaty Authority*en,active,government,1854 Authority*en; Tri-Band Authority*en,1854 Treaty Authority*en,,https://www.1854treatyauthority.org,https://en.wikipedia.org/wiki/1854_Treaty_Authority,1854treatyauthority.org,1988,,,,,,,Q4554894,Q4554894,Duluth,United States,5024719,
https://github.com/ror-community/ror-updates/issues/23952,https://ror.org/00h33x176,Bois Forte Band of Chippewa*en,active,government,Bois Forte Band of Ojibwe*en,Bois Forte Band of Chippewa*en; Zagaakwaandagowininiwag*oj,,https://boisforte.com,https://en.wikipedia.org/wiki/Bois_Forte_Band_of_Chippewa,boisforte.com,,,,,,,,Q4938422,Q4938422,Nett Lake,United States,5039049,
https://github.com/ror-community/ror-updates/issues/23954,https://ror.org/04yvvma51,Grand Portage Band of Lake Superior Chippewa*en,active,government,,Grand Portage Band of Lake Superior Chippewa*en; Gichi-Onigaming*oj,,https://www.grandportageband.com,,grandportageband.com,,,,,,,,Q107220492,Q107220492,Grand Portage,United States,5028525,
https://github.com/ror-community/ror-updates/issues/23955,https://ror.org/04hh72v06,Big Bend National Park*en,active,archive,Big Bend NP*en,Big Bend National Park*en; Parque nacional Big Bend*es,,https://www.nps.gov/bibe,https://en.wikipedia.org/wiki/Big_Bend_National_Park,,1944,,,,,,,Q1427197,Q1427197,Big Bend National Park,United States,5516970,
https://github.com/ror-community/ror-updates/issues/23002,https://ror.org/022tacd25,Engineers Europe*en,active,nonprofit,Fédération Européenne d'Associations Nationales d'Ingénieurs*fr; European Federation of National Engineering Associations*en,Engineers Europe*en,FEANI*fr,https://engineerseurope.com,https://en.wikipedia.org/wiki/Engineers_Europe,engineerseurope.com,1951,,,,,0000 0001 1958 3670,0000 0001 1958 3670,Q1479706,Q1479706,Brussels,Belgium,2800866,
https://github.com/ror-community/ror-updates/issues/23967,https://ror.org/04cq7sd97,Wrangell–St. Elias National Park and Preserve*en,active,archive,Wrangell–Saint Elias National Park*en,Wrangell–St. Elias National Park and Preserve*en,,https://www.nps.gov/wrst,https://en.wikipedia.org/wiki/Wrangell%E2%80%93St._Elias_National_Park_and_Preserve,,1978,,,,,,,Q748597,Q748597,Wrangell-Saint Elias National Park,United States,5878411,
https://github.com/ror-community/ror-updates/issues/23972,https://ror.org/022s3b561,LiveRamp (United States),active,company,"LiveRamp Holdings, Inc.*en; Acxiom Corporation*en; Acxiom Holdings, Inc.*en",LiveRamp (United States); LiveRamp*en,,https://liveramp.com,https://en.wikipedia.org/wiki/LiveRamp,liveramp.com,2011,,,,,,,Q125352505,Q125352505,San Francisco,United States,5391959,
https://github.com/ror-community/ror-updates/issues/23005,https://ror.org/042rbzb83,Geological Survey of Pakistan*en,active,facility,,Geological Survey of Pakistan*en,GSP*en,https://gsp.gov.pk,https://en.wikipedia.org/wiki/Geological_Survey_of_Pakistan,gsp.gov.pk,1947,,,,,0000 0004 0447 1790,0000 0004 0447 1790,Q5535321,Q5535321,Islamabad,Pakistan,1176615,
https://github.com/ror-community/ror-updates/issues/23006,https://ror.org/03kre0g15,Bank of Israel*en,active,government,,Bank of Israel*en; בנק ישראל*he; بنك إسرائيل*ar,BoI*en,https://www.boi.org.il,https://en.wikipedia.org/wiki/Bank_of_Israel,boi.org.il,1954,,,,,0000 0004 0631 1432,0000 0004 0631 1432,Q244411,Q244411,Jerusalem,Israel,281184,
https://github.com/ror-community/ror-updates/issues/23015,https://ror.org/05tq1gt96,"GiMaRIS Research, Inventory & Strategy Solutions (Netherlands)*en",active,company,"GiMaRIS*en; Gittenberger Marine Research, Inventory & Strategy*en; GiMaRIS, Marine Research Inventory & Strategy Solutions*en","GiMaRIS Research, Inventory & Strategy Solutions (Netherlands)*en; GiMaRIS Research, Inventory & Strategy Solutions*en",,https://www.gimaris.com,,gimaris.com,2006,,,,,,,,,Sassenheim,Netherlands,2747751,
https://github.com/ror-community/ror-updates/issues/23976,https://ror.org/03p2edy05,American Society for Nondestructive Testing*en,active,nonprofit; funder,American Industrial Radium and X-Ray Society*en,American Society for Nondestructive Testing*en; American Society for Nondestructive Testing Inc.*en,ASNT*en,https://www.asnt.org,https://en.wikipedia.org/wiki/American_Society_for_Nondestructive_Testing,asnt.org,1941,100022600,100022600,,,0000 0001 2162 1330,0000 0001 2162 1330,Q4745028,Q4745028,"Columbus, OH",United States,4509177,
https://github.com/ror-community/ror-updates/issues/23016,https://ror.org/01fj5k015,ASNT Foundation*en,active,funder,American Society for Nondestructive Testing Foundation*en,ASNT Foundation*en,,https://foundation.asnt.org,,asnt.org,2022,,,,,,,,,Columbus,United States,4509177,
https://github.com/ror-community/ror-updates/issues/23018,https://ror.org/02rg98h11,Centro de Investigaciones Feministas y Estudios de Género*es,active,education,,Centro de Investigaciones Feministas y Estudios de Género*es,CIFEG*es,https://rephip.unr.edu.ar/handle/2133/9014,,cifegunr.com.ar,2008,,,,,,,,,Rosario,Argentina,3838583,
https://github.com/ror-community/ror-updates/issues/23019,https://ror.org/00xjw1x97,Universidad Tecnológica de San Luis Potosí*es,active,education,,Universidad Tecnológica de San Luis Potosí*es,UTSLP*es; UT*es,https://utslp.edu.mx,,utslp.edu.mx,1997,,,,,0000 0004 4674 1111,0000 0004 4674 1111,,,San Luis Potosí,México,8583317,
https://github.com/ror-community/ror-updates/issues/23978,https://ror.org/03jhjmf97,Dewey Data Inc. (United States)*en,active,company,Dewey*en,Dewey Data Inc. (United States)*en; Dewey Data Inc.*en,,https://www.deweydata.io,,deweydata.io,,,,,,,,,,San Diego,United States,5391811,
https://github.com/ror-community/ror-updates/issues/23979,https://ror.org/001dv4j44,Tatta Bio*en,active,nonprofit,,Tatta Bio*en,,https://www.tatta.bio,,tatta.bio,,,,,,,,,,Cambridge,United States,4931972,
https://github.com/ror-community/ror-updates/issues/23980,https://ror.org/002weee54,CHRR at The Ohio State University*en,active,facility,Center for Human Resource Research*en,CHRR at The Ohio State University*en,CHRR*en,https://chrr.osu.edu,,chrr.osu.edu,1965,,,,,,,,,Columbus,United States,4509177,
https://github.com/ror-community/ror-updates/issues/23982,https://ror.org/03gc4br58,"Institut für Ethik, Geschichte und Theorie der Medizin*de",active,education,"Institut für Ethik, Geschichte und Theorie der Medizin der LMU München*de; Institut für Ethik, Geschichte und Theorie der Medizin ist Teil der Medizinischen Fakultät der Ludwig-Maximilians-Universität (LMU) München*de","Institut für Ethik, Geschichte und Theorie der Medizin*de; Institute for the Ethics, History and Theory of Medicine*en",,https://www.egt.med.uni-muenchen.de/index.html,,,1939,,,,,,,,,Munich,Germany,2867714,
https://github.com/ror-community/ror-updates/issues/23984,https://ror.org/03dftj863,Anatomische Anstalt*de,active,education,Anatomische Anstalt der LMU*de; Anatomischen Anstalt München*de; Anatomische Anstalt der Ludwig-Maximilians Universität*de,Anatomische Anstalt*de; Institute of Anatomy*en,,https://www.anatomie.med.uni-muenchen.de/index.html,,,1905,,,,,,,,,Munich,Germany,2867714,
https://github.com/ror-community/ror-updates/issues/23985,https://ror.org/00v8kcx92,Physiologisches Institut*de,active,education,"Physiologisches Institut der Ludwig-Maximilians-Universität München*de; Institute of Physiology, Ludwig-Maximilians University Munich*en",Physiologisches Institut*de; Institute of Physiology*en,,https://www.physiol.med.uni-muenchen.de/index.html,,,,,,,,,,,,Munich,Germany,2867714,
https://github.com/ror-community/ror-updates/issues/23986,https://ror.org/0480tmh03,"Adolf-Butenandt-Institut für Physiologische Chemie, Physikalische Biochemie und Zellbiologie*de",active,education,Adolf-Butenandt-Institut*de; Adolf Butenandt Institute*en,"Adolf-Butenandt-Institut für Physiologische Chemie, Physikalische Biochemie und Zellbiologie*de; Adolf Butenandt Institute of Physiological Chemistry, Physical Biochemistry and Cell Biology*en",ABI*de; ABI*en,https://www.abi.med.uni-muenchen.de,https://de.wikipedia.org/wiki/Adolf-Butenandt-Institut,,,,,,,,,,,Munich,Germany,2867714,
https://github.com/ror-community/ror-updates/issues/23023,https://ror.org/01g04ek95,Choctaw Nation of Oklahoma*en,active,government,Choctaw Nation*en,Choctaw Nation of Oklahoma*en,,https://www.choctawnation.com,https://en.wikipedia.org/wiki/Choctaw_Nation_of_Oklahoma,choctawnation.com,1786,,,,,0000 0005 0779 1658,0000 0005 0779 1658,Q5103726,Q5103726,Durant,United States,4535414,
https://github.com/ror-community/ror-updates/issues/23025,https://ror.org/011tppt04,Tecnológico de Estudios Superiores de San Felipe del Progreso*es,active,education,,Tecnológico de Estudios Superiores de San Felipe del Progreso*es,TESSFP*es,https://tessfp.edomex.gob.mx,,tessfp.edomex.gob.mx,2001,,,,,0000 0004 1770 5437,0000 0004 1770 5437,,,San Felipe del Progreso,México,8582231,
https://github.com/ror-community/ror-updates/issues/23027,https://ror.org/022hvg611,RIKEN Center for Interdisciplinary Theoretical and Mathematical Sciences*en,active,facility,RIKEN Interdisciplinary Theoretical and Mathematical Sciences*en; RIKEN Interdisciplinary Theoretical and Mathematical Sciences Program*en,RIKEN Center for Interdisciplinary Theoretical and Mathematical Sciences*en; 理化学研究所 数理創造研究センター*ja,iTHEMS*en,https://ithems.riken.jp,,ithems.riken.jp,2025,,,,,,,Q54958558,Q54958558,Wako,Japan,1907300,
https://github.com/ror-community/ror-updates/issues/23011,https://ror.org/024c12b08,Government College Asghar Mall Rawalpindi*en,active,education,Govt Graduate college Asghar Mall Rawalpindi*en; Government Post Graduate College*en; Sanatan Dharma High School*en,Government College Asghar Mall Rawalpindi*en; گورنمنٹ گریجوئیٹ کالج اصغر مال، راولپنڈی*ur,,,https://en.wikipedia.org/wiki/Government_College_Asghar_Mall_Rawalpindi,hep.punjab.gov.pk; gpgcam.edu.pk,1913,,,,,,,Q5588720,Q5588720,Rawalpindi,Pakistan,1166993,
https://github.com/ror-community/ror-updates/issues/23029,https://ror.org/040g1y854,Guangdong Laboratory of Artificial Intelligence and Digital Economy (Shenzhen)*en,active,facility,光明实验室*zh; Guangming Laboratory*en,Guangdong Laboratory of Artificial Intelligence and Digital Economy (Shenzhen)*en; 人工智能与数字经济广东省实验室（深圳)*zh,,https://www.gml.ac.cn,,gml.ac.cn,2021,,,,,,,,,"Guangming, Shenzhen, Guangdong Province",China,11876377,
https://github.com/ror-community/ror-updates/issues/23031,https://ror.org/022dbf076,Springboro High School*en,active,education,Springboro City Schools*en; Springboro Schools*en,Springboro High School*en,SHS*en,https://www.springboro.org,https://en.wikipedia.org/wiki/Springboro_High_School,springboro.org,1893,,,,,0000 0004 1279 8443,0000 0004 1279 8443,Q7580812,Q7580812,Springboro,United States,4525304,
https://github.com/ror-community/ror-updates/issues/24075,https://ror.org/00fc2ss05,Badlands National Park*en,active,archive,Badlands NP*en,Badlands National Park*en; Parque nacional Badlands*es,,https://nps.gov/badl,https://en.wikipedia.org/wiki/Badlands_National_Park,,1939,,,,,,,Q306216,Q306216,Badlands National Park,United States,5762546,
https://github.com/ror-community/ror-updates/issues/24076,https://ror.org/05w1d5z06,Keweenaw Bay Indian Community*en,active,government,Keweenaw Bay Indian Community of the L'Anse and Ontonagon Bands of Chippewa Indians*en; L'Anse Indian Reservation*en,Keweenaw Bay Indian Community*en; Gakiiwe'onaning*oj,KBIC*en,https://www.kbic-nsn.gov,https://fy.wikipedia.org/wiki/Keweenaw_Bay_Yndianemienskip_fan_de_L%27Anse_en_Ontonagon_Troepen_fan_Tsjippewa_Yndianen,kbic-nsn.gov,,,,,,,,Q27825724,Q27825724,Baraga,United States,4984902,
https://github.com/ror-community/ror-updates/issues/24081,https://ror.org/0249qtc86,Tanzania Institute of Accountancy*en,active,education,,Tanzania Institute of Accountancy*en,TIA*en,https://www.tia.ac.tz,,tia.ac.tz,2002,,,,,0000 0004 4665 4448,0000 0004 4665 4448,Q66424102,Q66424102,Dar es Salaam,Tanzania,160263,
https://github.com/ror-community/ror-updates/issues/24084,https://ror.org/04xqc3e23,Northwestern Mindanao State College of Science and Technology*en,active,education,University of Northwestern Mindanao*en; Tangub Agro-Industrial School*en,Northwestern Mindanao State College of Science and Technology*en; Kolehiyong Pampamahalaan sa Agham at Teknolohiya ng Hilaga-Kanluraning Mindanao*tl,UNM*en,https://www.nmsc.edu.ph,https://en.wikipedia.org/wiki/Northwestern_Mindanao_State_College_of_Science_and_Technology,nmsc.edu.ph,1971,,,,,,,Q7060346,Q7060346,Tangub,Philippines,1683116,
https://github.com/ror-community/ror-updates/issues/24058,https://ror.org/00z7xz780,Ministry of Internal Affairs of the Republic of Kazakhstan*en,active,government,Ministry of Internal Affairs of Kazakhstan*en,Ministry of Internal Affairs of the Republic of Kazakhstan*en; Қазақстан Республикасы Ішкі істер министрлігі*kk; Министерство внутренних дел Республики Казахстан*ru,,https://www.gov.kz/memleket/entities/qriim,https://en.wikipedia.org/wiki/Ministry_of_Internal_Affairs_%28Kazakhstan%29,mvd.gov.kz,1992,,,,,0000 0004 4908 249X,0000 0004 4908 249X,Q1620994,Q1620994,Astana,Kazakhstan,1526273,
https://github.com/ror-community/ror-updates/issues/23034,https://ror.org/01vy7ep52,Academy of the National Guard of the Republic of Kazakhstan*en,active,education,Қазақстан Республикасы Ұлттық ұланының Әскери институты*kk; Военный институт Национальной гвардии Республики Казахстан*ru; Қазақстан Республикасы Ішкі істер министрі Ішкі әскерлерінің Жоғары әскери училищесі*kk; Қазақстан Республикасы Ішкі істер министрі Ішкі әскерлерінің Әскери институты*kk; Петропавловское Высшее военное училище Внутренних войск Министерства внутренних дел Республики Казахстан*ru; Военный институт Внутренних войск Министерства внутренних дел Республики Казахстан*ru,Academy of the National Guard of the Republic of Kazakhstan*en; Академия Национальной гвардии Республики Казахстан*ru; Қазақстан Республикасы Ұлттық Ұланның Академиясы*kk,ANG RK*en; АНГ РК*ru; ҚР ҰҰА*kk,https://www.ang.edu.kz,https://kk.wikipedia.org/wiki/%D2%9A%D0%B0%D0%B7%D0%B0%D2%9B%D1%81%D1%82%D0%B0%D0%BD_%D0%A0%D0%B5%D1%81%D0%BF%D1%83%D0%B1%D0%BB%D0%B8%D0%BA%D0%B0%D1%81%D1%8B_%D2%B0%D0%BB%D1%82%D1%82%D1%8B%D2%9B_%D2%B1%D0%BB%D0%B0%D0%BD%D1%8B%D0%BD%D1%8B%D2%A3_%D0%90%D0%BA%D0%B0%D0%B4%D0%B5%D0%BC%D0%B8%D1%8F%D1%81%D1%8B,ang.edu.kz,1997,,,,,0000 0005 2783 2541,0000 0005 2783 2541,Q31194976,Q31194976,Petropavlovsk,Republic of Kazakhstan,1520172,
https://github.com/ror-community/ror-updates/issues/23037,https://ror.org/00k0pfp21,Maharaja Agrasen Himalayan Garhwal University*en,active,education,,Maharaja Agrasen Himalayan Garhwal University*en,MAHGU*en,https://www.hgu.ac.in,https://en.wikipedia.org/wiki/Maharaja_Agrasen_Himalayan_Garhwal_University,hgu.ac.in,2016,,,,,,,Q55394452,Q55394452,Pauri,India,12682591,
https://github.com/ror-community/ror-updates/issues/23039,https://ror.org/03cdjre93,Institute of Hydrogeology and Engineering Geology*en,active,government,Institute of HYDROENGEO*en; HYDROENGEO*en; Gidrogeologiya va injenerlik geologiyasi instituti*uz; Институт гидрогеологии и инженерной геологии*ru,Institute of Hydrogeology and Engineering Geology*en; State Establishment “Institute of Hydrogeology and Engineering Geology”*en; “Gidrogeologiya va injenerlik geologiyasi instituti” davlat muassasasi*uz; Государственное учреждение «Институт гидрогеологии и инженерной геологии»*ru,,https://hydroengeo.uz,,hydroengeo.uz,1960,,,,,,,,,Tashkent,Uzbekistan,1512569,
https://github.com/ror-community/ror-updates/issues/23041,https://ror.org/03shjds31,KNCV TB Plus*en,active,nonprofit; funder,KNCV Tuberculosis Foundation*en; KNCV Tuberculosefonds*nl,KNCV TB Plus*en,KNCV*en,https://www.kncvtbplus.com,,kncvtbc.org; kncvtbplus.com,1903,100008698,100008698,,,0000 0004 0465 7544,0000 0004 0465 7544,Q110069513,Q110069513,The Hague,Netherlands,2747373,
https://github.com/ror-community/ror-updates/issues/23040,https://ror.org/0240bsv43,SIMEC Institute of Technology*en,active,education,,SIMEC Institute of Technology*en,,https://simecinstitute.edu.bd,,simecinstitute.edu.bd,2018,,,,,,,,,Dhaka,Bangladesh,1185241,
https://github.com/ror-community/ror-updates/issues/23064,https://ror.org/044133t28,Akademi Teknik Elektromedik Andakara*en,active,education,ATEM Andakara*en,Akademi Teknik Elektromedik Andakara*en,,https://atemandakara.ac.id,,atemandakara.ac.id,1988,,,,,,,Q109922578,Q109922578,Bekasi,Indonesia,6599302,
https://github.com/ror-community/ror-updates/issues/23048,https://ror.org/00r2ye360,Vitalant Research Institute*en,active,facility,BloodSystems Research Institute*en,Vitalant Research Institute*en,VRI*en,https://research.vitalant.org/Home.aspx,,research.vitalant.org,,,,,,,,,,San Francisco; Denver,United States,5391959; 5419384,
https://github.com/ror-community/ror-updates/issues/23077,https://ror.org/01e536d88,National Higher School of Technology and Engineering Annaba*en,active,education,ENSTI Annaba*fr; National Higher School of Technology and Engineering*en; المدرسة الوطنية العليا للتكنولوجيا والهندسة*ar; École Nationale Supérieure de Technologie et d'Ingénierie*fr,National Higher School of Technology and Engineering Annaba*en; École Nationale Supérieure de Technologie et d'Ingénierie - Annaba*fr; المدرسة الوطنية العليا للتكنولوجيا والهندسة –عنابة*ar,,https://ensti-annaba.dz,,ensti-annaba.dz,2023,,,,,,,,,Annaba,Algeria,2506999,
https://github.com/ror-community/ror-updates/issues/23065,https://ror.org/00a6vph10,Research and Production Center of Microbiology and Virology*en,active,facility,Scientific Production Center for Microbiology and Virology*en; Research and Production Center for Microbiology and Virology*en,Research and Production Center of Microbiology and Virology*en; Микробиология және вирусология ғылыми-өндірістік орталығы*kk; Научно-производственный центр микробиологии и вирусологии*ru,,https://imv-kaz.kz,,imv-kaz.kz,1956,,,,,0000 0004 0606 0856,0000 0004 0606 0856,,,Almaty,Kazakhstan,1526384,
https://github.com/ror-community/ror-updates/issues/24109,https://ror.org/05761st14,China National Knowledge Infrastructure (China),active,company,"Tongfang Knowledge Network Technology Co., Ltd.*en",China National Knowledge Infrastructure (China); 中国知识基础设施工程*zh; China National Knowledge Infrastructure*en,中国知网*zh; CNKI*en,https://cnki.net,https://en.wikipedia.org/wiki/CNKI,cnki.net,1996,,,,,0000 0000 8954 6210,0000 0000 8954 6210,Q12857515,Q12857515,Beijing,China,1816670,
https://github.com/ror-community/ror-updates/issues/23067,https://ror.org/01fwt7148,Gokhale Education Society’s College of Education and Research*en,active,education,Gokhale Education Society's College of Education & Research*en,Gokhale Education Society’s College of Education and Research*en,GESCER*en,https://www.gescer.in,,gescer.in,1970,,,,,,,,,Mumbai,India,1275339,
https://github.com/ror-community/ror-updates/issues/23068,https://ror.org/02wz9mw49,Sekolah Tinggi Teologi Injili Indonesia Yogyakarta*id,active,education,STTII Yogyakarta*id,Sekolah Tinggi Teologi Injili Indonesia Yogyakarta*id,,https://sttii-yogyakarta.vercel.app,,sttii-yogyakarta.vercel.app,2014,,,,,,,Q109911599,Q109911599,Yogyakarta,Indonesia,1621177,
