html_url,id,names.types.ror_display,status,types,names.types.alias,names.types.label,names.types.acronym,links.type.website,links.type.wikipedia,domains,established,external_ids.type.fundref.all,external_ids.type.fundref.preferred,external_ids.type.grid.all,external_ids.type.grid.preferred,external_ids.type.isni.all,external_ids.type.isni.preferred,external_ids.type.wikidata.all,external_ids.type.wikidata.preferred,city,country,locations.geonames_id
https://github.com/ror-community/ror-updates/issues/31549,https://ror.org/058djva95,Université de recherche Paris Sciences et Lettres COMUE*fr,inactive,education,Université de recherche Paris Sciences et Lettres Comue expérimentale*fr,Université de recherche Paris Sciences et Lettres COMUE*fr,,,,,2015,,,,,,,,,Paris,France,2988507
https://github.com/ror-community/ror-updates/issues/28746,https://ror.org/02q03fs23,Ahad Media Digital (Indonesia)*en,active,company,,Ahad Media Digital (Indonesia)*en; Ahad Media Digital*en,,https://ahadmedia.com,,ahadmedia.com,2024,,,,,,,Q139595074,Q139595074,Depok,Indonesia,1645524
https://github.com/ror-community/ror-updates/issues/33941,https://ror.org/05nsysx58,The Periodic Table of Food Initiative*en,active,nonprofit,,The Periodic Table of Food Initiative*en,PTFI*en,https://foodperiodictable.org,,foodperiodictable.org,2021,,,,,,,,,Dallas,United States,4684888
https://github.com/ror-community/ror-updates/issues/33948,https://ror.org/00eyb5m17,Ministry of the Solicitor General*en,active,government,,Ministry of the Solicitor General*en; Ministère du Solliciteur général*fr,,https://ontario.ca/page/ministry-solicitor-general/,https://en.wikipedia.org/wiki/Ministry_of_the_Solicitor_General,,1972,,,,,,,Q7557780,Q7557780,Toronto,Canada,6167865
https://github.com/ror-community/ror-updates/issues/33950,https://ror.org/005yxex58,Correctional Service Canada*en,active,government,Corrections Canada*en,Correctional Service Canada*en; Service correctionel du Canada*fr,CSC*en,https://www.canada.ca/en/correctional-service.html,https://en.wikipedia.org/wiki/Correctional_Service_Canada,,1979,,,,,,,Q3480093,Q3480093,Ottawa,Canada,6094817
https://github.com/ror-community/ror-updates/issues/30053,https://ror.org/02zh77895,Edo State College of Nursing Sciences*en,active,education,Edo State College of Nursing Science*en,Edo State College of Nursing Sciences*en,,https://edocns.edu.ng,,edocns.edu.ng,1977,,,,,,,Q137910260,Q137910260,Benin City,Nigeria,2347283
https://github.com/ror-community/ror-updates/issues/34026,https://ror.org/04c807f09,Fundação de Apoio à Pesquisa*pt,active,nonprofit,Fundação de apoio à Pesquisa - UFG*pt; Fundação de apoio à Pesquisa*pt,Fundação de Apoio à Pesquisa*pt,FUNAPE*pt,https://site.funape.org.br,,funape.org.br,,,,,,0000 0004 0372 3810,0000 0004 0372 3810,Q134306780,Q134306780,Goiânia,Brasil,3462377
https://github.com/ror-community/ror-updates/issues/34072,https://ror.org/00hprb304,KCG College of Technology*en,active,education,National Institute of Technology and Science*en,KCG College of Technology*en; கே. சி. ஜி. தொழில்நுட்பக் கல்லூரி*ta,KCG*en; NITS*en,https://www.kcgcollege.ac.in,https://ta.wikipedia.org/wiki/%E0%AE%95%E0%AF%87._%E0%AE%9A%E0%AE%BF._%E0%AE%9C%E0%AE%BF._%E0%AE%A4%E0%AF%8A%E0%AE%B4%E0%AE%BF%E0%AE%B2%E0%AF%8D%E0%AE%A8%E0%AF%81%E0%AE%9F%E0%AF%8D%E0%AE%AA%E0%AE%95%E0%AF%8D_%E0%AE%95%E0%AE%B2%E0%AF%8D%E0%AE%B2%E0%AF%82%E0%AE%B0%E0%AE%BF,kcgcollege.com;kcgcollege.ac.in,1998,,,,,0000 0004 1784 8200,0000 0004 1784 8200,Q6326776,Q6326776,Chennai,India,1264527
https://github.com/ror-community/ror-updates/issues/33333,https://ror.org/01hzkwm11,Educational Research Organisation*en,active,government,,Educational Research Organisation*en; Foras Taighde ar Oideachas*ga,ERC*en,https://www.erc.ie,,erc.ie,1966,,,,,,,,,Dublin,Ireland,2964574
https://github.com/ror-community/ror-updates/issues/33977,https://ror.org/0559yn632,Yanbu English Language and Preparatory Year Institute*en,active,education,معهد ينبع للغة الإنجليزية والسنة التحضيرية*ar,Yanbu English Language and Preparatory Year Institute*en,YELI*en,https://rcjy.edu.sa/en/colleges-and-institutes-in-yanbu/yanbu-english-language-institute,,,1985,,,,,,,,,Yanbu,Saudi Arabia,100425
https://github.com/ror-community/ror-updates/issues/33984,https://ror.org/02x596q83,Kerala State Disaster Management Authority*en,active,government,,Kerala State Disaster Management Authority*en,KSDMA*en,https://sdma.kerala.gov.in,,kerala.gov.in,2007,,,,,,,,,Thiruvananthapuram,India,1254163
https://github.com/ror-community/ror-updates/issues/34212,https://ror.org/033n52c61,Mili University*en,active,education,Mili Institute of Higher Education*en,Mili University*en; ملي پوهنتون*ps,,https://www.mili.edu.af,,mili.edu.af,2012,,,,,,,Q139762202,Q139762202,Kabul,Afghanistan,1138958
https://github.com/ror-community/ror-updates/issues/34211,https://ror.org/05jcsht27,Alisher Navoi State Literature Museum*en,active,archive,Alisher Navoi State Museum of Literature*en; Alisher Navoi Literature Museum*en; O'zR FA Alisher Navoiy nomidagi Davlat adabiyot muzeyi*uz,Alisher Navoi State Literature Museum*en; Государственный музей литературы имени Алишера Навои*ru; O'zbekiston Respublikasi Fanlar akademiyasi Alisher Navoiy nomidagi Davlat adabiyot muzeyi*uz,,https://navoimuseum.uz,https://en.wikipedia.org/wiki/The_Alisher_Navoi_State_Museum_of_Literature,navoimuseum.uz,1947,,,,,0000 0001 2174 1981,0000 0001 2174 1981,Q19614593,Q19614593,Tashkent,Uzbekistan,1512569
https://github.com/ror-community/ror-updates/issues/34210,https://ror.org/02tzzd284,Colegio de Chihuahua*es,active,education,El Colegio de Chihuahua*es; El Colech*es,Colegio de Chihuahua*es; College of Chihuahua*en,,https://www.colech.edu.mx,,colech.edu.mx,2005,,,,,0000 0000 9995 2044,0000 0000 9995 2044,Q5640316,Q5640316,Ciudad Juárez,Mexico,4013708
https://github.com/ror-community/ror-updates/issues/34186,https://ror.org/01pzaz860,Society for Evidence-Based Gender Medicine*en,active,nonprofit,,Society for Evidence-Based Gender Medicine*en,SEGM*en,https://segm.org,https://en.wikipedia.org/wiki/Society_for_Evidence-Based_Gender_Medicine,segm.org,2019,,,,,0000 0005 0232 1112,0000 0005 0232 1112,Q113715335,Q113715335,Twin Falls,United States,5610810
https://github.com/ror-community/ror-updates/issues/34181,https://ror.org/00fqs9036,Sharif Medical and Dental College*en,active,education,Sharif Medical & Dental College*en; Sharif Medical City*en,Sharif Medical and Dental College*en; شریف میڈیکل اینڈ ڈینٹل کالج*ur,SMDC*en,https://sharifmedicalcity.org,https://en.wikipedia.org/wiki/Sharif_Medical_and_Dental_College,sharifmedicalcity.org,2008,,,,,,,Q7489670,Q7489670,Lahore,Pakistan,1172451
https://github.com/ror-community/ror-updates/issues/34200,https://ror.org/02b2vzw55,World Professional Association for Transgender Health*en,active,nonprofit,Harry Benjamin International Gender Dysphoria Association*en,World Professional Association for Transgender Health*en,WPATH*en; HBIGDA*en,https://wpath.org,https://en.wikipedia.org/wiki/World_Professional_Association_for_Transgender_Health,wpath.org,1979,,,,,0000 0001 0791 6204,0000 0001 0791 6204,Q2290184,Q2290184,East Dundee,United States,4890486
https://github.com/ror-community/ror-updates/issues/34233,https://ror.org/00dcsjn06,UK Management College*en,active,education,,UK Management College*en,UKMC*en,https://www.ukmc.ac.uk,,ukmc.ac.uk,2016,,,,,0000 0005 2726 9015,0000 0005 2726 9015,Q139782530,Q139782530,Manchester,United Kingdom,2643123
https://github.com/ror-community/ror-updates/issues/33992,https://ror.org/002mdge77,Deutsches Zentrum für Astrophysik*de,active,facility,,Deutsches Zentrum für Astrophysik*de; German Centre for Astrophysics*en,DZA*de,https://www.deutscheszentrumastrophysik.de,https://de.wikipedia.org/wiki/Deutsches_Zentrum_f%C3%BCr_Astrophysik,deutscheszentrumastrophysik.de; dzastro.de,2025,,,,,,,Q118643276,Q118643276,Görlitz,Germany,2918987
https://github.com/ror-community/ror-updates/issues/34000,https://ror.org/02fjza359,Black Forest Biosphere Reserve*en,active,government,,Black Forest Biosphere Reserve*en; Biosphärengebiet Schwarzwald*de,,https://www.biosphaerengebiet-schwarzwald.de,https://als.wikipedia.org/wiki/Biosph%C3%A4rengebiet_Schwarzwald,rpf.bwl.de,2016,,,,,,,Q26271338,Q26271338,Schönau im Schwarzwald,Germand,6558143
https://github.com/ror-community/ror-updates/issues/34013,https://ror.org/01br3ba18,CentroDerm*de,active,healthcare,,CentroDerm*de,,https://www.centroderm.de,,centroderm.de,,,,,,,,,,Wuppertal,Germany,2805753
https://github.com/ror-community/ror-updates/issues/34007,https://ror.org/055tnvn41,Universitas Muhammadiyah Palopo*id,active,education,UM Palopo*id,Universitas Muhammadiyah Palopo*id,,https://umpalopo.ac.id,https://id.wikipedia.org/wiki/Universitas_Muhammadiyah_Palopo,umpalopo.ac.id,2019,,,,,0000 0005 1419 9265,0000 0005 1419 9265,Q109912705,Q109912705,Kota Palopo,Indonesia,1633037
https://github.com/ror-community/ror-updates/issues/34063,https://ror.org/0044faa23,Indian Museum*en,active,archive,Indian Museum Calcutta*en,Indian Museum*en; भारतीय संग्रहालय*hi; ভারতীয় জাদুঘর*bn,IMK*en,https://indianmuseumkolkata.org,https://en.wikipedia.org/wiki/Indian_Museum,indianmuseumkolkata.org,1814,,,,,0000 0001 2375 9659,0000 0001 2375 9659,Q1364900,Q1364900,Kolkata,India,1275004
https://github.com/ror-community/ror-updates/issues/34267,https://ror.org/04c0dmz55,Orutsararmiut Native Council*en,active,government,Orutsararmiut Traditional Native Council*en,Orutsararmiut Native Council*en,ONC*en,https://orutsararmiut.org,https://en.wikipedia.org/wiki/Orutsararmiut_Traditional_Native_Council,nativecouncil.org; orutsararmiut.org,,,,,,,,Q113682092,Q113682092,Bethel,United States,5880568
https://github.com/ror-community/ror-updates/issues/34268,https://ror.org/029km3g17,Alutiiq Museum*en,active,archive,Alutiiq Museum and Archaeological Repository*en,Alutiiq Museum*en,,https://alutiiqmuseum.org,https://en.wikipedia.org/wiki/Alutiiq_Museum,alutiiqmuseum.org,1995,,,,,0000 0001 0437 1069,0000 0001 0437 1069,Q18589167,Q18589167,Kodiak,United States,5866583
https://github.com/ror-community/ror-updates/issues/34270,https://ror.org/00962sr83,International Institute of Management Studies*en,active,education,"International Institute of Management Studies, Pune*en; IIMS Pune*en; एम्स पुणे*mr",International Institute of Management Studies*en; इंटरनॅशनल इन्स्टिट्यूट ऑफ मॅनेजमेंट स्टडीज*mr,IIMS*en,https://iimspune.edu.in,,iimspune.edu.in,2005,,,,,0000 0004 1764 5219,0000 0004 1764 5219,Q139784130,Q139784130,Pune,India,1259229
https://github.com/ror-community/ror-updates/issues/34269,https://ror.org/03d166522,Sree Sevugan Annamalai College*en,active,education,"S.S.A. College, Devakottai*en; SSAC Devakottai*en","Sree Sevugan Annamalai College*en; ஸ்ரீ சேவுகன் அண்ணாமலை கல்லூரி, தேவகோட்டை*ta",SSAC*en,https://sreesevuganannamalaicollege.org.in,https://ta.wikipedia.org/wiki/%E0%AE%9A%E0%AE%BF%E0%AE%B1%E0%AF%80_%E0%AE%9A%E0%AF%87%E0%AE%B5%E0%AF%81%E0%AE%95%E0%AE%A9%E0%AF%8D_%E0%AE%85%E0%AE%A3%E0%AF%8D%E0%AE%A3%E0%AE%BE%E0%AE%AE%E0%AE%B2%E0%AF%88_%E0%AE%95%E0%AE%B2%E0%AF%8D%E0%AE%B2%E0%AF%82%E0%AE%B0%E0%AE%BF,sreesevuganannamalaicollege.org.in,1970,,,,,0000 0004 1768 5771,0000 0004 1768 5771,Q25551559,Q25551559,Devakottai,India,1273128
https://github.com/ror-community/ror-updates/issues/34264,https://ror.org/01g7jaj47,"State Administration of Science, Technology and Industry for National Defense*en",active,government; funder,,"State Administration of Science, Technology and Industry for National Defense*en; 国家国防科技工业局*zh",SASTIND*en,https://www.sastind.gov.cn,https://en.wikipedia.org/wiki/State_Administration_of_Science%2C_Technology_and_Industry_for_National_Defense,sastind.gov.cn,2008,501100010878,501100010878,,,,,Q7603001,Q7603001,Beijing,China,1816670
https://github.com/ror-community/ror-updates/issues/34241,https://ror.org/01j4d3p58,Tribunal de Contas do Estado de Santa Catarina*pt,active,government,Tribunal de Contas de Santa Catarina*pt,Tribunal de Contas do Estado de Santa Catarina*pt; Court of Auditors of Santa Catarina*en; Court of Auditors of the State of Santa Catarina*en,TCE/SC*pt,https://www.tcesc.tc.br,https://pt.wikipedia.org/wiki/Tribunal_de_Contas_do_Estado_de_Santa_Catarina,tcesc.tc.br,1955,,,,,,,Q10384656,Q10384656,Florianópolis,Brasil,3463237
https://github.com/ror-community/ror-updates/issues/34231,https://ror.org/03pec1b52,Institut für Rechtsmedizin der Universität Basel*de,active,education; government,IRM Basel*de,Institut für Rechtsmedizin der Universität Basel*de; Institute of Forensic Medicine of the University of Basel*en,IRM*de,https://www.bs.ch/gd/irm,,,1925,,,,,,,,,Basel,Switzerland,2661604
https://github.com/ror-community/ror-updates/issues/34218,https://ror.org/0411a0y97,Scarborough Health Network Research Institute*en,active,nonprofit,SHN Research Institute*en,Scarborough Health Network Research Institute*en,SHNRI*en,https://www.shn.ca/shn-research-institute,,,2022,,,,,,,,,Toronto,Canada,6167865
https://github.com/ror-community/ror-updates/issues/33270,https://ror.org/05rbj7j43,My Name'5 Doddie Foundation*en,active,nonprofit,My Name'5 Doddie*en,My Name'5 Doddie Foundation*en,,https://www.myname5doddie.co.uk,,myname5doddie.co.uk,2017,,,,,,,,,Edinburgh,United Kingdom,2650225
https://github.com/ror-community/ror-updates/issues/31638,https://ror.org/02bny8r02,Consorcio de Bibliotecas Universitarias de Andalucía (CBUA)*es,active,education,Consorcio de Bibliotecas Universitarias de Andalucía*es,Consorcio de Bibliotecas Universitarias de Andalucía (CBUA)*es,CBUA*es,https://www.cbua.es,,cbua.es,2001,,,,,,,,,Córdoba,España,2519240
https://github.com/ror-community/ror-updates/issues/32759,https://ror.org/00r4ttk04,Ken Walker International University*en,active,education,კენ ვოლკერის საერთაშორისო უნივერსიტეტი*ka,Ken Walker International University*en,KWIU*en,https://kwiu.edu.ge,,kwiu.edu.ge,2019,,,,,,,,,Tbilisi,Georgia,611717
https://github.com/ror-community/ror-updates/issues/34295,https://ror.org/0097d3a24,Uzbekistan National Institute of Musical Art named after Yunus Rajabi*en,active,education,Uzbek National Institute of Music and Arts*en; Institute of Uzbek National Musical Art named after Yunus Rajabi*en; Uzbek National Music Art named after Yunus Rajabi*en; Oʻzbek milliy musiqa sanʼati instituti*uz,Uzbekistan National Institute of Musical Art named after Yunus Rajabi*en; Юнус Раджаби исемендәге Үзбәк милли музыкаль сәнгате институты*tt; Yunus Rajabiy nomidagi Oʻzbek milliy musiqa sanʼati instituti*uz,OʻzMMSI*uz,https://uzmmsi.uz,https://uz.wikipedia.org/wiki/O%CA%BBzbek_milliy_musiqa_san%CA%BCati_instituti,uzmmsi.uz,2020,,,,,,,Q127272707,Q127272707,Tashkent,Uzbekistan,1512569
https://github.com/ror-community/ror-updates/issues/34327,https://ror.org/00akjtr19,Sekolah Tinggi Agama Islam Al Gazali Barru*id,active,education,STAI Al Gazali Barru*id,Sekolah Tinggi Agama Islam Al Gazali Barru*id,,https://stai-barru.ac.id,,stai-barru.ac.id,1996,,,,,,,Q109919315,Q109919315,Kabupaten Barru,Indonesia,1649975
https://github.com/ror-community/ror-updates/issues/34206,https://ror.org/05psn6x24,Pediatric Trauma Society*en,active,nonprofit,,Pediatric Trauma Society*en,PTS*en,https://pediatrictraumasociety.org,,pediatrictraumasociety.org,2011,,,,,,,,,Beverly,United States,4930505
https://github.com/ror-community/ror-updates/issues/34204,https://ror.org/01v231v33,Valhalla Foundation*en,active,nonprofit; funder,Valhalla Charitable Foundation*en,Valhalla Foundation*en,,https://valhalla.org,,valhalla.org,2003,100020463,100020463,,,0000 0005 0973 821X,0000 0005 0973 821X,,,Woodside,United States,5410535
https://github.com/ror-community/ror-updates/issues/34202,https://ror.org/02kczyn17,Nebraska Educational Biomedical Research Association*en,active,nonprofit,,Nebraska Educational Biomedical Research Association*en,NEBRA*en,,,,1990,,,,,,,,,Omaha,United States,5074472
https://github.com/ror-community/ror-updates/issues/34197,https://ror.org/024t28156,The Well Project*en,active,nonprofit,Well Project*en,The Well Project*en,,https://www.thewellproject.org,,thewellproject.org,2002,,,,,,,,,Brooklyn,United States,5110302
https://github.com/ror-community/ror-updates/issues/34196,https://ror.org/03d7a5973,Nebraska Arts Council*en,active,government; funder,,Nebraska Arts Council*en,NAC*en,https://www.artscouncil.nebraska.gov,,artscouncil.nebraska.gov,1974,100014755,100014755,,,0000 0001 2179 387X,0000 0001 2179 387X,Q6984677,Q6984677,Omaha,United States,5074472
https://github.com/ror-community/ror-updates/issues/34102,https://ror.org/01har3c06,Canadian Centre of Recovery Excellence*en,active,government,,Canadian Centre of Recovery Excellence*en,,https://recoveryexcellence.org,,recoveryexcellence.org,2024,,,,,,,,,Calgary,Canada,5913490
https://github.com/ror-community/ror-updates/issues/34114,https://ror.org/02evta315,Scientific Research Institute of Fruit and Tea Growing*en,active,government,Azərbaycan Respublikası Kənd Təsərrüfatı Nazirliyinin Meyvəçilik və Çayçılıq Elmi-Tədqiqat İnstitutu*az; Azərbaycan Elmi-Tədqiqat Bağçılıq və Subtropik Bitkilər İnstitutu*az; Azerbaijan Scientific Research Institute of Horticulture and Subtropical Plants*en,Scientific Research Institute of Fruit and Tea Growing*en; Meyvəçilik və Çayçılıq Elmi-Tədqiqat İnstitutu*az,,https://mceti.az,https://az.wikipedia.org/wiki/Meyv%C9%99%C3%A7ilik_v%C9%99_%C3%87ay%C3%A7%C4%B1l%C4%B1q_Elmi-T%C9%99dqiqat_%C4%B0nstitutu,mceti.az,1926,,,,,,,Q16416498,Q16416498,Zardabi,Azerbaijan,824036
https://github.com/ror-community/ror-updates/issues/34064,https://ror.org/030j0mx51,Terrestrial Ecosystems (Australia)*en,active,company,,Terrestrial Ecosystems (Australia)*en; Terrestrial Ecosystems*en,,https://www.terrestrialecosystems.com,,terrestrialecosystems.com,2002,,,,,,,,,Perth,Australia,2063523
https://github.com/ror-community/ror-updates/issues/34345,https://ror.org/05x332n94,Hawaiʻi Volcanoes National Park*en,active,archive,Hawaii Volcanoes National Park*en; Hawaii Volcanoes NP*en,Hawaiʻi Volcanoes National Park*en; Parque nacional de los Volcanes de Hawái*es,,https://www.nps.gov/havo,https://en.wikipedia.org/wiki/Hawai%CA%BBi_Volcanoes_National_Park,,1916,,,,,0000 0004 1794 4593,0000 0004 1794 4593,Q205952,Q205952,Hawai‘i Volcanoes National Park,United States,5855796
https://github.com/ror-community/ror-updates/issues/34343,https://ror.org/02vbvba93,Abdulkadir Kure University*en,active,education,"AKU Minna*en; College of Education, Minna*en; Niger State College of Education*en",Abdulkadir Kure University*en; Jami'ar Abdulkadir Kure*ha,AKU*en,https://akum.edu.ng,https://en.wikipedia.org/wiki/Abdulkadir_Kure_University,akum.edu.ng,2023,,,,,0000 0000 9837 3390,0000 0000 9837 3390,Q131101560,Q131101560,Minna,Nigeria,2330100
https://github.com/ror-community/ror-updates/issues/33996,https://ror.org/04zpfdp15,Water and Amelioration Scientific Research Institute PLE*en,active,government,Scientific Research Institute of Water and Reclamation*en; Water Reclamation Scientific Research Institute*en,Water and Amelioration Scientific Research Institute PLE*en; Su və Meliorasiya Elmi Tədqiqat İnstitutu*az,WASRI*en,https://www.smeti.az,,smeti.gov.az; smeti.az,2022,,,,,,,,,Baku,Azerbaijan,587084
https://github.com/ror-community/ror-updates/issues/34011,https://ror.org/01qg8nq83,Escuela Superior de Guerra Aérea*es,active,government,Escuela Superior de Guerra Aérea de la Fuerza Aérea del Perú*es,Escuela Superior de Guerra Aérea*es; Higher School of Air Warfare*en,ESFAP*es,https://esfap.edu.pe,https://es.wikipedia.org/wiki/Escuela_Superior_de_Guerra_A%C3%A9rea_(Per%C3%BA),esfap.edu.pe,1946,,,,,0000 0000 9009 6413,0000 0000 9009 6413,Q101208714,Q101208714,Lima,Perú,3936456
https://github.com/ror-community/ror-updates/issues/34038,https://ror.org/01a2s8161,Institute of Molecular Biology*en,active,government,Institute of Molecular Biology and Biotechnologies*en,Institute of Molecular Biology*en; Molekulyar Biologiya Institutu*az,IMB*en,https://imbb.az,,imbb.az,2016,,,,,,,,,Baku,Azerbaijan,587084
https://github.com/ror-community/ror-updates/issues/34065,https://ror.org/053f51657,Interreg Alpenrhein-Bodensee-Hochrhein*de,active,funder,,Interreg Alpenrhein-Bodensee-Hochrhein*de; Interreg Germany-Austria-Switzerland-Liechtenstein*en,ABH*de,https://www.interreg.org,,interreg.org,,,,,,,,,,Tübingen,Germany,2820860
https://github.com/ror-community/ror-updates/issues/34115,https://ror.org/00fef6779,Centre de Recherche sur l'Enseignement de la Mathématique*fr,active,government,,Centre de Recherche sur l'Enseignement de la Mathématique*fr; Research Center on Mathematics Education*en,CREM*fr,https://crem-rdc.com,,crem-rdc.com,1970,,,,,,,,,Kinshasa,DR Congo,2314302
https://github.com/ror-community/ror-updates/issues/32608,https://ror.org/03nb1gj35,21st Century Music Practice Research Centre*en,active,nonprofit,,21st Century Music Practice Research Centre*en,C21MP*en,https://c21mp.org,,c21mp.org,,,,,,,,,,London,UK,2643743
https://github.com/ror-community/ror-updates/issues/34215,https://ror.org/021zc7v39,International Hydrogen Fuel Cell Association*en,active,nonprofit,,International Hydrogen Fuel Cell Association*en; 国际氢能燃料电池协会*zh,IHFCA*en,http://www.ihfca.net,,ihfca.net,2022,,,,,,,,,Beijing,China,1816670
https://github.com/ror-community/ror-updates/issues/34369,https://ror.org/0493eqn45,International American University*en,active,education,"Management Institute of America*en; International American University, Inc.*en",International American University*en,IAULA*en; IAU*en,https://iaula.edu,https://en.wikipedia.org/wiki/International_American_University,iaula.edu,2006,,,,,0000 0004 0469 4361,0000 0004 0469 4361,Q6048168,Q6048168,Los Angeles,United States,5368361
https://github.com/ror-community/ror-updates/issues/34334,https://ror.org/02k1ms293,Rehmatul-lil-Alameen Institute of Cardiology*en,active,government,,Rehmatul-lil-Alameen Institute of Cardiology*en,RAIC*en,https://pessi.punjab.gov.pk/rehmatul_lil_alameen_institute_of_cardiology,,,2011,,,,,,,,,Lahore,Pakistan,1172451
https://github.com/ror-community/ror-updates/issues/34315,https://ror.org/05v33q311,Unité Propre de Recherche et d’Innovation*fr,active,education,,Unité Propre de Recherche et d’Innovation*fr,UPRI*fr,https://univ-avignon.fr/laboratoire/laboratoires-en-sciences-et-agrosciences/unite-propre-de-recherche-et-dinnovation,,,2021,,,,,,,,,Avignon,France,3035681
https://github.com/ror-community/ror-updates/issues/34314,https://ror.org/03rndwg50,Laboratoire de Physiologie Expérimentale Cardiovasculaire*fr,active,education,UPR 4278 LaPEC - Laboratoire de Physiologie Expérimentale Cardiovasculaire*fr; UPR 4278 LaPEC*fr; UPR 4278*fr; LaPEC UPR-4278 - Avignon Université*fr; LaPEC*fr,Laboratoire de Physiologie Expérimentale Cardiovasculaire*fr; Laboratory of Experimental Cardiovascular Physiology*en,,http://lapec.univ-avignon.fr,,lapec.univ-avignon.fr,2021,,,,,,,,,Avignon,France,3035681
https://github.com/ror-community/ror-updates/issues/34313,https://ror.org/000d7xf38,Laboratoire de Mathématiques d'Avignon*fr,active,education,UPR 2151 - Laboratoire de Mathématiques d'Avignon*fr; UPR 2151*fr,Laboratoire de Mathématiques d'Avignon*fr; Avignon Mathematics Laboratory*en,LMA*fr,https://math.univ-avignon.fr,,math.univ-avignon.fr,2013,,,,,,,,,Avignon,France,3035681
https://github.com/ror-community/ror-updates/issues/34312,https://ror.org/01wrrzv62,"Laboratoire Identité Culturelle, Textes et Théâtralité*fr",active,education,"Laboratoire Identités Culturelles, Textes et Théâtralité*fr; UPR 4277 ICTT - Laboratoire Identité Culturelle, Textes et Théâtralité*fr; UPR 4277 ICTT*fr; ICTT - UPR 4277*fr","Laboratoire Identité Culturelle, Textes et Théâtralité*fr; Cultural Identity, Texts and Theatricality Laboratory*en",ICTT*fr,https://ictt.univ-avignon.fr,,ictt.univ-avignon.fr,2008,,,,,,,,,Avignon,France,3035681
https://github.com/ror-community/ror-updates/issues/34311,https://ror.org/05q7mnw87,"Le Laboratoire des sciences Juridiques, Politique, Économiques et de Gestion*fr",active,education,"Laboratoire Biens, Normes, Contrats*fr; UPR 3788 - Laboratoire des sciences juridiques, économiques et de gestion*fr; UPR 3788*fr","Le Laboratoire des sciences Juridiques, Politique, Économiques et de Gestion*fr; Laboratory of Legal, Political, Economic and Management Sciences*en",JPEG*fr,https://univ-avignon.fr/laboratoire/laboratoires-en-sciences-humaines-et-sociales/upr-3788-jpeg-laboratoire-sciences-juridiques-politique-economiques-gestion,,,2023,,,,,,,,,Avignon,France,3035681
https://github.com/ror-community/ror-updates/issues/34282,https://ror.org/036t4vm52,Elmi-Tədqiqat və Statistik İnnovasiyalar Mərkəzi*az,active,government,The Centre of Scientific Research and Statistical Innovations under the State Statistical Committee of the Republic of Azerbaijan*en; Centre of Scientific Research and Statistical Innovations*en,Elmi-Tədqiqat və Statistik İnnovasiyalar Mərkəzi*az; The Centre of Scientific Research and Statistical Innovations*en,ETSIM*az; CSRSI*en,http://www.etsim.azstat.gov.az,,etsim.azstat.gov.az,1992,,,,,,,,,Baku,Azerbaijan,587084
