html_url,id,names.types.ror_display,status,types,names.types.alias,names.types.label,names.types.acronym,links.type.website,links.type.wikipedia,domains,established,external_ids.type.fundref.all,external_ids.type.fundref.preferred,external_ids.type.grid.all,external_ids.type.grid.preferred,external_ids.type.isni.all,external_ids.type.isni.preferred,external_ids.type.wikidata.all,external_ids.type.wikidata.preferred,city,country,locations.geonames_id,NID
,https://ror.org/02spwfy20,Nagoya Tokushukai General Hospital*en,active,healthcare,名古屋徳洲会総合病院*ja,Nagoya Tokushukai General Hospital*en;医療法人徳洲会名古屋徳洲会総合病院*ja,,https://www.nagoya.tokushukai.or.jp,,nagoya.tokushukai.or.jp,,,,,,,,,,Kasugai,Japan,1859891,NID201200889501641
,https://ror.org/03cxavb34,Seirei Yokohama Hospital*en,active,healthcare,聖隷福祉事業団聖隷横浜病院*ja,Seirei Yokohama Hospital*en;社会福祉法人聖隷福祉事業団聖隷横浜病院*ja,,https://www.seirei.or.jp/yokohama/,,,,,,,,,,,,Yokohama,Japan,1848354,NID201200698257939
,https://ror.org/03h5b6q78,Wakkanai City Hospital*en,active,healthcare,,Wakkanai City Hospital*en;市立稚内病院*ja,,https://www.city.wakkanai.hokkaido.jp/hospital/,,,,,,,,,,,,Wakkanai,Japan,2127515,NID201200524682164
,https://ror.org/05cd29s30,Gifu Prefectural Government*en,active,government,,Gifu Prefectural Government*en;岐阜県庁*ja,,https://www.pref.gifu.lg.jp,,pref.gifu.lg.jp,,,,,,,,,,Gifu,Japan,1863641,NID201200860469632
,https://ror.org/031bmh670,Chiba Prefectural Fisheries Research Center*en,active,facility,Chibaken Suisan Sogo Kenkyu Senta*ja;チバケン スイサン ソウゴウ ケンキュウ センター*ja,Chiba Prefectural Fisheries Research Center*en;千葉県水産総合研究センター*ja,,https://www.pref.chiba.lg.jp/lab-suisan/,,,,,,,,,,,,Chiba,Japan,2113015,NID201200749061669
,https://ror.org/02wqt4811,Fukushima Forestry Research Center*en,active,facility,フクシマケン リンギョウ ケンキュウ センター*ja;Fukushimaken Ringyo Kenkyu Senta*ja,Fukushima Forestry Research Center*en;福島県林業研究センター*ja,,https://www.pref.fukushima.lg.jp/sec/37370a/,,,,,,,,,,,,Fukushima,Japan,2112923,NID201200723764537
,https://ror.org/02yedhf35,Shiraumegakuen College*en,active,education,シラウメ ガクエン タンキ ダイガク*ja;Shiraume Gakuen Tanki Daigaku*ja,Shiraumegakuen College*en;白梅学園短期大学*ja,,https://daigaku.shiraume.ac.jp,,daigaku.shiraume.ac.jp,,,,,,,,,,Tokyo,Japan,1850147,NID201200253363518
,https://ror.org/0068d6x78,Aino Hospital*en,active,healthcare,恒昭会藍野病院*ja,Aino Hospital*en;医療法人恒昭会藍野病院*ja,,https://www.koshokai.or.jp/aino/,,,,,,,,,,,,Ibaraki,Japan,1862033,NID201200556509796
,https://ror.org/04hba3q82,Yashima General hospital*en,active,healthcare,,Yashima General hospital*en;JA香川厚生連屋島総合病院*ja,,https://www.yashima-hp.com,,yashima-hp.com,,,,,,,,,,Takamatsu,Japan,1851100,NID201200847390786
,https://ror.org/00beq8h88,Shirakawa Kosei General Hospital*en,active,healthcare,,Shirakawa Kosei General Hospital*en;JA福島厚生連白河厚生総合病院*ja,,https://www.shirakawa-kosei.jp,,shirakawa-kosei.jp,,,,,,,,,,Shirakawa,Japan,11612472,NID201200976825906
,https://ror.org/00p6b0z91,Nippon Koukan Hospital*en,active,healthcare,,Nippon Koukan Hospital*en;医療法人社団こうかん会日本鋼管病院*ja,,https://www.koukankai.or.jp,,koukankai.or.jp,,,,,,,,,,Kawasaki,Japan,1859642,NID201200092632136
,https://ror.org/05j05sz90,Omuta City Hospital*en,active,healthcare,大牟田市立病院*ja,Omuta City Hospital*en;地方独立行政法人大牟田市立病院*ja,,https://www.ghp.omuta.fukuoka.jp,,ghp.omuta.fukuoka.jp,,,,,,,,,,Omuta,Japan,1854083,NID201200575028939
,https://ror.org/02jzg8331,Okinawa Churaumi Aquarium*en,active,archive,Okinawa Churaumi Suizokukan*ja;オキナワ チュラウミ スイゾクカン*ja,Okinawa Churaumi Aquarium*en;沖縄美ら海水族館*ja,,https://churaumi.okinawa,,churaumi.okinawa,,,,,,,,,,Okinawa,Japan,1894616,NID201200682505185
,https://ror.org/03myv4x23,Kumamoto Prefectural Fisheries Research Center*en,active,facility,クマモトケン スイサン ケンキュウ センター*ja;Kumamotoken Suisan Kenkyu Senta*ja,Kumamoto Prefectural Fisheries Research Center*en;熊本県水産研究センター*ja,,https://www.pref.kumamoto.jp/soshiki/95/,,,,,,,,,,,,Kumamoto,Japan,1858421,NID201200932118712
,https://ror.org/01e08v038,Yawatahama City General Hospital*en,active,healthcare,,Yawatahama City General Hospital*en;市立八幡浜総合病院*ja,,https://yawatahama-cgh.jp,,yawatahama-cgh.jp,,,,,,,,,,Yawatahama,Japan,7303003,NID201200602286778
,https://ror.org/02f4g7t12,CARE International Japan*en,active,nonprofit,ケア・インターナショナルジャパン*ja,CARE International Japan*en;公益財団法人ケア・インターナショナルジャパン*ja,,https://www.careintjp.org,,careintjp.org,,,,,,,,,,Tokyo,Japan,1850147,NID201200659694357
,https://ror.org/0414v5413,The Hyogo Institute of Assistive Technology*en,active,facility,ヒョウゴ ケンリツ フクシ ノ マチズクリ ケンキュウジョ*ja;Hyogo Kenritsu Fukushi No Machizukuri Kenkyujo*ja;Hyogo Institute of Assistive Technology*en,The Hyogo Institute of Assistive Technology*en;兵庫県立福祉のまちづくり研究所*ja,,https://assistech.hwc.or.jp,,assistech.hwc.or.jp,,,,,,,,,,Kobe,Japan,1859171,NID201200051724032
,https://ror.org/01e2d5r18,Navitas Clinic*en,active,healthcare,,Navitas Clinic*en;医療法人社団鉄医会ナビタスクリニック*ja,,https://navitasclinic.jp,,navitasclinic.jp,,,,,,,,,,Tokyo,Japan,1850147,NID201200780056455
,https://ror.org/04wwtb809,Ichinomiyanishi Hospital*en,active,healthcare,杏嶺会一宮西病院*ja,Ichinomiyanishi Hospital*en;社会医療法人杏嶺会一宮西病院*ja,,https://www.anzu.or.jp/ichinomiyanishi/,,,,,,,,,,,,Ichinomiya,Japan,1861949,NID201200465844775
,https://ror.org/04xzxak21,The Building Center of Japan*en,active,nonprofit,Building Center of Japan*en;日本建築センター*ja,The Building Center of Japan*en;一般財団法人日本建築センター*ja,,https://www.bcj.or.jp,,bcj.or.jp,,,,,,,,,,Tokyo,Japan,1850147,NID201200732234540
,https://ror.org/04fv0zf35,Shiga Prefecture Agricultural Technology Promotion Center*en,active,facility,シガケン ノウギョウ ギジュツ シンコウ センター*ja;Shigaken Nogyo Gijutsu Shinko Senta*ja,Shiga Prefecture Agricultural Technology Promotion Center*en;滋賀県農業技術振興センター*ja,,https://www.pref.shiga.lg.jp/nougicenter/,,,,,,,,,,,,Omihachiman,Japan,1863451,NID201200831139993
,https://ror.org/033b1bz24,Koto Memorial Hospital*en,active,healthcare,,Koto Memorial Hospital*en;医療法人社団昴会湖東記念病院*ja,,https://www.koto-hp.jp,,koto-hp.jp,,,,,,,,,,Higashiomi,Japan,6822197,NID201200865730188
,https://ror.org/04byjrr35,The Miyagi Prefectural Izunuma-Uchinuma Environmental Foundation*en,active,nonprofit,Miyagi Prefectural Izunuma-Uchinuma Environmental Foundation*en;宮城県伊豆沼・内沼環境保全財団*ja,The Miyagi Prefectural Izunuma-Uchinuma Environmental Foundation*en;公益財団法人宮城県伊豆沼・内沼環境保全財団*ja,,http://izunuma.org,,izunuma.org,,,,,,,,,,Izu,Japan,6822190,NID201200254300543
,https://ror.org/01k0ds106,National Institute for Research Advancement*en,active,nonprofit,総合研究開発機構*ja,National Institute for Research Advancement*en;公益財団法人総合研究開発機構*ja,NIRA*en,https://www.nira.or.jp,,nira.or.jp,,,,,,,,,,Tokyo,Japan,1850147,NID201200759279133
,https://ror.org/04rpc4v21,Hokkaido Prefectural Government*en,active,government,Hokkaidocho*ja;ホッカイドウチョウ*ja,Hokkaido Prefectural Government*en;北海道庁*ja,,https://www.pref.hokkaido.lg.jp/chosha/,,,,,,,,,,,,Sapporo,Japan,2128295,NID201200635255567
,https://ror.org/04ea1wf37,Uonuma kikan Hospital*en,active,healthcare,,Uonuma kikan Hospital*en;新潟大学地域医療教育センター魚沼基幹病院*ja,,https://www.uonuma-kikan-hospital.jp,,uonuma-kikan-hospital.jp,,,,,,,,,,Minamiuonuma,Japan,6825490,NID201200003087592
,https://ror.org/037vd2e78,Mie Prefecture Health and Environment Research Institute*en,active,facility,ミエケン ホケン カンキョウ ケンキュウジョ*ja;Mieken Hoken Kankyo Kenkyujo*ja,Mie Prefecture Health and Environment Research Institute*en;三重県保健環境研究所*ja,,https://www.pref.mie.lg.jp/HOKAN/,,,,,,,,,,,,Yokkaichi,Japan,1848373,NID201200144419351
,https://ror.org/01fk7f614,Gakushuin Women's College*en,active,education,Gakushuin Joshi Daigaku*ja;ガクシュウイン ジョシ ダイガク*ja,Gakushuin Women's College*en;学習院女子大学*ja,,https://www.gwc.gakushuin.ac.jp,,gwc.gakushuin.ac.jp,,,,,,,,,,Tokyo,Japan,1850147,NID201200710630287
,https://ror.org/016yns761,Kyoto Okamoto Memorial Hospital*en,active,healthcare,,Kyoto Okamoto Memorial Hospital*en;社会医療法人岡本病院（財団）京都岡本記念病院*ja,,https://www.okamoto-hp.or.jp/oka2/,,,,,,,,,,,,Kyoto,Japan,1857910,NID201200289326044
,https://ror.org/03bsybc69,Mie Prefectural Shima Hospital*en,active,healthcare,,Mie Prefectural Shima Hospital*en;三重県立志摩病院*ja,,https://kenritsushima.jadecom.or.jp,,kenritsushima.jadecom.or.jp,,,,,,,,,,Shima,Japan,1852481,NID201200592460084
,https://ror.org/04sbmhc14,Nagasaki Agriculture and Forestry Technical Development Center*en,active,facility,Nagasakiken Norin Gijutsu Kaihatsu Senta*ja;ナガサキケン ノウリン ギジュツ カイハツ センター*ja,Nagasaki Agriculture and Forestry Technical Development Center*en;長崎県農林技術開発センター*ja,,https://www.pref.nagasaki.jp/e-nourin/nougi/,,,,,,,,,,,,Isahaya,Japan,1861464,NID201200638917633
,https://ror.org/04r0rzf56,Komazawa Women's Junior College*en,active,education,コマザワ ジョシ タンキ ダイガク*ja;Komazawa Joshi Tanki Daigaku*ja,Komazawa Women's Junior College*en;駒沢女子短期大学*ja,,https://www.komajo.ac.jp,,,,,,,,,,,,Tokyo,Japan,1850147,NID201200510757061
,https://ror.org/02y8cd205,Systems Research & Development Institute of Japan*en,active,facility,日本システム開発研究所*ja;Systems Research and Development Institute of Japan*en,Systems Research & Development Institute of Japan*en;一般財団法人日本システム開発研究所*ja,,https://www.srdi.or.jp,,srdi.or.jp,,,,,,,,,,Tokyo,Japan,1850147,NID201200030054372
,https://ror.org/01xxhmy70,Ibaraki Fisheries Research Institute*en,active,facility,Ibarakiken Suisan Shikenjo*ja;イバラキケン スイサン シケンジョウ*ja,Ibaraki Fisheries Research Institute*en;茨城県水産試験場*ja,,https://www.pref.ibaraki.jp/nourinsuisan/suishi/,,,,,,,,,,,,Mito,Japan,2111901,NID201200815073352
,https://ror.org/01g23ms62,Saitama Agricultural Technology Research Center*en,active,facility,サイタマケン ノウギョウ ギジュツ ケンキュウ センター*ja;Saitamaken Nogyo Gijutsu Kenkyu Senta*ja,Saitama Agricultural Technology Research Center*en;埼玉県農業技術研究センター*ja,,https://www.pref.saitama.lg.jp/soshiki/b0909/,,,,,,,,,,,,Kumagaya,Japan,1858428,NID201200970714558
,https://ror.org/05n9ybf95,Japan Livestock Technology Association*en,active,nonprofit,,Japan Livestock Technology Association*en;公益社団法人畜産技術協会*ja,,https://jlta.jp,,lta.jp,,,,,,,,,,Tokyo,Japan,1850147,NID201200745502799
,https://ror.org/01z528e40,Coastal Development Institute of Technology*en,active,facility,沿岸技術研究センター*ja,Coastal Development Institute of Technology*en;一般財団法人沿岸技術研究センター*ja,,https://www.cdit.or.jp,,cdit.or.jp,,,,,,,,,,Tokyo,Japan,1850147,NID201200981753058
,https://ror.org/04zee8776,International Consortium on Landslides*en,active,nonprofit,,International Consortium on Landslides*en;特定非営利活動法人国際斜斜面災害研究機構*ja,,https://icljp.landslides.org,,icljp.landslides.org,,,,,,,,,,Kyoto,Japan,1857910,NID201200049849329
,https://ror.org/03tw56e23,Akita Fruit-Tree Experiment Station*en,active,facility,アキタケン カジュ シケンジョウ*ja;Akitaken Kaju Shikenjo*ja,Akita Fruit-Tree Experiment Station*en;秋田県果樹試験場*ja,,https://www.pref.akita.lg.jp/pages/genre/13863,,,,,,,,,,,,Yokote,Japan,2110506,NID201200606576077
,https://ror.org/0381yqw52,Fukushima Institute of Public Health*en,active,facility,,Fukushima Institute of Public Health*en;福島県衛生研究所*ja,,https://www.pref.fukushima.lg.jp/sec/21910a/,,,,,,,,,,,,Minamisoma,Japan,2112923,NID201200338868994
,https://ror.org/00pm9ra94,Kumamoto Shinto General Hospital*en,active,healthcare,,Kumamoto Shinto General Hospital*en;医療法人創起会くまもと森都総合病院*ja,,https://www.k-shinto.or.jp,,k-shinto.or.jp,,,,,,,,,,Kumamoto,Japan,1858421,NID201200347570455
,https://ror.org/01vsged97,Ishinkai Yao General Hospital*en,active,healthcare,,Ishinkai Yao General Hospital*en;社会医療法人医真会八尾総合病院*ja,,https://ishinkai.or.jp/hospital/,,,,,,,,,,,,Yao,Japan,1848522,NID201200881904763
,https://ror.org/04jt3r546,Kamagaya General Hospital*en,active,healthcare,,Kamagaya General Hospital*en;社会医療法人社団木下会鎌ケ谷総合病院*ja,,https://www.kamagaya-hp.jp,,kamagaya-hp.jp,,,,,,,,,,Kamagaya,Japan,11611942,NID201200286457518
,https://ror.org/00kpwzc89,Musashino Junior College*en,active,education,,Musashino Junior College*en;武蔵野短期大学*ja,,https://www.musashino.ac.jp/mjc/,,,,,,,,,,,,Sayama,Japan,1907146,NID201200600391481
,https://ror.org/01e4yrb49,Mie Prefectural Government*en,active,government,,Mie Prefectural Government*en;三重県庁*ja,,https://www.pref.mie.lg.jp,,,,,,,,,,,,Tsu,Japan,1849796,NID201200173921205
,https://ror.org/03jmt9g16,Akita Kousei Medical Center*en,active,healthcare,,Akita Kousei Medical Center*en;JA秋田厚生連秋田厚生医療センター*ja,,https://www.akikumihsp.com,,akikumihsp.com,,,,,,,,,,Akita,Japan,2113126,NID201200921383770
,https://ror.org/02jj93j25,Johoku Hospital*en,active,healthcare,,Johoku Hospital*en;公益社団法人石川勤労者医療協会城北病院*ja,,http://jouhoku-hosp.com,,jouhoku-hosp.com,,,,,,,,,,Kanazawa,Japan,1860243,NID201200462885014
,https://ror.org/027qmrv63,Yasuda Women's College*en,active,education,ヤスダ ジョシ タンキ ダイガク*ja;Yasuda Joshi Tanki Daigaku*ja,Yasuda Women's College*en;安田女子短期大学*ja,,https://www.yasuda-u.ac.jp,,,,,,,,,,,,Hiroshima,Japan,1862415,NID201200105099464
,https://ror.org/01xegsd60,Oyokyo Kidney Research Institute*en,active,facility,鷹揚郷腎研究所*ja,Oyokyo Kidney Research Institute*en;公益財団法人鷹揚郷腎研究所*ja,,http://www.oyokyo.jp,,oyokyo.jp,,,,,,,,,,Hirosaki,Japan,2130057,NID201200608766711
,https://ror.org/02ksnjk05,Kyoto City Institute of Health and Environmental Sciences*en,active,facility,キョウトシ エイセイ カンキョウ ケンキュウジョ*ja;Kyotoshi Eisei Kankyo Kenkyujo*ja,Kyoto City Institute of Health and Environmental Sciences*en;京都市衛生環境研究所*ja,,https://www.city.kyoto.lg.jp/menu3/category/41-0-0-0-0-0-0-0-0-0.html,,,,,,,,,,,,Kyoto,Japan,1857910,NID201200989247379
,https://ror.org/020ay5m03,Japan Plant Protection Association*en,active,nonprofit,日本植物防疫協会*ja,Japan Plant Protection Association*en;一般社団法人日本植物防疫協会*ja,,https://www.jppa.or.jp,,jppa.or.jp,,,,,,,,,,Tokyo,Japan,1850147,NID201200692152027
,https://ror.org/01188dy18,Tochigi Prefectural Museum*en,active,archive,Tochigi Kenritsu Hakubutsukan*ja;トチギ ケンリツ ハクブツカン*ja,Tochigi Prefectural Museum*en;栃木県立博物館*ja,,http://www.muse.pref.tochigi.lg.jp,,muse.pref.tochigi.lg.jp,,,,,,,,,,Utsunomiya,Japan,1849053,NID201200864810579
,https://ror.org/049y5v215,Mimihara General Hospital*en,active,healthcare,,Mimihara General Hospital*en;社会医療法人同仁会耳原総合病院*ja,,https://www.mimihara.or.jp/sogo/,,,,,,,,,,,,Sakai,Japan,1853195,NID201200849196243
,https://ror.org/03nc4h531,National Printing Bureau*en,active,government,,National Printing Bureau*en;独立行政法人国立印刷局*ja,,https://www.npb.go.jp,,npb.go.jp,,,,,,,,,,Tokyo,Japan,1850147,NID201200313080847
,https://ror.org/04y31xb63,Center for Better Living*en,active,nonprofit,ベターリビング*ja,Center for Better Living*en;一般財団法人ベターリビング*ja,,https://www.cbl.or.jp,,cbl.or.jp,,,,,,,,,,Tokyo,Japan,1850147,NID201200125861520
,https://ror.org/00396tw82,Kohsei Chuo General Hospital*en,active,healthcare,,Kohsei Chuo General Hospital*en;全国土木建築国民健康保険組合総合病院厚生中央病院*ja,,https://kohseichuo.jp,,kohseichuo.jp,,,,,,,,,,Tokyo,Japan,1850147,NID201200271789273
,https://ror.org/04z4ygh26,Iwate Prefectural Kuji Hospital*en,active,healthcare,,Iwate Prefectural Kuji Hospital*en;岩手県立久慈病院*ja,,https://kuji-hp.com,,kuji-hp.com,,,,,,,,,,Kuji,Japan,2129427,NID201200090779888
,https://ror.org/02c9sby34,Miyagi Prefecture Fisheries Technology Institute*en,active,facility,Miyagiken Suisan Gijutsu Sogo Senta*ja;ミヤギケン スイサン ギジュツ ソウゴウ センター*ja,Miyagi Prefecture Fisheries Technology Institute*en;宮城県水産技術総合センター*ja,,https://www.pref.miyagi.jp/soshiki/mtsc/,,,,,,,,,,,,Ishinomaki,Japan,2112576,NID201200583879505
,https://ror.org/00cvmch98,Tokyo Seitoku College*en,active,education,Tokyo Seitoku Tanki Daigaku*ja;トウキョウ セイトク タンキ ダイガク*ja,Tokyo Seitoku College*en;東京成徳短期大学*ja,,https://www.tsu.ac.jp,,tsu.ac.jp,,,,,,,,,,Tokyo,Japan,1850147,NID201200091697046
,https://ror.org/03rpe7357,Nagano Chuo Hospital*en,active,healthcare,,Nagano Chuo Hospital*en;長野医療生活協同組合長野中央病院*ja,,https://www.nagano-chuo-hospital.jp,,nagano-chuo-hospital.jp,,,,,,,,,,Nagano,Japan,1856215,NID201200221874341
,https://ror.org/00pdqy006,Textile Research Institute of Gunma*en,active,facility,グンマケン センイ コウギョウ シケンジョウ*ja;Gunmaken Sen'I Kogyo Shikenjo*ja,Textile Research Institute of Gunma*en;群馬県繊維工業試験場*ja,,https://www.pref.gunma.jp/soshiki/157/,,,,,,,,,,,,Kiryu,Japan,1859405,NID201200023558238
,https://ror.org/05ptvzg43,Fukushima Prefectural Government*en,active,government,,Fukushima Prefectural Government*en;福島県庁*ja,,https://www.pref.fukushima.lg.jp,,pref.fukushima.lg.jp,,,,,,,,,,Fukushima,Japan,2112923,NID201200819999184
,https://ror.org/01aaq3s61,IVF Namba Clinic*en,active,healthcare,,IVF Namba Clinic*en;医療法人三慧会IVFなんばクリニック*ja,,https://www.ivfnamba.com,,,,,,,,,,,,Osaka,Japan,1853909,NID201200923466101
,https://ror.org/00j9zbm39,Gifu Prefectural Ceramics Research Institute*en,active,facility,Gifuken Seramikkusu Kenkyujo*ja;ギフケン セラミックス ケンキュウジョ*ja,Gifu Prefectural Ceramics Research Institute*en;岐阜県セラミックス研究所*ja,,https://www.ceram.rd.pref.gifu.lg.jp,,ceram.rd.pref.gifu.lg.jp,,,,,,,,,,Tajimi,Japan,1851193,NID201200240614153
,https://ror.org/04mnyr134,Sonoda Women's College*en,active,education,Sonoda Gakuen Joshi Daigaku Tanki Daigakubu*ja;ソノダ ガクエン ジョシ ダイガク タンキ ダイガクブ*ja,Sonoda Women's College*en;園田学園女子大学短期大学部*ja,,https://www.sonoda-u.ac.jp,,sonoda-u.ac.jp,,,,,,,,,,Amagasaki,Japan,1865387,NID201200609446492
,https://ror.org/018wh2466,Japan Food Hygiene Association*en,active,nonprofit,日本食品衛生協会*ja,Japan Food Hygiene Association*en;公益社団法人日本食品衛生協会*ja,,https://www.n-shokuei.jp,,n-shokuei.jp,,,,,,,,,,Tokyo,Japan,1850147,NID201200798750534
,https://ror.org/044fpa022,Suiseikai Kajikawa Hospital*en,active,healthcare,,Suiseikai Kajikawa Hospital*en;医療法人翠清会翠清会梶川病院*ja,,https://www.suiseikai.jp,,suiseikai.jp,,,,,,,,,,Hiroshima,Japan,1862415,NID201200779919079
,https://ror.org/02dkt6479,"National Center for Presons with Severe Intellectual Disabilities, Nozominosono*en",active,facility,,"National Center for Presons with Severe Intellectual Disabilities, Nozominosono*en;独立行政法人国立重度知的障害者総合施設のぞみの園*ja",,https://www.nozomi.go.jp,,nozomi.go.jp,,,,,,,,,,Takasaki,Japan,1851002,NID201200624305729
,https://ror.org/0140wyg37,KKR Takamatsu Hospital*en,active,healthcare,,KKR Takamatsu Hospital*en;国家公務員共済組合連合会KKR高松病院*ja,,https://takamatsu.kkr.or.jp,,takamatsu.kkr.or.jp,,,,,,,,,,Takamatsu,Japan,1851100,NID201200897426444
,https://ror.org/055tbc836,Fondation Maison franco-japonaise*fr,active,nonprofit,Maison Franco-Japonaise (Public Interest Foundation);Maison franco-japonaise*fr,Fondation Maison franco-japonaise*fr;公益財団法人日仏会館*ja,,https://www.fmfj.or.jp,,fmfj.or.jp,,,,,,,,,,Tokyo,Japan,1850147,NID201200969467540
,https://ror.org/01tkga408,Kokugakuin Tochigi Junior College*en,active,education,,Kokugakuin Tochigi Junior College*en;國學院大学栃木短期大学*ja,,https://www.kokugakuintochigi.ac.jp/tandai/,,,,,,,,,,,,Tokyo,Japan,1850147,NID201200487494916
,https://ror.org/02m6br644,Osaka Gyoumeikan Hospital*en,active,healthcare,大阪暁明館大阪暁明館病院*ja,Osaka Gyoumeikan Hospital*en;社会福祉法人大阪暁明館大阪暁明館病院*ja,,https://www.gyoumeikan.or.jp,,gyoumeikan.or.jp,,,,,,,,,,Osaka,Japan,1853909,NID201200841975734
,https://ror.org/04phfvx94,National Sanatorium Tama Zenshoen*en,active,healthcare,コクリツ リョウヨウジョ タマ ゼンショウエン*ja;Kokuritsu Ryoyojo Tama Zenshoen*ja,National Sanatorium Tama Zenshoen*en;国立療養所多磨全生園*ja,,https://www.mhlw.go.jp/seisakunitsuite/bunya/kenkou_iryou/iryou/hansen/zenshoen/,,,,,,,,,,,,Higashimurayama,Japan,7279570,NID201200125015925
,https://ror.org/00c7s9h48,Kyoto Medical Association*en,active,nonprofit,京都府医師会*ja,Kyoto Medical Association*en;一般社団法人京都府医師会*ja,,https://www.kyoto.med.or.jp,,kyoto.med.or.jp,,,,,,,,,,Kyoto,Japan,1857910,NID201200366786163
,https://ror.org/02tqf3106,Nishichita General Hospital*en,active,healthcare,,Nishichita General Hospital*en;公立西知多総合病院*ja,,https://www.nishichita-hp.aichi.jp/,,nishichita-hp.aichi.jp,,,,,,,,,,Tokai,Japan,11612537,NID201200954390910
,https://ror.org/053hfm619,Hayama Heart Center*en,active,healthcare,,Hayama Heart Center*en;特定医療法人沖縄徳洲会葉山ハートセンター*ja,,https://www.hayamaheart.gr.jp,,,,,,,,,,,,Kamakura,Japan,1862992,NID201200904353105
,https://ror.org/00573e884,Nagano Nanshin Agricultural Experiment Station*en,active,facility,Naganoken Nanshin Nogyo Shikenjo*ja;ナガノケン ナンシン ノウギョウ シケンジョウ*ja,Nagano Nanshin Agricultural Experiment Station*en;長野県南信農業試験場*ja,,https://www.pref.nagano.lg.jp/nannoshiken/,,,,,,,,,,,,Takamori,Japan,1851079,NID201200061762013
,https://ror.org/02x6dxy73,Kochi Professional University of Rehabilitation*en,active,education,Kochi Rihabiriteshon Senmonshoku Daigaku*ja;コウチ リハビリテーション センモンショク ダイガク*ja,Kochi Professional University of Rehabilitation*en;高知リハビリテーション専門職大学*ja,,https://kpur.ac.jp,,kpur.ac.jp,,,,,,,,,,Tosa,Japan,1849928,NID201200699219758
,https://ror.org/015d1gt07,Japan Quality Assurance Organization*en,active,nonprofit,日本品質保証機構*ja,Japan Quality Assurance Organization*en;一般財団法人日本品質保証機構*ja,,https://www.jqa.jp,,jqa.jp,,,,,,,,,,Tokyo,Japan,1850147,NID201200048844457
,https://ror.org/0086pzr68,Nanbu Child Medical Center*en,active,healthcare,,Nanbu Child Medical Center*en;沖縄県立南部医療センター・こども医療センター*ja,,https://nanbuweb.hosp.pref.okinawa.jp,,nanbuweb.hosp.pref.okinawa.jp,,,,,,,,,,Okinawa,Japan,1894616,NID201200981472630
,https://ror.org/01gyv0x79,Gifu Prefectural Research Institute for Health and Environmental Sciences*en,active,facility,ギフケン ホケン カンキョウ ケンキュウジョ*ja;Gifuken Hoken Kankyo Kenkyujo*ja,Gifu Prefectural Research Institute for Health and Environmental Sciences*en;岐阜県保健環境研究所*ja,,https://www.health.rd.pref.gifu.lg.jp,,health.rd.pref.gifu.lg.jp,,,,,,,,,,Kakamigahara,Japan,1860735,NID201200585421218
,https://ror.org/03bdrf724,Shimane Prefectural Mountainous Regions Research Center*en,active,facility,シマネケン チュウサンカン チイキ ケンキュウ センター*ja;Shimaneken Chusankan Chiiki Kenkyu Senta*ja,Shimane Prefectural Mountainous Regions Research Center*en;島根県中山間地域研究センター*ja,,https://www.pref.shimane.lg.jp/chusankan/,,,,,,,,,,,,Iinan Chō,Japan,7392555,NID201200582845338
,https://ror.org/00xhy9s30,Toyama International Center*en,active,facility,とやま国際センター*ja,Toyama International Center*en;公益財団法人とやま国際センター*ja,,https://www.tic-toyama.or.jp,,tic-toyama.or.jp,,,,,,,,,,Toyama,Japan,1849876,NID201200606087502
,https://ror.org/05n6vkd45,Miyazaki Prefectural Institute for Public Health and Environment*en,active,facility,Miyazakiken Eisei Kankyo Kenkyujo*ja;ミヤザキケン エイセイ カンキョウ ケンキュウジョ*ja,Miyazaki Prefectural Institute for Public Health and Environment*en;宮崎県衛生環境研究所*ja,,https://www.pref.miyazaki.lg.jp/contents/org/fukushi/eikanken/,,,,,,,,,,,,Miyazaki,Japan,1856717,NID201200917793062
