html_url,id,names.types.ror_display,status,types,names.types.alias,names.types.label,names.types.acronym,links.type.website,links.type.wikipedia,domains,established,external_ids.type.fundref.all,external_ids.type.fundref.preferred,external_ids.type.grid.all,external_ids.type.grid.preferred,external_ids.type.isni.all,external_ids.type.isni.preferred,external_ids.type.wikidata.all,external_ids.type.wikidata.preferred,city,country,locations.geonames_id,NID
,https://ror.org/01y7jk925,Japan Industrial Waste Information Center*en,active,facility,日本産業廃棄物処理振興センター*ja,Japan Industrial Waste Information Center*en;公益財団法人日本産業廃棄物処理振興センター*ja,,https://www.jwnet.or.jp,,jwnet.or.jp,,,,,,,,,,Tokyo,Japan,1850147,NID201200369066998
,https://ror.org/04tqen686,Japan Productivity Center*en,active,facility,日本生産性本部*ja,Japan Productivity Center*en;公益財団法人日本生産性本部*ja,,https://www.jpc-net.jp,,jpc-net.jp,,,,,,,,,,Tokyo,Japan,1850147,NID201200582594362
,https://ror.org/00b51r420,Institute of Radiation Measurements*en,active,facility,放射線計測協会*ja,Institute of Radiation Measurements*en;公益財団法人放射線計測協会*ja,,https://www.irm.or.jp,,irm.or.jp,,,,,,,,,,Tokai,Japan,11612537,NID201200657156729
,https://ror.org/059kpn068,Policy Research Institute for Land Infrastructure and Transport*en,active,facility,コクド コウツウショウ コクド コウツウ セイサク ケンキュウジョ*ja;Kokudo Kotsusho Kokudo Kotsu Seisaku Kenkyujo*ja,Policy Research Institute for Land Infrastructure and Transport*en;国土交通省国土交通政策研究所*ja,,https://www.mlit.go.jp/pri/,,,,,,,,,,,,Tokyo,Japan,1850147,NID201200717748734
,https://ror.org/04vgz7238,Akita Prefecture Forestry Research and Training Center*en,active,facility,アキタケン リンギョウ ケンキュウ ケンシュウ センター*ja;Akitaken Ringyo Kenkyu Kenshu Senta*ja,Akita Prefecture Forestry Research and Training Center*en;秋田県林業研究研修センター*ja,,https://www.mapion.co.jp/phonebook/M16006/05201/20530087845/,,,,,,,,,,,,Akita,Japan,2113126,NID201200208633912
,https://ror.org/0510mg863,Reiwa Health Scienses University*en,active,education,,Reiwa Health Scienses University*en;令和健康科学大学*ja,,https://www.rhs-u.ac.jp,,rhs-u.ac.jp,,,,,,,,,,Fukuoka,Japan,1863967,NID201200353038057
,https://ror.org/023r10y33,Japan Grassland Agriculture and Forage Seed Association*en,active,nonprofit,日本草地畜産種子協会*ja,Japan Grassland Agriculture and Forage Seed Association*en;一般社団法人日本草地畜産種子協会*ja,,https://souchi.lin.gr.jp,,souchi.lin.gr.jp,,,,,,,,,,Tokyo,Japan,1850147,NID201200427124651
,https://ror.org/03wz4p175,The Japan Welding Engineering Society*en,active,nonprofit,日本溶接協会*ja;Japan Welding Engineering Society*en,The Japan Welding Engineering Society*en;一般社団法人日本溶接協会*ja,JWES*en,https://www.jwes.or.jp,,jwes.or.jp,,,,,,,,,,Tokyo,Japan,1850147,NID201200057531641
,https://ror.org/04dq3z287,Iwamizawa Asuka Hospital*en,active,healthcare,,Iwamizawa Asuka Hospital*en;岩見沢明日佳病院*ja,,https://asuka-gp.or.jp/iwamizawa/,,,,,,,,,,,,Iwamizawa,Japan,2129870,NID201200402030784
,https://ror.org/05h6tzw52,Yamagata Promotional Organization for Industrial Technology*en,active,nonprofit,山形県産業技術振興機構*ja,Yamagata Promotional Organization for Industrial Technology*en;公益財団法人山形県産業技術振興機構*ja,,http://www.ynet.or.jp,,ynet.or.jp,,,,,,,,,,Yamagata,Japan,2110556,NID201200849165058
,https://ror.org/03pxeg974,Ishikawa Insect Museum*en,active,archive,イシカワケン フレアイ コンチュウカン*ja;Ishikawaken Fureai Konchukan*ja,Ishikawa Insect Museum*en;石川県ふれあい昆虫館*ja,,https://www.furekon.jp,,furekon.jp,,,,,,,,,,Hakusan,Japan,7467881,NID201200601568815
,https://ror.org/035f5kg94,Teikyo Gakuen Junior College*en,active,education,Teikyo Gakuen Tanki Daigaku*ja;テイキョウ ガクエン タンキ ダイガク*ja,Teikyo Gakuen Junior College*en;帝京学園短期大学*ja,,https://teikyo-gjc.ac.jp,,teikyo-gjc.ac.jp,,,,,,,,,,Yamanashi,Japan,1848648,NID201200229323607
,https://ror.org/04txrm941,Japanese Association of Medical Technologists*en,active,nonprofit,日本臨床衛生検査技師会*ja,Japanese Association of Medical Technologists*en;一般社団法人日本臨床衛生検査技師会*ja,,https://www.jamt.or.jp,,jamt.or.jp,,,,,,,,,,Tokyo,Japan,1850147,NID201200782998654
,https://ror.org/01w1yrw69,Fuel Cell Cutting-Edge Research Center Technology Research Association*en,active,facility,,Fuel Cell Cutting-Edge Research Center Technology Research Association*en;技術研究組合FC-Cubic*ja,,https://www.fc-cubic.or.jp,,fc-cubic.or.jp,,,,,,,,,,Kofu,Japan,1859100,NID201200713217270
,https://ror.org/01t7rrn64,Niigata Industrial Creation Organization*en,active,nonprofit,にいがた産業創造機構*ja,Niigata Industrial Creation Organization*en;公益財団法人にいがた産業創造機構*ja,,https://www.nico.or.jp,,nico.or.jp,,,,,,,,,,Niigata,Japan,1855431,NID201200818278251
,https://ror.org/03r4yvq42,Wagyu Registry Association*en,active,nonprofit,全国和牛登録協会*ja,Wagyu Registry Association*en;公益社団法人全国和牛登録協会*ja,,http://cus4.zwtk.or.jp,,cus4.zwtk.or.jp,,,,,,,,,,Kyoto,Japan,1857910,NID201200283911442
,https://ror.org/02v9z1h82,Manufacturing Technology Association of Biologics*en,active,nonprofit,,Manufacturing Technology Association of Biologics*en;次世代バイオ医薬品製造技術研究組合*ja,,https://cho-mab.or.jp,,cho-mab.or.jp,,,,,,,,,,Tokyo,Japan,1850147,NID201200985643173
,https://ror.org/032f2kz07,Micromachine Center*en,active,nonprofit,マイクロマシンセンター*ja,Micromachine Center*en;一般財団法人マイクロマシンセンター*ja,,http://www.mmc.or.jp,,mmc.or.jp,,,,,,,,,,Tokyo,Japan,1850147,NID201200921393434
,https://ror.org/01v7ahx52,Water Re-use Promotion Center*en,active,nonprofit,造水促進センター*ja,Water Re-use Promotion Center*en;一般財団法人造水促進センター*ja,,http://www.wrpc.jp,,wrpc.jp,,,,,,,,,,Tokyo,Japan,1850147,NID201200781069001
,https://ror.org/04z8fv018,The Mushroom Research Institute of Japan*en,active,nonprofit,Mushroom Research Institute of Japan*en;日本きのこ研究所*ja,The Mushroom Research Institute of Japan*en;一般財団法人日本きのこ研究所*ja,,http://www.kinoko.or.jp,,kinoko.or.jp,,,,,,,,,,Kiryu,Japan,1859405,NID201200884762757
,https://ror.org/02srmp066,Suzuki Foundation*en,active,nonprofit,スズキ財団*ja,Suzuki Foundation*en;公益財団法人スズキ財団*ja,,https://www.suzukifound.jp,,suzukifound.jp,,,,,,,,,,Shizuoka,Japan,1851714,NID201200237961750
,https://ror.org/05vf68943,Niigata Seiryo WOMEN'S Junior College*en,active,education,,Niigata Seiryo WOMEN'S Junior College*en;新潟青陵大学短期大学部*ja,,https://www.n-seiryo.ac.jp/faculty/nsujc/,,,,,,,,,,,,Niigata,Japan,1855431,NID201200490910249
,https://ror.org/02e420914,Kashiwazaki General Hospital and Medical Center*en,active,healthcare,柏崎総合医療センター*ja,Kashiwazaki General Hospital and Medical Center*en;JA新潟厚生連柏崎総合医療センター*ja,,https://www.kashiwazaki-ghmc.jp,,kashiwazaki-ghmc.jp,,,,,,,,,,Kashiwazaki,Japan,1859908,NID201200126298345
,https://ror.org/002hy1z05,Japan Hydrographic Association*en,active,nonprofit,日本水路協会*ja,Japan Hydrographic Association*en;一般財団法人日本水路協会*ja,,https://www.jha.or.jp,,jha.or.jp,,,,,,,,,,Tokyo,Japan,1850147,NID201200738802435
,https://ror.org/040cqjs91,New Technology Foundation*en,active,nonprofit,ニューテクノロジー振興財団*ja,New Technology Foundation*en;公益財団法人ニューテクノロジー振興財団*ja,,https://www.ntf.or.jp/foundation/,,,,,,,,,,,,Tokyo,Japan,1850147,NID201200626386720
,https://ror.org/006pbws28,Japan Seafarers Relief Association*en,active,nonprofit,,Japan Seafarers Relief Association*en;公益社団法人日本海員掖済会*ja,,https://www.ekisaikai.com,,ekisaikai.com,,,,,,,,,,Tokyo,Japan,1850147,NID201200430289691
,https://ror.org/04nhgac81,Jissen Women's Junior College*en,active,education,ジッセン ジョシ ダイガク タンキ ダイガクブ*ja;Jissen Joshi Daigaku Tanki Daigakubu*ja,Jissen Women's Junior College*en;実践女子大学短期大学部*ja,,https://www.jissen.ac.jp/learning/junior_college/,,,,,,,,,,,,Tokyo,Japan,1850147,NID201200904916290
,https://ror.org/05da84g64,SOUSEIKAI Hakata Clinic*en,active,healthcare,相生会博多クリニック*ja,SOUSEIKAI Hakata Clinic*en;医療法人相生会博多クリニック*ja,,https://souseikai-crd.com/service/hakatacl/,,,,,,,,,,,,Fukuoka,Japan,1863967,NID201200041326916
,https://ror.org/04sv18103,The Mathematical Society of Japan*en,active,nonprofit,Mathematical Society of Japan*en;日本数学会*ja,The Mathematical Society of Japan*en;一般社団法人日本数学会*ja,,https://www.mathsoc.jp/publicity/news20100101.html,,,,,,,,,,,,Tokyo,Japan,1850147,NID201200182121656
,https://ror.org/03fxjgq92,Asian Health Institute*en,active,facility,アジア保健研修所*ja,Asian Health Institute*en;公益財団法人アジア保健研修所*ja,,https://ahi-japan.jp,,ahi-japan.jp,,,,,,,,,,Nisshin,Japan,6822209,NID201200889292211
,https://ror.org/04701bc03,Japan Industrial Management Association*en,active,nonprofit,日本経営工学会*ja,Japan Industrial Management Association*en;公益社団法人日本経営工学会*ja,,https://www.jimanet.jp,,jimanet.jp,,,,,,,,,,Tokyo,Japan,1850147,NID201200595232961
,https://ror.org/04250ya65,Sodegaura Satsukidai Hospital*en,active,nonprofit,社団さつき会袖ケ浦さつき台病院*ja,Sodegaura Satsukidai Hospital*en;社会医療法人社団さつき会袖ケ浦さつき台病院*ja,,https://satsuki-kai.or.jp,,satsuki-kai.or.jp,,,,,,,,,,Sodegaura,Japan,11612456,NID201200362269536
,https://ror.org/04x9cdm35,Wakayama Shin-ai University*en,active,education,,Wakayama Shin-ai University*en;和歌山信愛大学*ja,,https://www.wsu.ac.jp,,wsu.ac.jp,,,,,,,,,,Wakayama,Japan,1926004,NID201200879283412
,https://ror.org/00cc2cj67,Japan Cooperation Center Petroleum*en,active,facility,JCCP国際石油・ガス協力機関*ja,Japan Cooperation Center Petroleum*en;一般財団法人JCCP国際石油・ガス協力機関*ja,,https://www.jccp.or.jp,,jccp.or.jp,,,,,,,,,,Tokyo,Japan,1850147,NID201200295095785
,https://ror.org/028mk3t27,Science and Technology Promotion Foundation of Ibaraki*en,active,nonprofit,茨城県科学技術振興財団*ja,Science and Technology Promotion Foundation of Ibaraki*en;一般財団法人茨城県科学技術振興財団*ja,,https://www.i-step.org,,i-step.org,,,,,,,,,,Tsukuba,Japan,2110681,NID201200086102153
,https://ror.org/00dbg3003,Economic Research Association*en,active,nonprofit,経済調査会*ja,Economic Research Association*en;一般財団法人経済調査会*ja,,https://www.zai-keicho.or.jp,,zai-keicho.or.jp,,,,,,,,,,Tokyo,Japan,1850147,NID201200097313711
,https://ror.org/00fb64e91,Miyazaki Prefectural Industrial Support Foundation*en,active,nonprofit,宮崎県産業振興機構*ja,Miyazaki Prefectural Industrial Support Foundation*en;公益財団法人宮崎県産業振興機構*ja,,https://www.mepo.or.jp,,mepo.or.jp,,,,,,,,,,Miyazaki,Japan,1856717,NID201200747212384
,https://ror.org/05yc82y16,Kamma Memorial Hospital*en,active,healthcare,博愛会菅間記念病院*ja,Kamma Memorial Hospital*en;社会医療法人博愛会菅間記念病院*ja,,https://www.hakuai.or.jp/kamma/,,,,,,,,,,,,Nasushiobara,Japan,6822174,NID201200545780986
,https://ror.org/02nc1mn78,The Japanese Society of Nutrition and Dietetics*en,active,nonprofit,日本栄養改善学会*ja;Japanese Society of Nutrition and Dietetics*en,The Japanese Society of Nutrition and Dietetics*en;特定非営利活動法人日本栄養改善学会*ja,,https://jsnd.jp,,jsnd.jp,,,,,,,,,,Tokyo,Japan,1850147,NID201200913877296
,https://ror.org/05jjkap67,Institute for Information and Communications Policy*en,active,facility,,Institute for Information and Communications Policy*en;総務省情報通信政策研究所*ja,,https://www.soumu.go.jp,,soumu.go.jp,,,,,,,,,,Tokyo,Japan,1850147,NID201200555447785
,https://ror.org/00ga49p33,Nagano Prefectural Police*en,active,government,,Nagano Prefectural Police*en;長野県警察*ja,,https://www.pref.nagano.lg.jp/police/,,,,,,,,,,,,Nagano,Japan,1856215,NID201200226122746
,https://ror.org/00ee9rw54,The Society of Non-Traditional Technology*en,active,nonprofit,Society of Non-Traditional Technology*en;未踏科学技術協会*ja,The Society of Non-Traditional Technology*en;一般社団法人未踏科学技術協会*ja,,,,,,,,,,,,,,Tokyo,Japan,1850147,NID201200792257158
,https://ror.org/00phkb172,Arts Flanders Japan*en,active,nonprofit,Flanders Center*en;フランダースセンター*ja,Arts Flanders Japan*en; 公益財団法人フランダースセンター*ja,,http://www.flanders.jp,,flanders.jp,,,,,,,,,,Tokyo,Japan,1850147,NID201200456690404
,https://ror.org/05dnvsb41,Chemical Materials Evaluation and Research Base*en,active,nonprofit,,Chemical Materials Evaluation and Research Base*en;次世代化学材料評価技術研究組合*ja,,,,,,,,,,,,,,Tsukuba,Japan,2110681,NID201200087645291
,https://ror.org/01srz1t22,Research and Training Institute of the Ministry of Justice*en,active,facility,,Research and Training Institute of the Ministry of Justice*en;法務省法務総合研究所*ja,,https://www.moj.go.jp/housouken/houso_index.html,,,,,,,,,,,,Tokyo,Japan,1850147,NID201200899620464
,https://ror.org/02nf82x34,Kagoshima Prefectural Institute for Environmental Research and Public Health*en,active,facility,Kagoshimaken Kankyo Hoken Senta*ja;カゴシマケン カンキョウ ホケン センター*ja,Kagoshima Prefectural Institute for Environmental Research and Public Health*en;鹿児島県環境保健センター*ja,,https://www.pref.kagoshima.jp/kurashi-kankyo/kankyo/kankyohoken/index.html,,,,,,,,,,,,Kagoshima,Japan,1860827,NID201200628955342
,https://ror.org/05vvex219,Kamakura Women's Junior College*en,active,education,,Kamakura Women's Junior College*en;鎌倉女子大学短期大学部*ja,,https://www.kamakura-u.ac.jp,,kamakura-u.ac.jp,,,,,,,,,,Kamakura,Japan,1860672,NID201200038288504
,https://ror.org/04xzp4624,Josai Junior College*en,active,education,Josai Tanki Daigaku*ja;ジョウサイ タンキ ダイガク*ja,Josai Junior College*en;城西短期大学*ja,,https://www.josai.ac.jp/college/,,,,,,,,,,,,Sakado,Japan,1853209,NID201200645100264
,https://ror.org/02f7src36,Sainokuni Higashiomiya Medical Center*en,active,healthcare,,Sainokuni Higashiomiya Medical Center*en;医療法人社団協友会彩の国東大宮メディカルセンター*ja,,https://www.shmc.jp,,shmc.jp,,,,,,,,,,Saitama,Japan,6940394,NID201200626458337
,https://ror.org/03t988a77,Japan Food Industry Center*en,active,facility,食品産業センター*ja,Japan Food Industry Center*en;一般財団法人食品産業センター*ja,,https://www.shokusan.or.jp,,shokusan.or.jp,,,,,,,,,,Tokyo,Japan,1850147,NID201200087062834
,https://ror.org/05qxhp197,The Japanese Respiratory Society*en,active,nonprofit,Japanese Respiratory Society*en;日本呼吸器学会*ja,The Japanese Respiratory Society*en;一般社団法人日本呼吸器学会*ja,,https://www.jrs.or.jp,,jrs.or.jp,,,,,,,,,,Tokyo,Japan,1850147,NID201200209176083
,https://ror.org/02gtc5h12,Japan Medical Women's Association*en,active,nonprofit,日本女医会*ja,Japan Medical Women's Association*en;公益社団法人日本女医会*ja,,https://www.jmwa.or.jp,,jmwa.or.jp,,,,,,,,,,Tokyo,Japan,1850147,NID201200173443417
,https://ror.org/01m316d02,"Center for Reproductive Medicine and Implantation Research, Sugiyama Clinic*en",active,facility,,"Center for Reproductive Medicine and Implantation Research, Sugiyama Clinic*en;杉山産婦人科*ja",,https://www.sugiyama.or.jp,,sugiyama.or.jp,,,,,,,,,,Tokyo,Japan,1850147,NID201200568034040
,https://ror.org/03vsze143,Niigata Prefectural Inland Water Fisheries Experiment Station*en,active,facility,Niigataken Naisuimen Suisan Shikenjo*ja;ニイガタケン ナイスイメン スイサン シケンジョウ*ja,Niigata Prefectural Inland Water Fisheries Experiment Station*en;新潟県内水面水産試験場*ja,,https://www.pref.niigata.lg.jp/site/naisuimen/,,,,,,,,,,,,Nagaoka,Japan,1856199,NID201200121574011
,https://ror.org/03egn3336,Aomori Prefectural Public Health and Environment Center*en,active,facility,Aomoriken Kankyo Hoken Senta*ja;アオモリケン カンキョウ ホケン センター*ja,Aomori Prefectural Public Health and Environment Center*en;青森県環境保健センター*ja,,https://www.pref.aomori.lg.jp/soshiki/kenko/eisei/center-home.html,,,,,,,,,,,,Aomori,Japan,2130658,NID201200451248868
,https://ror.org/05y7et149,Nara Prefectural Pharmaceutical Research Center*en,active,facility,,Nara Prefectural Pharmaceutical Research Center*en;奈良県薬事研究センター*ja,,https://www.pref.nara.jp/1744.htm,,,,,,,,,,,,Nara,Japan,1855612,NID201200842525095
,https://ror.org/033r5zc58,Kumiai Kousei Hospital*en,active,healthcare,久美愛厚生病院*ja,Kumiai Kousei Hospital*en;JA岐阜厚生連久美愛厚生病院*ja,,http://www.kumiai.gfkosei.or.jp,,kumiai.gfkosei.or.jp,,,,,,,,,,Takayama,Japan,1850892,NID201200834368518
,https://ror.org/02zgfrv63,Kyoto Interdisciplinary Institute of Community Medicine*en,active,facility,京都地域医療学際研究所*ja,Kyoto Interdisciplinary Institute of Community Medicine*en;一般財団法人京都地域医療学際研究所*ja,,https://gakusai.or.jp,,gakusai.or.jp,,,,,,,,,,Kyoto,Japan,1857910,NID201200249410189
,https://ror.org/03528cg63,Japan AeroSpace Technology Foundation*en,active,nonprofit,航空宇宙技術振興財団*ja,Japan AeroSpace Technology Foundation*en;一般財団法人航空宇宙技術振興財団*ja,,https://www.f-jast.or.jp,,f-jast.or.jp,,,,,,,,,,Sendai,Japan,2111149,NID201200241337897
,https://ror.org/03crfce94,Livestock Industry's Environmental Improvement Organization*en,active,nonprofit,畜産環境整備機構*ja,Livestock Industry's Environmental Improvement Organization*en;一般財団法人畜産環境整備機構*ja,,https://www.leio.or.jp,,leio.or.jp,,,,,,,,,,Tokyo,Japan,1850147,NID201200873225940
,https://ror.org/04zp58p78,Japan Cement Association*en,active,nonprofit,セメント協会*ja,Japan Cement Association*en;一般社団法人セメント協会*ja,,https://www.jcassoc.or.jp,,jcassoc.or.jp,,,,,,,,,,Tokyo,Japan,1850147,NID201200091606811
,https://ror.org/05nksec02,Shirahama Foundation for Health and Welfare*en,active,nonprofit,白浜医療福祉財団*ja,Shirahama Foundation for Health and Welfare*en;公益財団法人白浜医療福祉財団*ja,,https://www.hamayu-hp.or.jp,,hamayu-hp.or.jp,,,,,,,,,,Shirahama,Japan,1851936,NID201200205887134
,https://ror.org/02n9c6w39,Hyogo Health Service Association*en,active,nonprofit,兵庫県予防医学協会*ja,Hyogo Health Service Association*en;公益財団法人兵庫県予防医学協会*ja,,https://hyogo-yobouigaku.or.jp,,hyogo-yobouigaku.or.jp,,,,,,,,,,Kobe,Japan,1859171,NID201200234928132
,https://ror.org/00v5mf634,Hiroshima Community Research Center*en,active,facility,,Hiroshima Community Research Center*en;財団法人広島地域社会研究センター*ja,,,,,,,,,,,,,,Hiroshima,Japan,1862415,NID201200986277627
,https://ror.org/02t8qyv80,Kochi Prefectural Deep Seawater Laboratory*en,active,facility,コウチケン カイヨウ シンソウスイ ケンキュウジョ*ja;Kochiken Kaiyo Shinsosui Kenkyujo*ja,Kochi Prefectural Deep Seawater Laboratory*en;高知県海洋深層水研究所*ja,,https://www.pref.kochi.lg.jp/soshiki/150000/151407/,,,,,,,,,,,,Muroto,Japan,1856389,NID201200627020951
,https://ror.org/022q30y61,Yamanashi Prefectural Police*en,active,government,,Yamanashi Prefectural Police*en;山梨県警察*ja,,https://www.pref.yamanashi.jp/police/,,,,,,,,,,,,Kofu,Japan,1859100,NID201200700071476
,https://ror.org/03v8pkb73,Oita Prefectural Police*en,active,government,,Oita Prefectural Police*en;大分県警察*ja,,https://www.pref.oita.jp/site/keisatu/,,,,,,,,,,,,Ōita,Japan,1854487,NID201200236713495
,https://ror.org/002k0xe08,Sensho-kai Eye Institute*en,active,healthcare,,Sensho-kai Eye Institute*en;医療法人千照会千原眼科医院*ja,,https://www.chihara-ganka.or.jp,,chihara-ganka.or.jp,,,,,,,,,,Uji,Japan,1849372,NID201200416985463
,https://ror.org/0430ewv75,Jyuzen General Hospital*en,active,healthcare,積善会十全総合病院*ja,Jyuzen General Hospital*en;一般財団法人積善会十全総合病院*ja,,https://jyuzen.jp,,jyuzen.jp,,,,,,,,,,Niihama,Japan,1855425,NID201200324840821
,https://ror.org/040mpqc50,Japan Foods Inspection Corporation*en,active,nonprofit,日本食品検査*ja,Japan Foods Inspection Corporation*en;一般財団法人日本食品検査*ja,,https://www.jffic.or.jp,,jffic.or.jp,,,,,,,,,,Tokyo,Japan,1850147,NID201200593878459
,https://ror.org/04rpzaq65,Rural Development Planning Commission*en,active,nonprofit,農村開発企画委員会*ja,Rural Development Planning Commission*en;一般財団法人農村開発企画委員会*ja,,https://www.rdpc.or.jp,,rdpc.or.jp,,,,,,,,,,Tokyo,Japan,1850147,NID201200291902564
,https://ror.org/00kh69w15,Institute Of Geriatric Medicine And Dentistry*en,active,facility,老年歯科医学総合研究所*ja,Institute Of Geriatric Medicine And Dentistry*en;一般財団法人老年歯科医学総合研究所*ja,,https://www.gerodontology.jp,,gerodontology.jp,,,,,,,,,,Tokyo,Japan,1850147,NID201200213512587
,https://ror.org/05jxd4z48,"The Society for Biotechnology, Japan*en",active,nonprofit,"Society for Biotechnology, Japan*en;日本生物工学会*ja","The Society for Biotechnology, Japan*en;公益社団法人日本生物工学会*ja",,https://www.sbj.or.jp,,sbj.or.jp,,,,,,,,,,Suita,Japan,1851482,NID201200181448657
,https://ror.org/05ggcve06,Eikei University Of Hiroshima*en,active,education,,Eikei University Of Hiroshima*en;叡啓大学*ja,,https://www.eikei.ac.jp,,eikei.ac.jp,,,,,,,,,,Hiroshima,Japan,1862415,NID201200732862334
,https://ror.org/04jh8cx24,Professional Institute of International Fashion*en,active,education,Kokusai Fasshon Senmonshoku Daigaku*ja;コクサイ ファッション センモンショク ダイガク*ja,Professional Institute of International Fashion*en;国際ファッション専門職大学*ja,,https://www.piif.ac.jp,,piif.ac.jp,,,,,,,,,,Tokyo,Japan,1850147,NID201200904478653
,https://ror.org/03nyq1252,Nihon Wellness Sports University*en,active,education,,Nihon Wellness Sports University*en;日本ウェルネススポーツ大学*ja,,https://www.nihonwellness.jp,,nihonwellness.jp,,,,,,,,,,Tone,Japan,2110738,NID201200968491670
,https://ror.org/023s81402,The Japanese Red Cross Junior College of Akita*en,active,education,ニホン セキジュウジ アキタ タンキ ダイガク*ja;Nihon Sekijuji Akita Tanki Daigaku*ja;Japanese Red Cross Junior College of Akita*en,The Japanese Red Cross Junior College of Akita*en;日本赤十字秋田短期大学*ja,,https://www.rcakita.ac.jp/department,,,,,,,,,,,,Akita,Japan,2113126,NID201200030026810
,https://ror.org/05bt52s63,Fukui Science Education Academy*en,active,nonprofit,,Fukui Science Education Academy*en;NPO法人ふくい科学学園*ja,,http://www.fukuikagakugakuen.com,,fukuikagakugakuen.com,,,,,,,,,,Fukui,Japan,1863985,NID201200247687633
,https://ror.org/03hp3mw60,Institute of Administrative Management*en,active,facility,行政管理研究センター*ja,Institute of Administrative Management*en;一般財団法人行政管理研究センター*ja,,https://www.iam.or.jp,,iam.or.jp,,,,,,,,,,Tokyo,Japan,1850147,NID201200696501041
,https://ror.org/05r92j264,The Society for Near Eastern Studies in Japan*en,active,nonprofit,Society for Near Eastern Studies in Japan*en;日本オリエント学会*ja,The Society for Near Eastern Studies in Japan*en;一般社団法人日本オリエント学会*ja,,https://www.j-orient.com,,j-orient.com,,,,,,,,,,Tokyo,Japan,1850147,NID201200491688343
,https://ror.org/048jm0g87,PRO Natura Foundation Japan*en,active,nonprofit,自然保護助成基金*ja,PRO Natura Foundation Japan*en;公益財団法人自然保護助成基金*ja,,https://www.pronaturajapan.com,,pronaturajapan.com,,,,,,,,,,Tokyo,Japan,1850147,NID201200473766159
,https://ror.org/0227zyy26,Toyota Regional Medical Center*en,active,healthcare,豊田地域医療センター*ja,Toyota Regional Medical Center*en;公益財団法人豊田地域医療センター*ja,,https://www.toyotachiiki-mc.or.jp,,toyotachiiki-mc.or.jp,,,,,,,,,,Toyota,Japan,1849814,NID201200857835602
,https://ror.org/01y42f538,Japan Canners Association*en,active,nonprofit,日本缶詰びん詰レトルト食品協会*ja,Japan Canners Association*en;公益社団法人日本缶詰びん詰レトルト食品協会*ja,,https://www.jca-can.or.jp,,jca-can.or.jp,,,,,,,,,,Tokyo,Japan,1850147,NID201200541108830
,https://ror.org/032ymr618,Musashimurayama Hospital*en,active,healthcare,,Musashimurayama Hospital*en;社会医療法人財団大和会武蔵村山病院*ja,,https://www.yamatokai.or.jp/musasimurayama/,,,,,,,,,,,,Tokyo,Japan,1850147,NID201200557150632
,https://ror.org/03qhh6685,Vector Magnetic Characteristic Technical Lavoratory*en,active,other,,Vector Magnetic Characteristic Technical Lavoratory*en;ベクトル磁気特性技術研究所*ja,,,,,,,,,,,,,,Hino,Japan,1862599,NID201200142037669
,https://ror.org/01vtvs553,Hokusho Central Hospital*en,active,healthcare,北松中央病院*ja,Hokusho Central Hospital*en;地方独立行政法人北松中央病院*ja,,http://www.hokusho.dr-clinic.jp,,hokusho.dr-clinic.jp,,,,,,,,,,Sasebo,Japan,1852899,NID201200906581537
