html_url,id,names.types.ror_display,status,types,names.types.alias,names.types.label,names.types.acronym,links.type.website,links.type.wikipedia,domains,established,external_ids.type.fundref.all,external_ids.type.fundref.preferred,external_ids.type.grid.all,external_ids.type.grid.preferred,external_ids.type.isni.all,external_ids.type.isni.preferred,external_ids.type.wikidata.all,external_ids.type.wikidata.preferred,city,country,locations.geonames_id,NID
,https://ror.org/05wkg1r24,Yamaguchi Prefectural Fisheries Research Center*en,active,facility,Yamaguchiken Suisan Kenkyu Senta*ja;ヤマグチケン スイサン ケンキュウ センター*ja,Yamaguchi Prefectural Fisheries Research Center*en;山口県水産研究センター*ja,,https://www.pref.yamaguchi.lg.jp/soshiki/125/21871.html,,,,,,,,,,,,Nagato; Yamaguchi,Japan,1899102;1848689,NID201200076792753
,https://ror.org/0244vtq08,Shizuoka Prefectural Research Institute of Fishery*en,active,facility,,Shizuoka Prefectural Research Institute of Fishery*en;静岡県水産・海洋技術研究所*ja,,https://fish-exp.pref.shizuoka.jp,,fish-exp.pref.shizuoka.jp,,,,,,,,,,Yaizu,Japan,1848774,NID201200689298473
,https://ror.org/00gmq0p08,Nara Prefecture Agricultural Research and Development Center*en,active,facility,Naraken Nogyo Kenkyu Kaihatsu Senta*ja;ナラケン ノウギョウ ケンキュウ カイハツ センター*ja,Nara Prefecture Agricultural Research and Development Center*en;奈良県農業研究開発センター*ja,,https://www.pref.nara.jp/1761.htm,,,,,,,,,,,,Sakurai,Japan,1853066,NID201200699630047
,https://ror.org/03edrct07,Hyogo Prefectural Tamba Medical Center*en,active,facility,,Hyogo Prefectural Tamba Medical Center*en;兵庫県立丹波医療センター*ja,,https://tmc.hyogo.jp,,tmc.hyogo.jp,,,,,,,,,,Tanba,Japan,11612482,NID201200323898159
,https://ror.org/04xdag444,Osaka University of Arts Junior College*en,active,education,Osaka Geijutsu Daigaku Tanki Daigakubu*ja;オオサカ ゲイジュツ ダイガク タンキ ダイガクブ*ja,Osaka University of Arts Junior College*en;大阪芸術大学短期大学部*ja,,https://osaka-geitan.jp,,osaka-geitan.jp,,,,,,,,,,Osaka,Japan,1853909,NID201200554287270
,https://ror.org/042q4kf72,Brewing Society of Japan*en,active,nonprofit,日本醸造協会*ja,Brewing Society of Japan*en;公益財団法人日本醸造協会*ja,,https://www.jozo.or.jp,,jozo.or.jp,,,,,,,,,,Tokyo,Japan,1850147,NID201200128697115
,https://ror.org/01pq2gy67,Kumagaya General Hospital*en,active,healthcare,熊谷総合病院*ja,Kumagaya General Hospital*en;社会医療法人熊谷総合病院*ja,,https://www.kumasou.or.jp,,kumasou.or.jp,,,,,,,,,,Kumagaya,Japan,1858428,NID201200958050625
,https://ror.org/04a1sdj76,Shizuoka Prefectural Research Institute of Animal Industry*en,active,facility,シズオカケン チクサン ギジュツ ケンキュウジョ*ja;Shizuokaken Chikusan Gijutsu Kenkyujo*ja,Shizuoka Prefectural Research Institute of Animal Industry*en;静岡県畜産技術研究所*ja,,https://www.pref.shizuoka.jp/sangyoshigoto/norinjimusho/1046796/1044314.html,,,,,,,,,,,,Fujinomiya,Japan,1864105,NID201200644982137
,https://ror.org/01z2bgb86,Reproduction Clinic Osaka*en,active,healthcare,,Reproduction Clinic Osaka*en;リプロダクションクリニック大阪*ja,,http://www.reposaka.jp,,reposaka.jp,,,,,,,,,,Osaka,Japan,1853909,NID201200596317618
,https://ror.org/027t3y253,Fukuoka Mirai Hospital*en,active,healthcare,福岡みらい病院*ja,Fukuoka Mirai Hospital*en;医療法人相生会福岡みらい病院*ja,,https://www.fukuoka-mirai.jp,,fukuoka-mirai.jp,,,,,,,,,,Fukuoka,Japan,1863967,NID201200259629081
,https://ror.org/03ddrbp36,Japan Travel Bureau Foundation*en,active,nonprofit,日本交通公社*ja,Japan Travel Bureau Foundation*en;公益財団法人日本交通公社*ja,,https://www.jtb.or.jp,,jtb.or.jp,,,,,,,,,,Tokyo,Japan,1850147,NID201200039218441
,https://ror.org/04rjn2z79,Sanjo City University*en,active,education,,Sanjo City University*en;三条市立大学*ja,,https://www.sanjo-u.ac.jp,,sanjo-u.ac.jp,,,,,,,,,,Nagaoka,Japan,1856199,NID201200566129065
,https://ror.org/05d1de378,Civil Engineering Center Tokyo Metropolitan Government*en,active,facility,Tokyo Metropolitan Government Civil Engineering Center*en,Civil Engineering Center Tokyo Metropolitan Government*en;東京都土木技術支援・人材育成センター*ja,,https://www.kensetsu.metro.tokyo.lg.jp/jimusho/tech,,,,,,,,,,,,Tokyo,Japan,1850147,NID201200868663669
,https://ror.org/00941jr33,The Japan Electric Association*en,active,nonprofit,Japan Electric Association*en;日本電気協会*ja,The Japan Electric Association*en;一般社団法人日本電気協会*ja,,https://www.denki.or.jp,,denki.or.jp,,,,,,,,,,Tokyo,Japan,1850147,NID201200727308287
,https://ror.org/04f8q4539,Toyama College of Welfare Science*en,active,education,,Toyama College of Welfare Science*en;富山福祉短期大学*ja,,https://www.t-fukushi.urayama.ac.jp,,t-fukushi.urayama.ac.jp,,,,,,,,,,Imizu,Japan,6822125,NID201200879328186
,https://ror.org/03vzxt803,Japan Marine Science Foundation*en,active,nonprofit,日本海洋科学振興財団*ja,Japan Marine Science Foundation*en;公益財団法人日本海洋科学振興財団*ja,,http://jmsfmml.or.jp,,jmsfmml.or.jp,,,,,,,,,,Tokyo,Japan,1850147,NID201200798848992
,https://ror.org/00ytawf04,Akita Prefectural Government*en,active,government,,Akita Prefectural Government*en;秋田県庁*ja,,https://www.pref.akita.lg.jp,,pref.akita.lg.jp,,,,,,,,,,Akita,Japan,2113126,NID201200837859718
,https://ror.org/00qq6h941,St. Andrew's University of Education*en,active,education,Momoyama Gakuin Kyoiku Daigaku*ja;モモヤマ ガクイン キョウイク ダイガク*ja,St. Andrew's University of Education*en;桃山学院教育大学*ja,,https://www.andrew-edu.ac.jp,,andrew-edu.ac.jp,,,,,,,,,,Sakai,Japan,1853195,NID201200511335053
,https://ror.org/05hf5kp66,Fukuoka Renal Clinic*en,active,healthcare,福岡腎臓内科クリニック*ja,Fukuoka Renal Clinic*en;医療法人医心会福岡腎臓内科クリニック*ja,,https://www.fukuoka-renal-clinic.jp,,fukuoka-renal-clinic.jp,,,,,,,,,,Fukuoka,Japan,1863967,NID201200190170907
,https://ror.org/00k0q6e68,Institute for Building Environment and Energy Conservation*en,active,facility,建築環境・省エネルギー機構*ja,Institute for Building Environment and Energy Conservation*en;一般財団法人建築環境・省エネルギー機構*ja,,https://www.ibecs.or.jp,,ibecs.or.jp,,,,,,,,,,Tokyo,Japan,1850147,NID201200563926483
,https://ror.org/0493g0246,Osaka Health Medical Foundation*en,active,nonprofit,大阪府保健医療財団*ja,Osaka Health Medical Foundation*en;公益財団法人大阪府保健医療財団*ja,,http://www.osaka-mf.jp,,osaka-mf.jp,,,,,,,,,,Osaka,Japan,1853909,NID201200269320002
,https://ror.org/05rk57t35,Sendai Akamon College*en,active,education,,Sendai Akamon College*en;仙台赤門短期大学*ja,,https://sendai-akamon.ac.jp,,sendai-akamon.ac.jp,,,,,,,,,,Sendai,Japan,2111149,NID201200298956694
,https://ror.org/02zpmxf06,Medical Information System Development Center*en,active,nonprofit,医療情報システム開発センター*ja,Medical Information System Development Center*en;一般財団法人医療情報システム開発センター*ja,,https://www.medis.or.jp,,medis.or.jp,,,,,,,,,,Tokyo,Japan,1850147,NID201200962189476
,https://ror.org/00xcej302,The Japan Iron and Steel Federation*en,active,nonprofit,日本鉄鋼連盟*ja;Japan Iron and Steel Federation*en,The Japan Iron and Steel Federation*en;一般社団法人日本鉄鋼連盟*ja,,https://www.jisf.or.jp,,jisf.or.jp,,,,,,,,,,Tokyo,Japan,1850147,NID201200843645910
,https://ror.org/05ad39p10,Ishikawa Prefectural Institute of Public Health and Environmental Science*en,active,facility,イシカワケン ホケン カンキョウ センター*ja;Ishikawaken Hoken Kankyo Senta*ja,Ishikawa Prefectural Institute of Public Health and Environmental Science*en;石川県保健環境センター*ja,,https://www.pref.ishikawa.lg.jp/hokan/,,,,,,,,,,,,Kanazawa,Japan,1860243,NID201200537084344
,https://ror.org/00pv5gd36,Kameoka Municipal Hospital*en,active,healthcare,,Kameoka Municipal Hospital*en;亀岡市立病院*ja,,https://www.city.kameoka.kyoto.jp/site/hospital/,,,,,,,,,,,,Kyoto,Japan,1857910,NID201200738634832
,https://ror.org/050wdfq62,THE Nippon Agricultural Research Institute*en,active,facility,日本農業研究所*ja;Nippon Agricultural Research Institute*en,THE Nippon Agricultural Research Institute*en;公益財団法人日本農業研究所*ja,,http://www.nohken.or.jp,,nohken.or.jp,,,,,,,,,,Tokyo,Japan,1850147,NID201200900139316
,https://ror.org/00xn6v638,KANO General Hospital*en,active,healthcare,協和会加納総合病院*ja,KANO General Hospital*en;社会医療法人協和会加納総合病院*ja,,https://www.heartfull.or.jp/kano/,,,,,,,,,,,,Osaka,Japan,1853909,NID201200159274086
,https://ror.org/02k107z27,Yonemori Hospital*en,active,healthcare,緑泉会米盛病院*ja,Yonemori Hospital*en;社会医療法人緑泉会米盛病院*ja,,https://www.yonemorihp.jp,,yonemorihp.jp,,,,,,,,,,Kagoshima,Japan,1860827,NID201200153965818
,https://ror.org/02f3v2286,Saga Prefectural Government*en,active,government,,Saga Prefectural Government*en;佐賀県庁*ja,,https://www.pref.saga.lg.jp,,pref.saga.lg.jp,,,,,,,,,,Saga,Japan,1853303,NID201200505569987
,https://ror.org/03jy2g328,Toyama Prefectural Government*en,active,government,,Toyama Prefectural Government*en;富山県庁*ja,,https://www.pref.toyama.jp,,pref.toyama.jp,,,,,,,,,,Toyama,Japan,1849876,NID201200729326470
,https://ror.org/01p29af69,Yokohama Women's Junior College*en,active,education,ヨコハマ ジョシ タンキ ダイガク*ja;Yokohama Joshi Tanki Daigaku*ja,Yokohama Women's Junior College*en;横浜女子短期大学*ja,,https://www.yokotan.ac.jp,,yokotan.ac.jp,,,,,,,,,,Yokohama,Japan,1848354,NID201200811769732
,https://ror.org/0175rgg14,Sakura General Hospital*en,active,healthcare,医仁会さくら総合病院*ja,Sakura General Hospital*en;医療法人医仁会さくら総合病院*ja,,https://www.ijinkai.or.jp,,ijinkai.or.jp,,,,,,,,,,Oguchi,Japan,13132739,NID201200017220912
,https://ror.org/026k08163,Eisei Hospital*en,active,healthcare,永生病院*ja,Eisei Hospital*en;医療法人社団永生会永生病院*ja,,https://www.eisei.or.jp/eisei-hospital/,,,,,,,,,,,,Hachiōji,Japan,1863440,NID201200032320189
,https://ror.org/00fn9q691,Niigata Prefectural Institute Of Brewing*en,active,facility,Niigataken Jozo Shikenjo*ja;ニイガタケン ジョウゾウ シケンジョウ*ja,Niigata Prefectural Institute Of Brewing*en;新潟県醸造試験場*ja,,https://www.pref.niigata.lg.jp/sec/jozo/annai.html,,,,,,,,,,,,Niigata,Japan,1855431,NID201200921212760
,https://ror.org/05v4axe68,Ishikawa Prefecture Fisheries Research Center*en,active,facility,Ishikawaken Suisan Sogo Senta*ja;イシカワケン スイサン ソウゴウ センター*ja,Ishikawa Prefecture Fisheries Research Center*en;石川県水産総合センター*ja,,https://www.pref.ishikawa.lg.jp/suisan/center/index.html,,,,,,,,,,,,Kanazawa,Japan,1860243,NID201200896825952
,https://ror.org/03m8f5n28,Shonan Keiiku Hospital*en,active,healthcare,湘南慶育病院*ja,Shonan Keiiku Hospital*en;医療法人社団健育会湘南慶育病院*ja,,https://keiiku.gr.jp,,keiiku.gr.jp,,,,,,,,,,Fujisawa,Japan,1864092,NID201200217896957
,https://ror.org/05hd91813,Urban Design Center*en,active,facility,都市づくりパブリックデザインセンター*ja,Urban Design Center*en;公益財団法人都市づくりパブリックデザインセンター*ja,,https://www.udc.or.jp,,udc.or.jp,,,,,,,,,,Tokyo,Japan,1850147,NID201200959558360
,https://ror.org/03memf294,Gunma Prefectural Forestry Experiment Station*en,active,facility,グンマケン リンギョウ シケンジョウ*ja;Gunmaken Ringyo Shikenjo*ja,Gunma Prefectural Forestry Experiment Station*en;群馬県林業試験場*ja,,https://www.pref.gunma.jp/soshiki/103/,,,,,,,,,,,,Maebashi,Japan,1857843,NID201200922668834
,https://ror.org/0058xdx33,Japan Welding Society*en,active,nonprofit,溶接学会*ja,Japan Welding Society*en;一般社団法人溶接学会*ja,,https://jweld.jp,,jweld.jp,,,,,,,,,,Tokyo,Japan,1850147,NID201200215523345
,https://ror.org/0370bwp13,The New Industry Research Organization*en,active,nonprofit,新産業創造研究機構*ja;New Industry Research Organization*en,The New Industry Research Organization*en;公益財団法人新産業創造研究機構*ja,,https://www.niro.or.jp,,niro.or.jp,,,,,,,,,,Kobe,Japan,1859171,NID201200477398581
,https://ror.org/01exadq33,Okayama Southern Institute of Health*en,active,facility,,Okayama Southern Institute of Health*en;岡山県南部健康づくりセンター*ja,,https://www.okakenko.jp/center/,,,,,,,,,,,,Okayama,Japan,1854383,NID201200309859879
,https://ror.org/0476qjd65,Hakusan Nature Conservation Center*en,active,facility,イシカワケン ハクサン シゼン ホゴ センター*ja;Ishikawaken Hakusan Shizen Hogo Senta*ja,Hakusan Nature Conservation Center*en;石川県白山自然保護センター*ja,,https://www.pref.ishikawa.lg.jp/hakusan/,,,,,,,,,,,,Hakusan,Japan,7467881,NID201200218278154
,https://ror.org/05tre4438,Nagano Prefectural Government*en,active,government,,Nagano Prefectural Government*en;長野県庁*ja,,https://www.pref.nagano.lg.jp,,pref.nagano.lg.jp,,,,,,,,,,Nagano,Japan,1856215,NID201200088983231
,https://ror.org/00fg4wc36,Shimane Prefectural Government*en,active,government,,Shimane Prefectural Government*en;島根県庁*ja,,https://www.pref.shimane.lg.jp,,pref.shimane.lg.jp,,,,,,,,,,Matsue,Japan,1857550,NID201200625592436
,https://ror.org/02kx5fx64,Tochigi Prefectural Forestry Research Center*en,active,facility,トチギケン リンギョウ センター*ja;Tochigiken Ringyo Senta*ja,Tochigi Prefectural Forestry Research Center*en;栃木県林業センター*ja,,https://www.pref.tochigi.lg.jp/d57/050511rindai.html,,,,,,,,,,,,Utsunomiya,Japan,1849053,NID201200581754987
,https://ror.org/00wghwr85,Daini Osaka Police Hospital*en,active,healthcare,,Daini Osaka Police Hospital*en;医療法人警和会第二大阪警察病院*ja,,https://www.oph-2.jp,,oph-2.jp,,,,,,,,,,Osaka,Japan,1853909,NID201200483646663
,https://ror.org/02t4mp811,Japan Bioindustry Association*en,active,nonprofit,バイオインダストリー協会*ja,Japan Bioindustry Association*en;一般財団法人バイオインダストリー協会*ja,,https://www.jba.or.jp,,jba.or.jp,,,,,,,,,,Tokyo,Japan,1850147,NID201200283263778
,https://ror.org/018c4h365,Japan Educational Research Institute*en,active,facility,教育調査研究所*ja,Japan Educational Research Institute*en;一般財団法人教育調査研究所*ja,,http://www.chou-ken.or.jp,,chou-ken.or.jp,,,,,,,,,,Tokyo,Japan,1850147,NID201200523637376
,https://ror.org/04d6h2y86,Warakukai Incorporated Medical Institution*en,active,healthcare,,Warakukai Incorporated Medical Institution*en;医療法人和楽会*ja,,https://fuanclinic.com,,fuanclinic.com,,,,,,,,,,Tokyo,Japan,1850147,NID201200295790675
,https://ror.org/03558c952,Botanic Gardens of Toyama*en,active,archive,トヤマケン チュウオウ ショクブツエン*ja;Toyamaken Chuo Shokubutsuen*ja,Botanic Gardens of Toyama*en;富山県中央植物園*ja,,https://www.bgtym.org,,bgtym.org,,,,,,,,,,Toyama,Japan,1849876,NID201200678617230
,https://ror.org/05qck8y15,Kameda Daiichi Hospital*en,active,healthcare,,Kameda Daiichi Hospital*en;医療法人愛仁会亀田第一病院*ja,,https://www.ijn.or.jp,,ijn.or.jp,,,,,,,,,,Niigata,Japan,1855431,NID201200316177308
,https://ror.org/01vqn8764,Saitama Health Promotion*en,active,healthcare,埼玉県健康づくり事業団*ja,Saitama Health Promotion*en;公益財団法人埼玉県健康づくり事業団*ja,,https://www.saitama-kenkou.or.jp,,saitama-kenkou.or.jp,,,,,,,,,,Saitama,Japan,6940394,NID201200549830122
,https://ror.org/01dwytp71,Gifu Prefectural Police*en,active,government,,Gifu Prefectural Police*en;岐阜県警察*ja,,https://www.pref.gifu.lg.jp/site/police/,,,,,,,,,,,,Gifu,Japan,1863641,NID201200614121005
,https://ror.org/00xcsac28,Kochi Prefectural Government*en,active,government,,Kochi Prefectural Government*en;高知県庁*ja,,https://www.pref.kochi.lg.jp,,pref.kochi.lg.jp,,,,,,,,,,Kochi,Japan,1859146,NID201200282915063
,https://ror.org/04p3g7x29,Sapporo Medical Association*en,active,nonprofit,札幌市医師会*ja,Sapporo Medical Association*en;一般社団法人札幌市医師会*ja,,https://www.spmed.jp,,spmed.jp,,,,,,,,,,Sapporo,Japan,2128295,NID201200359095494
,https://ror.org/00w8wc934,"Tokyo Metropolitan Islands Area Research and Development Center for Agriculture, Forestry and Fisheries*en",active,facility,トウキョウト トウショ ノウリン スイサン ソウゴウ センター*ja;Tokyoto Tosho Norin Suisan Sogo Senta*ja,"Tokyo Metropolitan Islands Area Research and Development Center for Agriculture, Forestry and Fisheries*en;東京都島しょ農林水産総合センター*ja",,https://www.ifarc.metro.tokyo.lg.jp,,ifarc.metro.tokyo.lg.jp,,,,,,,,,,Tokyo,Japan,1850147,NID201200483393055
,https://ror.org/0028wg630,Global Environmental Forum*en,active,nonprofit,地球・人間環境フォーラム*ja,Global Environmental Forum*en;一般財団法人地球・人間環境フォーラム*ja,,https://www.gef.or.jp,,gef.or.jp,,,,,,,,,,Tokyo,Japan,1850147,NID201200489995644
,https://ror.org/04h7yms32,Nagasaki Prefectural Institute for Environmental Research and Public Health*en,active,facility,Nagasakiken Kankyo Hoken Kenkyu Senta*ja;ナガサキケン カンキョウ ホケン ケンキュウ センター*ja,Nagasaki Prefectural Institute for Environmental Research and Public Health*en;長崎県環境保健研究センター*ja,,https://www.pref.nagasaki.jp/section/kankyo-c/,,,,,,,,,,,,Nagasaki,Japan,1856177,NID201200916396824
,https://ror.org/004ngv535,Sapporo Yamanoue Hospital*en,active,nonprofit,,Sapporo Yamanoue Hospital*en;医療法人札幌山の上病院*ja,,https://www.yamanoue.ne.jp,,yamanoue.ne.jp,,,,,,,,,,Sapporo,Japan,2128295,NID201200331845183
,https://ror.org/05d7x7x53,Japan Gas Association*en,active,nonprofit,日本ガス協会*ja,Japan Gas Association*en;一般社団法人日本ガス協会*ja,,https://www.gas.or.jp,,gas.or.jp,,,,,,,,,,Tokyo,Japan,1850147,NID201200300577574
,https://ror.org/00m3ptg97,Toyosato Hospital*en,active,healthcare,豊郷病院*ja,Toyosato Hospital*en;公益財団法人豊郷病院*ja,,http://www.toyosato.or.jp,,toyosato.or.jp,,,,,,,,,,Toyosato,Japan,7394804,NID201200734128139
,https://ror.org/04f8zmj78,Kyoto Yamashiro General Medical Center*en,active,healthcare,,Kyoto Yamashiro General Medical Center*en;京都山城総合医療センター*ja,,https://www.yamashiro-hp.jp,,yamashiro-hp.jp,,,,,,,,,,Kizugawa,Japan,11611622,NID201200260343648
,https://ror.org/05s7zab55,Tottori College of Nursing*en,active,education,トットリ カンゴ ダイガク*ja;Tottori Kango Daigaku*ja,Tottori College of Nursing*en;鳥取看護大学*ja,,https://www.tcn.ac.jp,,tcn.ac.jp,,,,,,,,,,Kurayoshi,Japan,1858301,NID201200132239235
,https://ror.org/03gt88y48,Aino University Junior College*en,active,education,Aino College*en,Aino University Junior College*en;藍野大学短期大学部*ja,,http://aoba.aino.ac.jp,,,,,,,,,,,,Takatsuki,Japan,1850910,NID201200458478736
,https://ror.org/02s3af642,Saitama Medical Association*en,active,nonprofit,埼玉県医師会*ja,Saitama Medical Association*en;一般社団法人埼玉県医師会*ja,,https://www.saitama.med.or.jp,,saitama.med.or.jp,,,,,,,,,,Saitama-shi,Japan,6940394,NID201200081759392
,https://ror.org/052vbfx84,The Nature Conservation Society of Japan*en,active,nonprofit,Nature Conservation Society of Japan*en;日本自然保護協会*ja,The Nature Conservation Society of Japan*en;公益財団法人日本自然保護協会*ja,NACS-J*en,https://www.nacsj.or.jp/,,nacsj.or.jp,,,,,,,,,,Tokyo,Japan,1850147,NID201200967270359
,https://ror.org/0240a1c32,Nihon Medical Association*en,active,nonprofit,日本医学協会*ja,Nihon Medical Association*en;公益社団法人日本医学協会*ja,,https://www.igaku-kyokai.org,,igaku-kyokai.org,,,,,,,,,,Tokyo,Japan,1850147,NID201200481155576
,https://ror.org/03ggkx359,Gunma Prefectural Government*en,active,government,,Gunma Prefectural Government*en;群馬県庁*ja,,https://www.pref.gunma.jp,,pref.gunma.jp,,,,,,,,,,Maebashi,Japan,1857843,NID201200815109217
,https://ror.org/02ngp7z50,Saga Livestock Research Laboratory*en,active,facility,サガケン チクサン シケンジョウ*ja;Sagaken Chikusan Shikenjo*ja,Saga Livestock Research Laboratory*en;佐賀県畜産試験場*ja,,https://www.pref.saga.lg.jp/kiji00320773/index.html,,,,,,,,,,,,Saga,Japan,1853303,NID201200948835771
,https://ror.org/05j1fb737,Kashiwa Kousei General Hospital*en,active,nonprofit,柏厚生総合病院*ja,Kashiwa Kousei General Hospital*en;医療法人社団協友会柏厚生総合病院*ja,,https://www.kashiwakousei.or.jp,,kashiwakousei.or.jp,,,,,,,,,,Kashiwa,Japan,1859924,NID201200777999840
,https://ror.org/01g8jmb35,Japan Health Promotion Foundation*en,active,nonprofit,日本健康増進財団*ja,Japan Health Promotion Foundation*en;一般財団法人日本健康増進財団*ja,,https://www.e-kenkou21.or.jp,,e-kenkou21.or.jp,,,,,,,,,,Tokyo,Japan,1850147,NID201200447888896
,https://ror.org/02zab2r83,Hirosaki Stroke and Rehabilitation Center*en,active,healthcare,黎明郷弘前脳卒中・リハビリテーションセンター*ja,Hirosaki Stroke and Rehabilitation Center*en;一般財団法人黎明郷弘前脳卒中・リハビリテーションセンター*ja,,https://reimeikyou.jp/hsc/,,,,,,,,,,,,Hirosaki,Japan,2130057,NID201200468964018
,https://ror.org/05m7x5j55,Central Japan Industries*en,active,nonprofit,中部産業連盟*ja,Central Japan Industries*en;一般社団法人中部産業連盟*ja,,https://www.chusanren.or.jp,,chusanren.or.jp,,,,,,,,,,Nagoya,Japan,1856057,NID201200777345159
,https://ror.org/027gdbg63,Tokyo Metropolitan Leather Technology Center*en,active,facility,トウキョウ トリツ ヒカク ギジュツ センター*ja;Tokyo Toritsu Hikaku Gijutsu Senta*ja,Tokyo Metropolitan Leather Technology Center*en;東京都立皮革技術センター*ja,,https://www.hikaku.metro.tokyo.lg.jp,,hikaku.metro.tokyo.lg.jp,,,,,,,,,,Tokyo,Japan,1850147,NID201200951077201
,https://ror.org/03a649882,Hanyu General Hospital*en,active,healthcare,,Hanyu General Hospital*en;埼玉医療生活協同組合羽生総合病院*ja,,https://www.fureaihosp.or.jp/hanyuhp/,,,,,,,,,,,,Hanyū,Japan,1863173,NID201200826395081
,https://ror.org/023tvfz15,National Sanatorium Oku-Komyoen*en,active,healthcare,コクリツ リョウヨウジョ オク コウミョウエン*ja;Kokuritsu Ryoyojo Oku Komyoen*ja,National Sanatorium Oku-Komyoen*en;国立療養所邑久光明園*ja,,https://www.mhlw.go.jp/seisakunitsuite/bunya/kenkou_iryou/iryou/hansen/komyo/,,,,,,,,,,,,Setouchi,Japan,11612566,NID201200878389407
,https://ror.org/056zesk73,Tottori Prefectural Government*en,active,government,,Tottori Prefectural Government*en;鳥取県庁*ja,,https://www.pref.tottori.lg.jp,,pref.tottori.lg.jp,,,,,,,,,,Tottori,Japan,1849892,NID201200908572506
,https://ror.org/00qsv5a30,Iida Junior College*en,active,education,イイダ タンキ ダイガク*ja;Iida Tanki Daigaku*ja,Iida Junior College*en;飯田短期大学*ja,,https://www.iida.ac.jp,,iida.ac.jp,,,,,,,,,,Iida,Japan,1861864,NID201200994991281
,https://ror.org/044qwwh31,Infrastructure Development INSTITUTE-JAPAN*en,active,nonprofit,国際建設技術協会*ja,Infrastructure Development INSTITUTE-JAPAN*en;一般社団法人国際建設技術協会*ja,,http://www.idi.or.jp/ja/,,idi.or.jp,,,,,,,,,,Tokyo,Japan,1850147,NID201200180508754
,https://ror.org/04wb7ez66,KKR Hokuriku Hospital*en,active,healthcare,,KKR Hokuriku Hospital*en;国家公務員共済組合連合会北陸病院*ja,,https://hokuriku.kkr.or.jp,,hokuriku.kkr.or.jp,,,,,,,,,,Kanazawa,Japan,1860243,NID201200848891480
,https://ror.org/01eyz2v57,Nanbu Tokushukai Hospital*en,active,healthcare,,Nanbu Tokushukai Hospital*en;特定医療法人沖縄徳洲会南部徳洲会病院*ja,,https://www.nantoku.org,,nantoku.org,,,,,,,,,,Yaese,Japan,6822225,NID201200036366060
,https://ror.org/03tpcyh35,"Policy Research Institute, Ministry of Finance*en",active,facility,Zaimusho Zaimu Sogo Seisaku Kenkyujo*ja;ザイムショウ ザイム ソウゴウ セイサク ケンキュウジョ*ja;Policy Research Institute of Ministry of Finance*en,"Policy Research Institute, Ministry of Finance*en;財務省財務総合政策研究所*ja",,https://www.mof.go.jp/pri/,,,,,,,,,,,,Tokyo,Japan,1850147,NID201200775445114
,https://ror.org/01e7bym67,Aomori Prefectural Government*en,active,government,,Aomori Prefectural Government*en;青森県庁*ja,,https://www.pref.aomori.lg.jp,,pref.aomori.lg.jp,,,,,,,,,,Aomori,Japan,2130658,NID201200356846978
,https://ror.org/05sqj2j86,Sanmu Medical Center*en,active,healthcare,さんむ医療センター*ja,Sanmu Medical Center*en;地方独立行政法人さんむ医療センター*ja,,https://www.sanmu-mc.jp,,sanmu-mc.jp,,,,,,,,,,Sanmu,Japan,6822168,NID201200274843367
,https://ror.org/0368r1627,Geological Carbon Dioxide Storage Technology Research Association*en,active,nonprofit,,Geological Carbon Dioxide Storage Technology Research Association*en;二酸化炭素地中貯留技術研究組合*ja,,https://www.co2choryu-kumiai.or.jp,,co2choryu-kumiai.or.jp,,,,,,,,,,Kizugawa,Japan,11611622,NID201200884123590
,https://ror.org/03165bw24,Photocoding*en,active,other,,Photocoding*en;フォトコーディング*ja,,http://www.photocoding.com,,photocoding.com,,,,,,,,,,Sagamihara,Japan,11611609,NID201200831269256
