html_url,id,names.types.ror_display,status,types,names.types.alias,names.types.label,names.types.acronym,links.type.website,links.type.wikipedia,domains,established,external_ids.type.fundref.all,external_ids.type.fundref.preferred,external_ids.type.grid.all,external_ids.type.grid.preferred,external_ids.type.isni.all,external_ids.type.isni.preferred,external_ids.type.wikidata.all,external_ids.type.wikidata.preferred,city,country,locations.geonames_id,relationships.type.parent,relationships.type.child,relationships.type.related,relationships.type.successor,relationships.type.predecessor
,,"Södra Foundation for Research, Development and Education*en",active,nonprofit;funder,"Södra Skogsägarnas Foundation for Research, Development and Education*en;Södras Forskningsstiftelse*sv","Södra Foundation for Research, Development and Education*en;Södra Skogsägarnas Stiftelse för Forskning, Utveckling och Utbildning*sv",,https://www.sodra.com/en/global/about-us/innovation/the-sodra-foundation-for-research/,,,1995,100010813,100010813,,,,,,,Växjö,Sweden,2663536,,,https://ror.org/04xh4sy96,,
,,Maryland Department of Transportation State Highway Administration*en,active,government;funder,MDOT State Highway Administration*en,Maryland Department of Transportation State Highway Administration*en;Maryland State Highway Administration*en,MDOT SHA;SHA,https://roads.maryland.gov,,roads.maryland.gov,1908,100030668,100030668,,,,,,,Baltimore,United States,4347778,,,,,
,,The Larry and Helen Hoag Foundation*en,active,nonprofit;funder,Larry and Helen Hoag Foundation*en,The Larry and Helen Hoag Foundation*en,,https://larryandhelenhoagfoundation.org,,larryandhelenhoagfoundation.org,1991,100019582,100019582,,,,,,,Long Beach,United States,5367929,,,,,
,,Friedrich und Elisabeth Boysen-Stiftung*de,active,nonprofit;funder,Friedrich und Elisabeth Boysen Stiftung für Forschung und Innovation*de,Friedrich und Elisabeth Boysen-Stiftung*de;Friedrich and Elisabeth Boysen Foundation*en,,https://www.boysen-stiftung.de,,boysen-stiftung.de,1996,100031269,100031269,,,,,,,Stuttgart,Germany,2825297,,,,,
,,Fabrikant Karl G. Andersens (Anderssons) Fond*da,active,nonprofit;funder,Manufacturer Karl G. Andersen's (Andersson's) Fund*en,Fabrikant Karl G. Andersens (Anderssons) Fond*da,,https://karlgandersenfond.dk,,karlgandersenfond.dk,1991,501100009926,501100009926,,,,,,,Hellerup,Denmark,2620516,,,,,
,,Lundbeck Canada (Canada),active,company;funder,Lundbeck Canada Inc*en;Lundbeck Canada Inc.*en,Lundbeck Canada (Canada),,https://www.lundbeck.com/ca/en,,,1995,501100021138,501100021138,,,,,,,Montréal,Canada,6077243,https://ror.org/0564cd633,,,,
,,Wuxi Association for Science and Technology*en,active,nonprofit;funder,无锡市科协*zh,Wuxi Association for Science and Technology*en;Wuxi Science and Technology Association*en;无锡市科学技术协会*zh,WXAST,https://tlpsr.wuxi.gov.cn,,tlpsr.wuxi.gov.cn,1958,100017837,100017837,,,,,,,Wuxi,China,1790923,,,,,
,,Limpopo Department of Agriculture and Rural Development*en,active,government;funder,Limpopo Agriculture and Rural Development*en;Department of Agriculture and Rural Development*en;Limpopo Department: Agriculture and Rural Development*en;Limpopo Dept Agriculture & Rural Development*en;Limpopo Department of Agriculture & Rural Development*en,Limpopo Department of Agriculture and Rural Development*en,LDARD,https://www.ldard.gov.za,,ldard.gov.za,,501100023301,501100023301,,,,,,,Polokwane,South Africa,965289,,,,,
,,Momental Foundation*en,active,nonprofit;funder,Mistletoe Foundation*en,Momental Foundation*en,,https://www.momentalfound.org,,momentalfound.org,2018,100019413,100019413,,,,,,,Redwood City,United States,,,,,,
,,Porter Family Foundation*en,active,nonprofit;funder,The Porter Family Foundation*en,Porter Family Foundation*en,,https://www.theporterfamilyfoundation.org,,theporterfamilyfoundation.org,1998,100017688,100017688,,,,,,,Ann Arbor,United States,4984247,,,,,
,,Kidney Cancer UK*en,active,nonprofit;funder,Kidney Cancer Care Ltd.*en,Kidney Cancer UK*en,KCUK,https://www.kcuk.org.uk,,kcuk.org.uk,2006,501100023339,501100023339,,,,,,,Guildford,United Kingdom,2647793,,,,,
,,Fundación Ciudadanía y Valores*es,active,nonprofit;funder,Citizenship and Values Foundation*en,Fundación Ciudadanía y Valores*es,FUNCIVA,https://funciva.org,,funciva.org,2006,100030778,100030778,,,,,,,Madrid,Spain,3117735,https://ror.org/029gnnp81,,,,
,,Korea National Institute for Bioethics Policy*en,active,facility;funder,,Korea National Institute for Bioethics Policy*en;국가생명윤리정책원*ko,KoNIBP,https://nibp.kr,,nibp.kr,2011,100015484,100015484,,,,,,,Seoul,South Korea,,https://ror.org/00vxgjw72,,,,
,,Willi Hennig Society*en,active,nonprofit;funder,Hennig Society*en,Willi Hennig Society*en,WHS,https://cladistics.org,,cladistics.org,1980,100011242,100011242,,,,,,,New York,United States,5128581,,,,,
,,Grace Science Foundation*en,active,nonprofit;funder,,Grace Science Foundation*en,,https://gracescience.org,,gracescience.org,2014,100012207,100012207,,,,,,,Menlo Park,United States,5372223,,,,,
,,Banff International Research Station for Mathematical Innovation and Discovery*en,active,facility;funder,Banff International Research Station*en;The Banff International Research Station for Mathematical Innovation and Discovery*en,Banff International Research Station for Mathematical Innovation and Discovery*en,BIRS,https://www.birs.ca,,birs.ca,2003,501100015899,501100015899,,,,,,,Banff,Canada,5892532,,,,,
,,National Key Laboratory of Science and Technology on Reliability and Environmental Engineering*en,active,facility;funder,Key Laboratory on Reliability and Environmental Engineering Technology*en;Science and Technology on Reliability and Environment Engineering Laboratory*en;National Defense Science & Technology Laboratory on Reliability & Environmental Engineering*en,National Key Laboratory of Science and Technology on Reliability and Environmental Engineering*en;可靠性与环境工程技术全国重点实验室*zh,,https://rse.buaa.edu.cn/kxyj1/kypt.htm,,,2005,501100015747,501100015747,,,,,,,Beijing,China,1816670,https://ror.org/00wk2mp56,,,,
,,Kunming Science and Technology Bureau*en,active,government;funder,Science and Technology Bureau of Kunming*en,Kunming Science and Technology Bureau*en;昆明市科学技术局*zh,,https://kjj.km.gov.cn,,kjj.km.gov.cn,,100017720,100017720,,,,,,,Kunming,China,1804651,,,,,
,,Children's Board of Hillsborough County*en,active,government;funder,Children's Board of Hillsborough County Florida*en;Children's Board*en,Children's Board of Hillsborough County*en,,https://www.childrensboard.org,,childrensboard.org,1988,100031732,100031732,,,,,,,Tampa,United States,4174757,,,,,
,,Office of Refugee Resettlement*en,active,government;funder,"Administration for Children and Families Office of Refugee Resettlement*en;OFFICE OF REFUGEE RESETTLEMENT, ADMINISTRATION FOR CHILDREN AND FAMILIES*en",Office of Refugee Resettlement*en,ORR,https://acf.gov/orr,https://en.wikipedia.org/wiki/Office_of_Refugee_Resettlement,,1980,100013171,100013171,,,,,,,Washington,United States,,https://ror.org/00g8hms52,,,,
,,Baoding Science and Technology Bureau*en,active,government;funder,Baoding City Science and Technology and Intellectual Property Bureau*en;Baoding City Science and Technology Bureau*en,保定市科学技术局*zh;保定市科学技术和知识产权局*zh,,https://kjj.baoding.gov.cn,,kjj.baoding.gov.cn,,501100011494,501100011494,,,,,,,Baoding,China,,,,,,
,,Heinz Family Foundation*en,active,nonprofit;funder,The Heinz Family Foundation*en,Heinz Family Foundation*en,,https://www.heinzawards.org,,heinzawards.org,1984,100016591,100016591,,,,,,,Pittsburgh,United States,5206379,,,,,
,,Swedish Society for Anthropology and Geography*en,active,nonprofit;funder,The Swedish Society for Anthropology and Geography*en,Swedish Society for Anthropology and Geography*en;Svenska Sällskapet för Antropologi och Geografi*sv,SSAG,https://ssag.se,,ssag.se,1877,501100022619,501100022619,,,,,,,Stockholm,Sweden,2673730,,,,,
,,Korean Gastric Cancer Association*en,active,nonprofit;funder,The Korean Gastric Cancer Association*en,Korean Gastric Cancer Association*en;대한위암학회*ko,KGCA,https://www.kgca-i.or.kr,,kgca-i.or.kr,1996,100020272,100020272,,,,,,,Seoul,South Korea,1835848,,,,,
,,TESS Research Foundation*en,active,nonprofit;funder,TESS Research Foundation for Slc13a5 Epilepsy*en,TESS Research Foundation*en,,https://tessresearch.org,,tessresearch.org,2015,100020067,100020067,,,,,,,Menlo Park,United States,5372223,,,,,
,,Fred C. and Katherine B. Andersen Foundation*en,active,nonprofit;funder,Fred C and Katherine B Andersen Foundation*en,Fred C. and Katherine B. Andersen Foundation*en,,https://www.fredckatherinebandersenfoundation.org,,fredckatherinebandersenfoundation.org,1959,100017909,100017909,,,,,,,Bayport,United States,5017416,,,,,
,,Cooperative Institute for the North Atlantic Region*en,active,facility;funder,NOAA's Cooperative Institute for the North Atlantic Region*en;North Atlantic Regional Cooperative Institute*en,Cooperative Institute for the North Atlantic Region*en,CINAR,https://website.whoi.edu/cinar/,,,2019,100020170,100020170,,,,,,,Woods Hole,United States,4956152,https://ror.org/03zbnzt98;https://ror.org/02z5nhe81,,,,
,,Nakatsuji Foresight Foundation*en,active,nonprofit;funder,一般財団法人中辻創智社*ja,Nakatsuji Foresight Foundation*en;公益財団法人中辻創智社*ja,NFF,https://nakatsuji-ff.org,,nakatsuji-ff.org,2015,100020240,100020240,,,,,,,Kyoto,Japan,,,,,,
,,Hellenic Heart Foundation*en,active,nonprofit;funder,,Hellenic Heart Foundation*en;Ελληνικό Ίδρυμα Καρδιολογίας*el,ΕΛ.Ι.ΚΑΡ.,https://www.elikar.gr,,elikar.gr,1991,501100015817,501100015817,,,,,,,Athens,Greece,264371,,,,,
,,Osteosarcoma Institute*en,active,nonprofit;funder,The Osteosarcoma Institute*en,Osteosarcoma Institute*en,OSI,https://osinst.org,,osinst.org,2017,100016622,100016622,,,,,,,Dallas,United States,4684888,,,,,
,,Society for Laboratory Automation and Screening*en,active,nonprofit;funder,Society for Laboratory Automation & Screening*en,Society for Laboratory Automation and Screening*en,SLAS,https://www.slas.org,,slas.org,2010,100014319,100014319,,,,,,,Oak Brook,United States,,,,,,
,,Foundation of Kinoshita Memorial Enterprise*en,active,nonprofit;funder,Kinoshita Memorial Foundation*en;財団法人木下記念事業団*ja,Foundation of Kinoshita Memorial Enterprise*en;公益財団法人木下記念事業団*ja,,https://www.k-zaidan.or.jp,,k-zaidan.or.jp,1975,100020148,100020148,,,,,,,Kobe,Japan,,,,,,
,,Guangdong Provincial Key Laboratory of Durability for Marine Civil Engineering*en,active,facility;funder,"Guangdong Provincial Key Laboratory of Marine Civil Engineering*en;Guangdong Provincial Key Laboratory of Durability for Marine Civil Engineering, SZU*en",Guangdong Provincial Key Laboratory of Durability for Marine Civil Engineering*en;广东省滨海土木工程耐久性重点实验室*zh,GDDCE,https://keylab.szu.edu.cn/English/Home.htm,,,2011,501100019057,501100019057,,,,,,,Shenzhen,China,1795565,https://ror.org/01vy4gh70,,,,
,,Janssen Korea (South Korea),active,company;funder,Janssen Korea Ltd.*en,Janssen Korea (South Korea);한국얀센*ko,,https://www.jnj.com/innovativemedicine/korea/,,,1983,100032569,100032569,,,,,,,Seoul,South Korea,1835848,https://ror.org/03qd7mz70,,,,
,,Dravet Syndrome UK*en,active,nonprofit;funder,,Dravet Syndrome UK*en,,https://www.dravet.org.uk,,dravet.org.uk,2009,100012012,100012012,,,,,,,Chesterfield,United Kingdom,,,,,,
,,Shinshu Public Utility Foundation for Promotion of Medical Sciences*en,active,nonprofit;funder,信州医学振興会*ja,Shinshu Public Utility Foundation for Promotion of Medical Sciences*en;公益財団法人信州医学振興会*ja,,https://www.shinshu-u.ac.jp/group/i-shinkoukai/,,,1994,501100011611,501100011611,,,,,,,Matsumoto,Japan,,,,,,
,,Telecommunications and Digital Government Regulatory Authority*en,active,government;funder,Telecommunications Regulatory Authority*en,Telecommunications and Digital Government Regulatory Authority*en;هيئة تنظيم الاتصالات والحكومة الرقمية*ar,TDRA;TRA,https://tdra.gov.ae,,tdra.gov.ae,2003,100012823,100012823,,,,,,,Abu Dhabi,United Arab Emirates,292968,,,,,
,,Georgia Tech Foundation*en,active,nonprofit;funder,"The Georgia Tech Foundation*en;Georgia Tech Foundation, Inc.*en",Georgia Tech Foundation*en,GTF,https://www.gtf.gatech.edu,,gtf.gatech.edu,1932,100017015,100017015,,,,,,,Atlanta,United States,4180439,,,https://ror.org/01zkghx44,,
,,Shanghai Tongji Gao Tingyao Environmental Science and Technology Development Foundation*en,active,nonprofit;funder,Shanghai Tongji Gao Tingyao Environmental Science & Technology Development Foundation*en;高廷耀环保基金会*zh,Shanghai Tongji Gao Tingyao Environmental Science and Technology Development Foundation*en;上海同济高廷耀环保科技发展基金会*zh,STGEF,http://www.stgef.cn,,stgef.cn,2003,100017661,100017661,,,,,,,Shanghai,China,,,,https://ror.org/03rc6as71,,
,,Sustainable Ocean Alliance*en,active,nonprofit;funder,Sustainable Ocean Alliance Inc*en,Sustainable Ocean Alliance*en,SOA,https://www.soalliance.org,,soalliance.org,2014,100027689,100027689,,,,,,,San Francisco,United States,5391959,,,,,
,,Gobernación de Boyacá*es,active,government;funder,Government of Boyacá*en,Gobernación de Boyacá*es,,https://www.boyaca.gov.co,,boyaca.gov.co,,501100019732,501100019732,,,,,,,Tunja,Colombia,3666608,,,,,
,,Margot und Erich Goldschmidt & Peter René Jacobson-Stiftung*de,active,nonprofit;funder,Goldschmidt-Jacobson Stiftung*de;Goldschmidt-Jacobson Foundation*en;Margot und Erich Goldschmidt und Peter René Jacobson-Stiftung*de,Margot und Erich Goldschmidt & Peter René Jacobson-Stiftung*de;Margot and Erich Goldschmidt and Peter René Jacobson Foundation*en,GJS,https://www.goldschmidtjacobsonstiftung.com,,goldschmidtjacobsonstiftung.com,2011,501100016071,501100016071,,,,,,,Basel,Switzerland,2661604,,,,,
,,Fetal Health Foundation*en,active,nonprofit;funder,Fetal Hope Foundation*en,Fetal Health Foundation*en,FHF,https://www.fetalhealthfoundation.org,,fetalhealthfoundation.org,2006,100013774,100013774,,,,,,,Littleton,United States,5429032,,,,,
,,Noordelijke Cara Stichting*nl,active,nonprofit;funder,Northern Cara Foundation*en;Noordelijke Cara-Stichting*nl,Noordelijke Cara Stichting*nl,NCS,https://www.noordelijkecarastichting.nl,,noordelijkecarastichting.nl,,100016056,100016056,,,,,,,Groningen,Netherlands,2755251,,,,,
,,Internal Revenue Service*en,active,government;funder,Bureau of Internal Revenue*en;Office of Commissioner of Internal Revenue*en,Internal Revenue Service*en;Servicio de Impuestos Internos*es;Налоговое управление США*ru,IRS,https://www.irs.gov,https://en.wikipedia.org/wiki/Internal_Revenue_Service,irs.gov,1862,100024081,100024081,,,,,,,Washington,United States,4140963,https://ror.org/028t43p77,,,,
,,Maryland Department of the Environment*en,active,government;funder,,Maryland Department of the Environment*en,MDE,https://mde.maryland.gov,,mde.maryland.gov,1987,100031472,100031472,,,,,,,Baltimore,United States,4347778,https://ror.org/04ja8je85,,,,
,,Lintilhac Foundation*en,active,nonprofit;funder,The Lintilhac Foundation*en;LINTILHAC FOUNDATION INC,Lintilhac Foundation*en,,https://lintilhacfoundation.org,,lintilhacfoundation.org,1975,100016430,100016430,,,,,,,Shelburne,United States,5241006,,,,,
,,State of Iowa*en,active,government;funder,,State of Iowa*en,,https://www.iowa.gov,,iowa.gov,1846,100023081,100023081,,,,,,,Des Moines,United States,4853828,,,,,
,,Orange Foundation*en,active,nonprofit;funder,,Orange Foundation*en;Fondation Orange*fr,,https://www.fondationorange.com,,fondationorange.com,1987,100018397,100018397,,,,,,,Issy-les-Moulineaux,France,,https://ror.org/035j0tq82,,,,
,,Foundation for Canadian Studies in the United Kingdom*en,inactive,nonprofit;funder,Foundation for Canadian Studies in the UK*en,Foundation for Canadian Studies in the United Kingdom*en,,http://www.canadian-studies-uk.org,,canadian-studies-uk.org,1975,501100013672,501100013672,,,,,,,London,United Kingdom,2643743,,,,,
,,DNA Genotek (Canada),active,company;funder,DNA Genotek Inc.*en,DNA Genotek (Canada),,https://www.dnagenotek.com,,dnagenotek.com,1998,100014098,100014098,,,,,,,Ottawa,Canada,6094817,https://ror.org/02hew9107,,,,
,,Fundación Sales*es,active,nonprofit;funder,Sales Foundation*en,Fundación Sales*es,,https://fundacionsales.org,,fundacionsales.org,2004,100017700,100017700,,,,,,,Vigo,Spain,3105976,,,,,
,,Japanese Society for Neuroendovascular Therapy*en,active,nonprofit;funder,,Japanese Society for Neuroendovascular Therapy*en;日本脳神経血管内治療学会*ja,JSNET,https://jsnet.website,,jsnet.website,1982,100031155,100031155,,,,,,,Tokyo,Japan,,,,,,
,,Montgomery County Government*en,active,government;funder,"Montgomery County, Maryland*en;Montgomery County, MD Government*en;Montgomery County, Maryland Government*en;Montgomery County*en;Gobierno del Condado de Montgomery*es;Administration du Comté de Montgomery*fr",Montgomery County Government*en;몽고메리 카운티 정부*ko;蒙哥马利县政府*zh,MCG,https://www.montgomerycountymd.gov,,montgomerycountymd.gov,1776,100024377,100024377,,,,,,,Rockville,United States,4367175,https://ror.org/04ja8je85,,,,
,,Pingtung Veterans General Hospital*en,active,healthcare;funder,,Pingtung Veterans General Hospital*en;屏東榮民總醫院*zh,PTVGH,https://www.ptvgh.gov.tw,,ptvgh.gov.tw,2022,100032814,100032814,,,,,,,Pingtung City,Taiwan,1670481,,,,,
,,Appendix Cancer Pseudomyxoma Peritonei Research Foundation*en,active,nonprofit;funder,Appendix Cancer PMP Research Foundation*en;ACPMP Research Foundation*en,Appendix Cancer Pseudomyxoma Peritonei Research Foundation*en,ACPMP,https://acpmp.org,,acpmp.org,2008,100013778,100013778,,,,,,,Springfield,United States,7259029,,,,,
,,Joint Shantou International Eye Center*en,active,healthcare;nonprofit;funder,,Joint Shantou International Eye Center*en;汕头大学·香港中文大学联合汕头国际眼科中心*zh,JSIEC,https://www.jsiec.org,,jsiec.org,2002,100012427,100012427,,,,,,,Shantou,China,1795940,,,,,
,,Munuaissäätiö*fi,active,nonprofit;funder,Finnish Kidney and Liver Foundation*en,Munuaissäätiö*fi,,https://muma.fi/munuaissaatio/,,,1974,100018865,100018865,,,,,,,Helsinki,Finland,658225,,,,,
,,European Federation of Immunological Societies*en,active,nonprofit;funder,Europese Federatie van Immunologische Verenigingen*nl,European Federation of Immunological Societies*en,EFIS,https://www.efis.org,,efis.org,1975,501100013710,501100013710,,,,,,,Amsterdam,Netherlands,,,,,,
,,Gene Solutions (Vietnam),active,company;funder,Gene Solutions JSC*en,Gene Solutions (Vietnam);CÔNG TY CỔ PHẦN GIẢI PHÁP GENE*vi;Gene Solutions*en,,https://genesolutions.vn,,genesolutions.vn,2017,100032442,100032442,,,,,,,Ho Chi Minh City,Vietnam,1566083,,,,,
,,Associazione Italiana per la Promozione delle Ricerche sull'Ambiente e la Salute Umana*it,active,nonprofit;funder,AIPRAS ONLUS,Associazione Italiana per la Promozione delle Ricerche sull'Ambiente e la Salute Umana*it,AIPRAS,https://www.aipras.org,,aipras.org,2010,501100014187,501100014187,,,,,,,Dugenta,Italy,3177453,,,,,
,,Vår Energi (Norway),active,company;funder,Vår Energi ASA*en;Vår Energi AS*en;Our Energy*en,Vår Energi (Norway),,https://varenergi.no,,varenergi.no,2018,100032094,100032094,,,,,,,Stavanger,Norway,3137115,https://ror.org/038483r84,,,,
,,Chinook Therapeutics (United States),inactive,company;funder,"Chinook Therapeutics, Inc.*en;Chinook*en",Chinook Therapeutics (United States),,https://www.chinooktx.com,,chinooktx.com,2019,501100015629,501100015629,,,,,,,Seattle,United States,5809844,https://ror.org/02f9zrr09,,,,
,,Pennsylvania Water Resources Research Center*en,active,facility;funder,"Pennsylvania Center for Water Resources Research*en;Pennsylvania Water Resources Research Center, Pennsylvania State University*en;Pennsylvania's WRRC*en",Pennsylvania Water Resources Research Center*en,PAWRRC;WRRC,https://www.pawatercenter.psu.edu,,pawatercenter.psu.edu,1964,100013641,100013641,,,,,,,University Park,United States,,https://ror.org/04p491231,,,,
,,Zhao Yi-Cheng Medical Science Foundation*en,active,nonprofit;funder,,Zhao Yi-Cheng Medical Science Foundation*en;天津市赵以成医学科学基金会*zh,,http://www.zycmsf.com,,zycmsf.com;zycmf.com,2012,501100016310,501100016310,,,,,,,Tianjin,China,,,,,,
,,Guangdong Key Laboratory of Fuel Cell Technology*en,active,facility;funder,Guangdong Provincial Key Laboratory of Fuel Cell Technology*en;Key Laboratory of Fuel Cell Technology of Guangdong Province*en,Guangdong Key Laboratory of Fuel Cell Technology*en;广东省燃料电池技术重点实验室*zh,,https://www2.scut.edu.cn/fuelcelllab/,,,2010,501100011507,501100011507,,,,,,,Guangzhou,China,1809858,https://ror.org/0530pts50,,,,
,,Putian Science and Technology Bureau*en,active,government;funder,Putian City Science and Technology Bureau*en,Putian Science and Technology Bureau*en;莆田市科学技术局*zh,,https://www.putian.gov.cn,,putian.gov.cn,,501100009617,501100009617,,,,,,,Putian,China,1798449,,,,,
,,RIH Orthopaedic Foundation*en,active,nonprofit;funder,"RIH Orthopaedic Foundation, Inc.*en;The RIH Orthopaedic Foundation*en",RIH Orthopaedic Foundation*en,RIHOF,https://rihof.org,,rihof.org,1982,100016380,100016380,,,,,,,Providence,United States,,,,,,
,,Bakewell Foundation*en,active,nonprofit;funder,The Bakewell Foundation*en,Bakewell Foundation*en,,https://thebakewellfoundation.org,,thebakewellfoundation.org,1986,100019371,100019371,,,,,,,St. Louis,United States,4407066,,,,,
,,American Regent (United States),active,company;funder,"American Regent, Inc.*en",American Regent (United States),,https://americanregent.com,,americanregent.com,1967,100016473,100016473,,,,,,,Shirley,United States,5138022,https://ror.org/027y26122,,,,
,,Brescia University College*en,inactive,education;funder,,Brescia University College*en,BUC,https://brescia.uwo.ca,https://en.wikipedia.org/wiki/Brescia_University_College,brescia.uwo.ca,1919,100012977,100012977,,,,,,,London,Canada,6058560,,,,https://ror.org/02grkyz14,
,,Melissa Lee Cancer Foundation*en,active,nonprofit;funder,,Melissa Lee Cancer Foundation*en;財團法人李美蓉癌症醫學研究基金會*zh,MLCF,https://www.mlcf.org.tw,,mlcf.org.tw,2020,100031316,100031316,,,,,,,Taipei,Taiwan,1668341,,,,,
,,"Key Laboratory of Synthetic and Natural Functional Molecular Chemistry, Ministry of Education*en",active,facility;funder,Key Laboratory of Synthetic and Natural Functional Molecular Chemistry of Ministry of Education*en;Key Laboratory of Synthetic and Natural Functional Molecular Chemistry*en,"Key Laboratory of Synthetic and Natural Functional Molecular Chemistry, Ministry of Education*en;西北大学合成与天然功能分子化学教育部重点实验室*zh",,http://htfsy.nwu.edu.cn,,htfsy.nwu.edu.cn,2007,501100010992,501100010992,,,,,,,Xi'an,China,1790630,https://ror.org/00z3td547,,,,
,,icare Foundation*en,active,nonprofit;funder,The I-Care Foundation*en;i-Care Foundation*en,icare Foundation*en,,https://www.icare.nsw.gov.au,,icare.nsw.gov.au,2016,501100021840,501100021840,,,,,,,Sydney,Australia,2147714,https://ror.org/0229nk184,,,,
,,BCCDC Foundation for Public Health*en,active,nonprofit;funder,Pacific Public Health Foundation*en;BCCDC Foundation for Population and Public Health*en;British Columbia Centre for Disease Control Foundation for Population and Public Health*en;BCCDC Foundation,BCCDC Foundation for Public Health*en,,https://pacificpublichealth.ca,,pacificpublichealth.ca,2004,100011227,100011227,,,,,,,Vancouver,Canada,,,,,,
,,Kobayashi Magobe Memorial Medical Foundation*en,active,nonprofit;funder,,Kobayashi Magobe Memorial Medical Foundation*en;小林孫兵衛記念医学振興財団*ja,,https://mannari.or.jp,,mannari.or.jp,1993,501100006679,501100006679,,,,,,,Okayama,Japan,1854383,,,,,
,,National Engineering Research Center of Information Content Analysis Technology*en,active,facility;funder,National Engineering Laboratory for Information Content Analysis Technology*en;Chinese National Engineering Laboratory for Information Content Analysis Technology*en,National Engineering Research Center of Information Content Analysis Technology*en;信息内容分析技术国家工程研究中心*zh,,https://icst.sjtu.edu.cn/Base.aspx,,,2009,501100014866,501100014866,,,,,,,Shanghai,China,1796236,https://ror.org/0220qvk04,,,,
,,"Key Laboratory of Solar Activities, Chinese Academy of Sciences*en",active,facility;funder,"CAS Key Laboratory of Solar Activity*en;CAS Key Laboratory of Solar Activity, National Astronomical Observatories*en","Key Laboratory of Solar Activities, Chinese Academy of Sciences*en;中国科学院太阳活动重点实验室*zh",CAS-KLSA,http://english.nao.cas.cn/Research2015/ckl2015/201701/t20170120_173568.html,,,2008,501100015059,501100015059,,,,,,,Beijing,China,,,https://ror.org/058pyyv44,,,
,,South Carolina Department of Agriculture*en,active,government;funder,SC Department of Agriculture*en;Department of Agriculture*en,South Carolina Department of Agriculture*en,SCDA,https://agriculture.sc.gov,,agriculture.sc.gov,1879,100017612,100017612,,,,,,,Columbia,United States,4575352,,,,,
,,Asociación Española de Ecología Terrestre*es,active,nonprofit;funder,Spanish Association for Terrestrial Ecology*en,Asociación Española de Ecología Terrestre*es,AEET,https://www.aeet.org,,aeet.org,1989,100010759,100010759,,,,,,,Móstoles,Spain,3116025,,,,,
,,Eleanor Crook Foundation*en,active,nonprofit;funder,The Eleanor Crook Foundation*en,Eleanor Crook Foundation*en,ECF,https://eleanorcrookfoundation.org,,eleanorcrookfoundation.org,1997,100031629,100031629,,,,,,,Washington,United States,4140963,,,,,
