html_url,id,names.types.ror_display,status,types,names.types.alias,names.types.label,names.types.acronym,links.type.website,links.type.wikipedia,domains,established,external_ids.type.fundref.all,external_ids.type.fundref.preferred,external_ids.type.grid.all,external_ids.type.grid.preferred,external_ids.type.isni.all,external_ids.type.isni.preferred,external_ids.type.wikidata.all,external_ids.type.wikidata.preferred,city,country,locations.geonames_id,relationships.type.parent,relationships.type.child,relationships.type.related,relationships.type.successor,relationships.type.predecessor
,,Peter Gilgan Foundation*en,active,nonprofit;funder,The Peter Gilgan Foundation*en,Peter Gilgan Foundation*en,,https://www.petergilganfoundation.org,,petergilganfoundation.org,2006,501100020903,501100020903,,,,,,,Toronto,Canada,6167865,,,,,
,,Open Medicine Foundation*en,active,nonprofit;funder,,Open Medicine Foundation*en,OMF,https://www.omf.ngo,,omf.ngo,2012,100014224,100014224,,,,,,,Agoura Hills,United States,5322553,,,,,
,,Advanced Enzyme Technologies Limited (India),active,company;funder,Advanced Enzyme Technologies*en;Advanced Enzymes*en,Advanced Enzyme Technologies Limited (India);Advanced Enzyme Technologies Limited*en,AETL,https://www.advancedenzymes.com,,advancedenzymes.com,1989,100021009,100021009,,,,,,,Thane,India,,,,,,
,,St. David's Foundation*en,active,nonprofit;funder,St David's Foundation*en,St. David's Foundation*en,SDF,https://stdavidsfoundation.org,,stdavidsfoundation.org,1996,100026904,100026904,,,,,,,Austin,United States,4671654,,,,,
,,Universitas Katolik Indonesia Santu Paulus Ruteng*id,active,education;funder,Indonesian Catholic University of Santu Paulus Ruteng*en;Catholic University of St. Paul Ruteng*en,Universitas Katolik Indonesia Santu Paulus Ruteng*id,UNIKA St. Paulus Ruteng,https://unikastpaulus.ac.id,,unikastpaulus.ac.id,2019,100020680,100020680,,,,,,,Ruteng,Indonesia,1629380,,,,,
,,Frederick A. Coller Surgical Society*en,active,nonprofit;funder,Coller Surgical Society*en;F.A. Coller Surgical Society*en,Frederick A. Coller Surgical Society*en,,https://collersociety.org,,collersociety.org,1947,100017482,100017482,,,,,,,Ann Arbor,United States,,,,,,
,,Australian Hand Therapy Association*en,active,nonprofit;funder,Australian Hand Therapy Association Inc.*en;Australian Hand Therapy Association Ltd*en,Australian Hand Therapy Association*en,AHTA,https://www.ahta.com.au,,ahta.com.au,1982,501100022872,501100022872,,,,,,,,Australia,,,,,,
,,Center for Engaged Scholarship*en,active,nonprofit;funder,The Center for Engaged Scholarship*en,Center for Engaged Scholarship*en,CES,https://cescholar.org,,cescholar.org,2014,100026046,100026046,,,,,,,Berkeley,United States,5327684,,,,,
,,Turkish National Union of Geodesy and Geophysics*en,active,nonprofit;funder,Türkiye Ulusal Jeodezi-Jeofizik Birliği*tr,Turkish National Union of Geodesy and Geophysics*en;Türkiye Ulusal Jeodezi ve Jeofizik Birliği*tr,TUJJB,https://www.tujjb.org.tr,,tujjb.org.tr,1968,501100011849,501100011849,,,,,,,Ankara,Türkiye,,,,https://ror.org/01jachm79,,
,,"DUSA Pharmaceuticals, Inc. (United States)",inactive,company;funder,DUSA Pharmaceuticals*en;DUSA*en,"DUSA Pharmaceuticals, Inc. (United States)",,https://www.dusapharma.com,https://en.wikipedia.org/wiki/DUSA_Pharmaceuticals,dusapharma.com,1991,100011026,100011026,,,,,,,Wilmington,United States,4955840,https://ror.org/030yyf771,,,,
,,Colorado Department of Agriculture*en,active,government;funder,CO Department of Agriculture*en;Colorado Dept. of Agriculture*en;State of Colorado Department Of Agriculture*en;Colorado State Department of Agriculture*en;CO Dept. of Agriculture*en;Departamento de Agricultura de Colorado*es,Colorado Department of Agriculture*en,CDA,https://ag.colorado.gov,,ag.colorado.gov,1949,100020294,100020294,,,,,,,Broomfield,United States,5415035,,,,,
,,Toyo Gosei Memorial Foundation*en,active,nonprofit;funder,,Toyo Gosei Memorial Foundation*en;公益財団法人 東洋合成記念財団*ja,,http://www.tgcfnd.or.jp,,tgcfnd.or.jp,2015,100030864,100030864,,,,,,,Ichikawa,Japan,,,,,,
,,Keep Memory Alive*en,active,nonprofit;funder,Keep Memory Alive Foundation*en,Keep Memory Alive*en,KMA,https://keepmemoryalive.org,,keepmemoryalive.org,1996,100030817,100030817,,,,,,,Las Vegas,United States,,https://ror.org/03xjacd83,,,,
,,Van Beuren Charitable Foundation*en,active,nonprofit;funder,Van Beuren Charitable Foundation Inc.*en;vBC Foundation*en,Van Beuren Charitable Foundation*en,VBCF,https://www.vbcfoundation.org,,vbcfoundation.org,1986,100029273,100029273,,,,,,,Newport,United States,5223593,,,,,
,,Center for East Asian Studies*en,active,education;funder,"Center for East Asian Studies at the University of Chicago*en;Center for East Asian Studies, University of Chicago*en;The Center for East Asian Studies*en",Center for East Asian Studies*en,CEAS,https://ceas.uchicago.edu,,ceas.uchicago.edu,1959,100023513,100023513,,,,,,,Chicago,United States,4887398,https://ror.org/024mw5h28,,,,
,,Cancer Research & Treatment Fund*en,active,nonprofit;funder,"Cancer Research and Treatment Fund*en;Cancer Research & Treatment Fund, Inc.*en",Cancer Research & Treatment Fund*en,CR&T,https://www.crt.org,,crt.org,1968,100032680,100032680,,,,,,,New York,United States,5128581,,,,,
,,Michael Cuccione Foundation*en,active,nonprofit;funder,,Michael Cuccione Foundation*en,MCF,https://www.childhoodcancerresearch.org,,childhoodcancerresearch.org,1997,501100023842,501100023842,,,,,,,Port Moody,Canada,,,,,,
,,South Carolina Commission on Higher Education*en,active,government;funder,The Commission on Higher Education*en,South Carolina Commission on Higher Education*en,SCCHE;CHE,https://che.sc.gov,,che.sc.gov,1967,100024256,100024256,,,,,,,Columbia,United States,4575352,,,,,
,,Mortar Board*en,active,nonprofit;funder,"Mortar Board, Inc.*en",Mortar Board*en,,https://mortarboard.org,,mortarboard.org,1918,100024304,100024304,,,,,,,Columbus,United States,4509177,,,,,
,,Intellectual Property Office*en,active,government;funder,,Intellectual Property Office*en,IPO,https://www.gov.uk/government/organisations/intellectual-property-office,https://en.wikipedia.org/wiki/Intellectual_Property_Office_(United_Kingdom),,1852,100012926,100012926,,,,,,,Newport,United Kingdom,2641598,https://ror.org/028z36n30,,,,
,,Arkansas Audubon Society*en,active,nonprofit;funder,Arkansas Audubon Society Inc*en,Arkansas Audubon Society*en,AAS,https://arbirds.org,,arbirds.org,1955,100031390,100031390,,,,,,,,United States,,,,,,
,,Coastal and Hydraulics Laboratory*en,active,facility;funder,Coastal & Hydraulics Laboratory*en,Coastal and Hydraulics Laboratory*en,CHL,https://www.erdc.usace.army.mil/Locations/CHL/,,,1996,100014049,100014049,,,,,,,Vicksburg,United States,4449620,https://ror.org/027mhn368,,,,
,,Social and Behavioral Sciences Research Institute*en,active,facility;funder,College of Social & Behavioral Sciences Research Institute*en;Social & Behavioral Sciences Research Institute*en,Social and Behavioral Sciences Research Institute*en,SBSRI,https://sbsri.sbs.arizona.edu,,sbsri.sbs.arizona.edu,,100022390,100022390,,,,,,,Tucson,United States,5318313,https://ror.org/03m2x1q45,,,,
,,MagVenture (Denmark),active,company;funder,MagVenture A/S;MagVenture Inc*en,MagVenture (Denmark);MagVenture*en,,https://magventure.com,,magventure.com,1992,100019447,100019447,,,,,,,Farum,Denmark,2622306,,,,,
,,Abdullah Gül University Foundation*en,active,nonprofit;funder,AGU Foundation*en;Abdullah Gul University Foundation*en,Abdullah Gül University Foundation*en;Abdullah Gül Üniversitesini Destekleme Vakfı*tr,AGÜV;AGUF,https://www.aguv.org.tr,,aguv.org.tr,2011,100010734,100010734,,,,,,,Kayseri,Türkiye,,,,https://ror.org/00zdyy359,,
,,Center for Emerging and Innovative Sciences*en,active,facility;funder,,Center for Emerging and Innovative Sciences*en,CEIS,https://www.ceis.rochester.edu,,ceis.rochester.edu,1992,100012430,100012430,,,,,,,Rochester,United States,5134086,https://ror.org/022kthw22,,,,
,,Maureen and Mike Mansfield Foundation*en,active,nonprofit;funder,Mansfield Foundation*en;MAUREEN & MIKE MANSFIELD FOUNDATION*en;맨스필드 재단*ko,Maureen and Mike Mansfield Foundation*en;The Maureen and Mike Mansfield Foundation*en;モーリーン・アンド・マイク・マンスフィールド財団*ja;모린 & 마이크 맨스필드 재단*ko,MMMF,https://mansfieldfdn.org,https://en.wikipedia.org/wiki/Maureen_and_Mike_Mansfield_Foundation,mansfieldfdn.org,1983,100027020,100027020,,,,,,,Washington,United States,4140963,,,,,
,,Yukon Foundation*en,active,nonprofit;funder,The Yukon Foundation*en,Yukon Foundation*en,,https://www.yukonfoundation.com,,yukonfoundation.com,1980,100021975,100021975,,,,,,,Whitehorse,Canada,6180550,,,,,
,,Local Government Association of South Australia*en,active,other;funder,LGA South Australia*en;Local Government Association of SA*en;LGA of SA*en,Local Government Association of South Australia*en,LGA SA;LGA,https://www.lga.sa.gov.au,,lga.sa.gov.au,1896,100032040,100032040,,,,,,,Adelaide,Australia,2078025,,,,,
,,Webb Memorial Trust*en,inactive,nonprofit;funder,THE WEBB MEMORIAL TRUST*en,Webb Memorial Trust*en,,http://www.webbmemorialtrust.org.uk,,webbmemorialtrust.org.uk,1947,100012344,100012344,,,,,,,,United Kingdom,,,,,,
,,Sphinx Organization*en,active,nonprofit;funder,"The Sphinx Organization*en;Sphinx Organization, Inc.*en",Sphinx Organization*en,Sphinx,https://www.sphinxmusic.org,,sphinxmusic.org,1997,100014353,100014353,,,,,,,Detroit,United States,,,,,,
,,BMO Harris Bank (United States),active,company;funder,"BMO Harris Bank, N.A.*en;BMO Harris*en;BMO","BMO Harris Bank (United States);BMO Bank, N.A.*en;BMO Harris Bank*en",,https://www.bmo.com,,bmo.com,1882,100017904,100017904,,,,,,,Chicago,United States,4887398,,,,,
,,Korean Society of Gastroenterology*en,active,nonprofit;funder,The Korea Society of Gastroenterology*en,Korean Society of Gastroenterology*en;대한소화기학회*ko,KSG,https://www.gastrokorea.org/eng/,,,1961,501100008962,501100008962,,,,,,,Seoul,South Korea,1835848,,,,,
,,Robert B. McMillen Foundation*en,active,nonprofit;funder,Robert B McMillen Foundation*en;The Robert B McMillen Foundation*en;McMillen Foundation*en,Robert B. McMillen Foundation*en,,https://mcmillenfoundation.org,,mcmillenfoundation.org,2004,100025343,100025343,,,,,,,Tucson,United States,5318313,,,,,
,,Sten K Johnson Foundation*en,active,nonprofit;funder,,Sten K Johnson Foundation*en;Sten K Johnsons stiftelse*sv,,https://www.stenkjohnsonsstiftelse.se,,stenkjohnsonsstiftelse.se,2012,501100021590,501100021590,,,,,,,Malmö,Sweden,2692969,,,,,
,,Fondation Philanthropia*en,active,nonprofit;funder,Philanthropia Foundation*en,Fondation Philanthropia*en,,https://www.fondationphilanthropia.org,,fondationphilanthropia.org,2008,100017729,100017729,,,,,,,Bellevue,Switzerland,,,,,,
,,Stiftung Universitätsmedizin Essen*de,active,nonprofit;funder,University Medical Center Essen*en,Stiftung Universitätsmedizin Essen*de,,https://www.universitaetsmedizin.de,,universitaetsmedizin.de,2006,501100010380,501100010380,,,,,,,Essen,Germany,2928810,,,,,
,,Ornithological Society of New Zealand*en,active,nonprofit;funder,"Birds New Zealand*en;The Ornithological Society of New Zealand Incorporated*en;BirdsNZ*en;The Ornithological Society of New Zealand*en;Ornithological Society of NZ, Inc.*en",Ornithological Society of New Zealand*en;Te Kāhui Mātai Manu o Aotearoa*mi,OSNZ,https://www.birdsnz.org.nz,https://en.wikipedia.org/wiki/Ornithological_Society_of_New_Zealand,birdsnz.org.nz,1940,501100023342,501100023342,,,,,,,Nelson,New Zealand,2186280,,,,,
,,Lotte und Adolf Hotz-Sprenger Stiftung*de,active,nonprofit;funder,Lotte and Adolf Hotz Sprenger Foundation*en,Lotte und Adolf Hotz-Sprenger Stiftung*de,LAHS,https://www.lahs-stiftung.ch,,lahs-stiftung.ch,2001,100018246,100018246,,,,,,,Thalwil,Switzerland,2658388,,,,,
,,Department of Justice Canada*en,active,government;funder,Department of Justice (Canada)*en;Justice Canada*en;Ministère de la Justice*fr,Department of Justice Canada*en;Ministère de la Justice Canada*fr,,https://www.justice.gc.ca/eng/,,,1868,100023253,100023253,,,,,,,Ottawa,Canada,6094817,https://ror.org/010q4q527,,,,
,,Salt River Project*en,active,government;funder,,Salt River Project*en,SRP,https://www.srpnet.com,https://en.wikipedia.org/wiki/Salt_River_Project,srpnet.com,1903,100024950,100024950,,,,,,,Tempe,United States,5317058,,,,,
,,Thure F och Karin Forsbergs Stiftelse*sv,active,nonprofit;funder,Thure F. and Karin Forsberg Foundation*en;Thure F. och Karin Forsbergs Stiftelse*sv,Thure F och Karin Forsbergs Stiftelse*sv;Thure F and Karin Forsberg Foundation*en,,https://www.forsbergsstiftelse.se,,forsbergsstiftelse.se,1983,501100007879,501100007879,,,,,,,Stockholm,Sweden,2673730,,,,,
,,Loterie Romande*fr,active,other;funder,,Loterie Romande*fr;Société de la Loterie de la Suisse Romande*fr,LORO,https://loro.ch,,loro.ch,1937,501100020310,501100020310,,,,,,,Lausanne,Switzerland,2659994,,,,,
,,National Institute for Nutrition and Health*en,active,government;funder,"National Institute for Nutrition and Health, Chinese Center for Disease Control and Prevention*en",National Institute for Nutrition and Health*en;中国疾病预防控制中心营养与健康所*zh,NINH,https://www.chinanutri.cn,,chinanutri.cn,1941,501100015672,501100015672,,,,,,,Beijing,China,1816670,https://ror.org/04wktzw65,,,,
,,Infectious Diseases Society for Obstetrics and Gynecology*en,active,nonprofit;funder,,Infectious Diseases Society for Obstetrics and Gynecology*en,IDSOG,https://www.idsog.org,,idsog.org,1973,100011169,100011169,,,,,,,Burnsville,United States,,,,,,
,,Hopper-Belmont Foundation*en,active,nonprofit;funder,Hopper Belmont Foundation*en,Hopper-Belmont Foundation*en,HBF,https://www.hopperbelmont.org,,hopperbelmont.org,2020,100018827,100018827,,,,,,,Cos Cob,United States,4831969,,,,,
,,Office of Community Oriented Policing Services*en,active,government;funder,Community Oriented Policing Services*en;COPS Office*en,Office of Community Oriented Policing Services*en,COPS,https://cops.usdoj.gov,,cops.usdoj.gov,1994,100013135,100013135,,,,,,,Washington,United States,4140963,https://ror.org/02916qm60,,,,
,,New Sunshine Charity Foundation*en,active,nonprofit;funder,"Beijing New Sunshine Charity Foundation*en;New Sunshine Charity Foundation, Beijing*en;Beijing New Sunshine Charity*en",New Sunshine Charity Foundation*en;北京新阳光慈善基金会*zh,NSCF,https://www.isun.org.cn,,isun.org.cn,2009,100020371,100020371,,,,,,,Beijing,China,,,,,,
,,DMC Foundation*en,inactive,nonprofit;funder,Health and Wellness Foundation*en;Health & Wellness Foundation of Greater Detroit*en,,,https://cfsem.org/organization/dmc-foundations/,,,2010,100017538,100017538,,,,,,,Detroit,United States,4990729,,,,,
,,Bruce J. Anderson Foundation*en,active,nonprofit;funder,Bruce J Anderson Foundation*en,Bruce J. Anderson Foundation*en,,https://www.tbf.org/nonprofits/grant-making-initiatives/anderson-foundation,,,1980,100018840,100018840,,,,,,,Boston,United States,4930956,https://ror.org/03t174c88,,,,
,,Congressional-Executive Commission on China*en,active,government;funder,Congressional Executive Commission on China*en,Congressional-Executive Commission on China*en,CECC,https://www.cecc.gov,https://en.wikipedia.org/wiki/Congressional-Executive_Commission_on_China,cecc.gov,2000,100023558,100023558,,,,,,,Washington,United States,4140963,https://ror.org/00k1mwv09,,,,
,,Barry Goldwater Scholarship and Excellence in Education Foundation*en,active,government;funder,Barry Goldwater Scholarship & Excellence in Education Foundation*en;The Barry Goldwater Scholarship and Excellence in Education Foundation*en;Barry M. Goldwater Scholarship and Excellence in Education Foundation*en,Barry Goldwater Scholarship and Excellence in Education Foundation*en,,https://goldwaterscholarship.gov,,goldwaterscholarship.gov,1986,100026294,100026294,,,,,,,Front Royal,United States,4760232,,,,,
,,Australian and New Zealand Bone and Mineral Society*en,active,nonprofit;funder,Australian & New Zealand Bone and Mineral Society*en;Australia and New Zealand Bone & Mineral Society*en;Australia and New Zealand Bone and Mineral Society*en,Australian and New Zealand Bone and Mineral Society*en,ANZBMS,https://anzbms.org.au,https://en.wikipedia.org/wiki/Australian_and_New_Zealand_Bone_and_Mineral_Society,anzbms.org.au,1988,501100022883,501100022883,,,,,,,Sydney,Australia,6619279,,,,,
,,National Association for Campus Activities*en,active,funder;nonprofit,National Entertainment Conference*en;National Entertainment and Campus Activities Association*en,National Association for Campus Activities*en,NACA;NEC;NECAA,https://www.naca.org,,naca.org,1960,100021843,100021843,,,,,,,Columbia,United States,4575352,,,,,
,,Pahernikova ustanova*sl,active,nonprofit;funder,,Pahernikova ustanova*sl;Pahernik Foundation*en,,https://www.pahernik.org,,pahernik.org,2005,100031121,100031121,,,,,,,Radlje ob Dravi,Slovenia,,,,,,
,,Serono Symposia International Foundation*en,active,nonprofit;funder,Fondation Serono Symposia International*fr;EXCEMED - Excellence in Medical Education*en,Serono Symposia International Foundation*en;Fondation EXCEMED*fr,SSIF,http://www.seronosymposia.org,,seronosymposia.org,1995,501100016301,501100016301,,,,,,,Geneva,Switzerland,2660646,,,,,
,,GRAMMY Museum Foundation*en,active,nonprofit;funder,"GRAMMY Museum Foundation, Inc.*en",GRAMMY Museum Foundation*en,GMF,https://grammymuseum.org,,grammymuseum.org,2008,100013974,100013974,,,,,,,Los Angeles,United States,5368361,,,,,
,,"Key Laboratory of Materials Modification by Laser, Ion and Electron Beams*en",active,facility;funder,"Key Laboratory of Three-Beam Material Modification, Ministry of Education*en;MOE Laboratory of Materials Modification by Laser, Ion and Electron Beams, DUT*en","Key Laboratory of Materials Modification by Laser, Ion and Electron Beams*en;三束材料改性教育部重点实验室*zh",MMLab,https://mmlab.dlut.edu.cn,,mmlab.dlut.edu.cn,1991,501100011375,501100011375,,,,,,,Dalian,China,1814087,https://ror.org/023hj5876,,,,
,,Community Foundation for Brevard*en,active,nonprofit;funder,"Community Foundation for Brevard, Inc.*en",Community Foundation for Brevard*en,CF Brevard;CFB,https://cfbrevard.org,,cfbrevard.org,1981,100022557,100022557,,,,,,,Melbourne,United States,4163971,,,,,
,,City of Missoula*en,active,government;funder,,City of Missoula*en,,https://www.ci.missoula.mt.us,,ci.missoula.mt.us,1885,100031420,100031420,,,,,,,Missoula,United States,5666639,,,,,
,,Sir Bobby Charlton Foundation*en,active,nonprofit;funder,The Sir Bobby Charlton Foundation*en,Sir Bobby Charlton Foundation*en,SBC Foundation,https://www.thesbcfoundation.org,,thesbcfoundation.org,2011,501100021275,501100021275,,,,,,,Manchester,United Kingdom,2643123,,,,,
,,Massachusetts Agricultural Experiment Station*en,active,facility;funder,Mass. Agricultural Experiment Station*en,Massachusetts Agricultural Experiment Station*en,MAES,https://www.umass.edu/agriculture-food-environment/research/mass-agricultural-experiment-station,,,1882,100019238,100019238,,,,,,,Amherst,United States,,https://ror.org/0072zz521,,,,
,,Greehey Family Foundation*en,active,nonprofit;funder,The Greehey Family Foundation*en,Greehey Family Foundation*en,GFF,https://greeheyfoundation.org,,greeheyfoundation.org,2003,100029180,100029180,,,,,,,San Antonio,United States,4726206,,,,,
,,Tokyo Center for Economic Research*en,active,nonprofit;funder,東京経済研究センター*ja,Tokyo Center for Economic Research*en;公益財団法人 東京経済研究センター*ja,TCER,https://www.tcer.or.jp,,tcer.or.jp,1959,501100009428,501100009428,,,,,,,Tokyo,Japan,,,,,,
,,NASPA—Student Affairs Administrators in Higher Education*en,active,nonprofit;funder,National Association of Student Personnel Administrators*en;Conference of Deans and Advisers of Men*en;National Association of Deans and Advisers of Men*en,NASPA—Student Affairs Administrators in Higher Education*en,NASPA;CDAM;NADAM,https://www.naspa.org,,naspa.org,1919,100022030,100022030,,,,,,,Washington,United States,4140963,,,,,
,,Williams Institute*en,active,facility;funder,The Williams Institute*en;The Williams Institute at UCLA School of Law*en;Williams Project*en,Williams Institute*en;Williams Institute on Sexual Orientation and Gender Identity Law and Public Policy*en,,https://williamsinstitute.law.ucla.edu,,williamsinstitute.law.ucla.edu,2001,100023815,100023815,,,,,,,Los Angeles,United States,5368361,https://ror.org/046rm7j60,,,,
,,International Organisation of Vine and Wine*en,active,government;funder,Internationale Organisation für Rebe und Wein*de;Organización Internacional de la Viña y el Vino*es;Organizzazione Internazionale della Vigna e del Vino*it,International Organisation of Vine and Wine*en;Organisation Internationale de la Vigne et du Vin*fr,OIV,https://www.oiv.int,,oiv.int,2004,501100011953,501100011953,,,,,,,Dijon,France,3021372,,,,,
,,Australian and New Zealand Academy of Management*en,active,nonprofit;funder,Australian & New Zealand Academy of Management*en;Australian and New Zealand Academy of Management Limited*en,Australian and New Zealand Academy of Management*en,ANZAM,https://www.anzam.org,https://en.wikipedia.org/wiki/Australia_and_New_Zealand_Academy_of_Management,anzam.org,1985,501100020474,501100020474,,,,,,,,Australia,,,,,,
,,St Vincent's Curran Foundation*en,active,nonprofit;funder,The Paul and Elizabeth Curran Foundation*en,St Vincent's Curran Foundation*en,,https://www.supportstvincents.com.au,,supportstvincents.com.au,1984,501100023812,501100023812,,,,,,,Darlinghurst,Australia,2169378,,,,,
,,McKenna Claire Foundation*en,active,nonprofit;funder,The McKenna Claire Foundation*en,McKenna Claire Foundation*en,MCF,https://mckennaclairefoundation.org,,mckennaclairefoundation.org,2011,100018101,100018101,,,,,,,Huntington Beach,United States,,,,,,
,,Todd Foundation*en,active,nonprofit;funder,Todd Foundation NZ*en,Todd Foundation*en,,https://www.toddfoundation.org.nz,,toddfoundation.org.nz,1972,501100024222,501100024222,,,,,,,Wellington,New Zealand,2179537,,,,,
,,Military Crypto Research Center*en,active,facility;funder,Korea University Military Crypto Research Center*en,Military Crypto Research Center*en;암호연구센터*ko,MCRC;CRC,https://icsp.korea.ac.kr/icsp/research/CryptographicResearch.do,,,2017,100017354,100017354,,,,,,,Seoul,South Korea,1835848,https://ror.org/047dqcg40,,,,
,,Pharmacy Quality Alliance*en,active,nonprofit;funder,PQA Inc.*en,Pharmacy Quality Alliance*en,PQA,https://www.pqa.org,,pqa.org,2006,100031815,100031815,,,,,,,Alexandria,United States,4744091,,,,,
,,Australian and New Zealand Forensic Science Society*en,active,nonprofit;funder,Australian & New Zealand Forensic Science Society*en;Australian & New Zealand Forensic Science Society Inc*en;Australian Forensic Society*en,Australian and New Zealand Forensic Science Society*en,ANZFSS;AFS,https://anzfss.org.au,,anzfss.org.au,1971,100031111,100031111,,,,,,,,Australia,,,,,,
,,BTL Industries (United States),active,company;funder,"BTL Industries, Inc.*en",BTL Industries (United States);BTL Industries*en,,https://www.btlnet.com,,btlnet.com,1993,100024883,100024883,,,,,,,Marlborough,United States,4943170,,,,,
,,Center for Advanced Bioenergy and Bioproducts Innovation*en,active,facility;funder,U.S. Department of Energy Center for Advanced Bioenergy and Bioproducts Innovation*en;DOE Center for Advanced Bioenergy and Bioproducts Innovation*en,Center for Advanced Bioenergy and Bioproducts Innovation*en,CABBI,https://cabbi.bio,,cabbi.bio,2017,100032860,100032860,,,,,,,Urbana,United States,4914570,https://ror.org/01bj3aw27,,,,
,,Stiftelsen Bundy Academy*sv,active,nonprofit;funder,Bundy Academy Foundation*en;Eva och Göran Bundys stiftelse för medicinsk forskning vid Lunds universitet*sv,Stiftelsen Bundy Academy*sv;Bundy Academy*en,,https://www.medicin.lu.se/samverkan/stiftelser/bundy-academy,,,2013,501100021728,501100021728,,,,,,,Lund,Sweden,,,,,,
,,Sealy & Smith Foundation*en,active,nonprofit;funder,Sealy and Smith Foundation*en;The Sealy & Smith Foundation*en,Sealy & Smith Foundation*en,,https://sealy-smith-foundation.org,,sealy-smith-foundation.org,1922,100019231,100019231,,,,,,,Galveston,United States,4693002,,,,,
,,International Whaling Commission*en,active,government;funder,The International Whaling Commission*en;Comision Ballenera Internacional*es;Commission Baleiniere Internationale*fr,International Whaling Commission*en,IWC;CBI,https://iwc.int,,iwc.int,1946,100032273,100032273,,,,,,,Cambridge,United Kingdom,2653941,,,,,
,,Quimby Family Foundation*en,active,nonprofit;funder,The Quimby Family Foundation*en,Quimby Family Foundation*en,QFF,https://www.quimbyfamilyfoundation.org,,quimbyfamilyfoundation.org,2004,100029228,100029228,,,,,,,Portland,United States,,,,,,
,,Sall Family Foundation*en,active,nonprofit;funder,,Sall Family Foundation*en,SFF,https://sallfamily.org,,sallfamily.org,1992,100007098,100007098,,,,,,,Cary,United States,4459467,,,,,
,,Australian Teacher Education Association*en,active,nonprofit;funder,,Australian Teacher Education Association*en,ATEA,https://atea.edu.au,,atea.edu.au,1988,501100020478,501100020478,,,,,,,,Australia,,,,,,
,,Jonas Foundation*en,active,nonprofit;funder,The Jonas Foundation*en,Jonas Foundation*en;Fondation Jonas*fr,,https://www.jonasfoundation.org,,jonasfoundation.org,2003,501100021739,501100021739,,,,,,,Bioley-Magnoux,Switzerland,,,,,,
,,Oregon Department of Forestry*en,active,government;funder,,Oregon Department of Forestry*en,ODF,https://www.oregon.gov/odf/,,,1911,100030069,100030069,,,,,,,Salem,United States,5750162,,,,,
,,Dr. N. Radhakrishnan Foundation for Research on Venous Diseases,active,funder;nonprofit,Dr. N. Radhakrishnan Foundation;Dr N Radhakrishnan Foundation;Dr N Radhakrishnan Foundation for Research on Venous Diseases,,,https://drradhakrishnan.com,,drradhakrishnan.com,2012,501100008910,501100008910,,,,,,,Changanassery,India,1274664,,,,,
