html_url,id,names.types.ror_display,status,types,names.types.alias,names.types.label,names.types.acronym,links.type.website,links.type.wikipedia,domains,established,external_ids.type.fundref.all,external_ids.type.fundref.preferred,external_ids.type.grid.all,external_ids.type.grid.preferred,external_ids.type.isni.all,external_ids.type.isni.preferred,external_ids.type.wikidata.all,external_ids.type.wikidata.preferred,city,country,locations.geonames_id,relationships.type.parent,relationships.type.child,relationships.type.related,relationships.type.successor,relationships.type.predecessor
,,Lucius N. Littauer Foundation*en,active,nonprofit;funder,"Lucius N. Littauer Foundation, Inc.*en;The Lucius N. Littauer Foundation*en;The Lucius N. Littauer Foundation, Inc.*en;The Lucius N Littauer Foundation Inc*en;Littauer Foundation*en",Lucius N. Littauer Foundation*en,LNL,https://www.littauerfoundation.org,,littauerfoundation.org,1929,100014133,100014133,,,,,,,New York,United States,,,,,,
,,"Japanese Society of Wound, Ostomy, and Continence Management*en",active,nonprofit;funder,"Japanese Society of Wound, Ostomy and Continence Management*en;Japanese Society of Wound, Ostomy & Continence Management*en","Japanese Society of Wound, Ostomy, and Continence Management*en;一般社団法人 日本創傷・オストミー・失禁管理学会*ja",JWOCM,https://jwocm.org,,jwocm.org,2009,100020181,100020181,,,,,,,Tokyo,Japan,1850147,,,,,
,,True Patriot Love Foundation*en,active,nonprofit;funder,True Patriot Love*en,True Patriot Love Foundation*en;La Fondation Les Fleurons glorieux*fr,TPL,https://truepatriotlove.com,,truepatriotlove.com,2009,100023483,100023483,,,,,,,Toronto,Canada,6167865,,,,,
,,Trauma and Orthopaedics Research Charity*en,active,nonprofit;funder,Trauma & Orthopaedics Research Charity*en;Trauma and Orthopaedics Research Charity Northern Ireland*en;Belfast Arthroplasty Research Trust*en,Trauma and Orthopaedics Research Charity*en,TORC,https://torcni.org,,torcni.org,2002,501100023966,501100023966,,,,,,,Belfast,United Kingdom,2655984,,,,,
,,Society for a Science of Clinical Psychology*en,active,nonprofit;funder,,Society for a Science of Clinical Psychology*en,SSCP,https://sscpweb.org,,sscpweb.org,1966,100029587,100029587,,,,,,,,United States,,,,,,
,,Patrick and Aimee Butler Family Foundation*en,active,nonprofit;funder,Butler Family Foundation*en;Patrick & Aimee Butler Family Foundation*en;THE PATRICK AND AIMEE BUTLER FAMILY FOUNDATION*en,Patrick and Aimee Butler Family Foundation*en,PABFF,https://www.butlerfamilyfoundation.org,,butlerfamilyfoundation.org,1951,100013820,100013820,,,,,,,Saint Paul,United States,5045360,,,,,
,,Wood Library-Museum of Anesthesiology*en,active,archive;funder,The Wood Library-Museum of Anesthesiology*en;Wood Library-Museum*en,Wood Library-Museum of Anesthesiology*en,WLM,https://www.woodlibrarymuseum.org,https://en.wikipedia.org/wiki/Wood_Library-Museum_of_Anesthesiology,woodlibrarymuseum.org,1933,100028881,100028881,,,,,,,Schaumburg,United States,4910713,https://ror.org/03g3kfn65,,,,
,,Aziz Foundation*en,active,nonprofit;funder,The Aziz Foundation*en;AzizFoundation,Aziz Foundation*en,,https://www.azizfoundation.org.uk,,azizfoundation.org.uk,2015,501100022769,501100022769,,,,,,,London,United Kingdom,2643743,,,,,
,,American Society of Plumbing Engineers*en,active,nonprofit;funder,,American Society of Plumbing Engineers*en,ASPE,https://aspe.org,,aspe.org,1964,100026121,100026121,,,,,,,Rosemont,United States,4908179,,,,,
,,BOMU Wellness Foundation*en,active,nonprofit;funder,Shiono Wellness Foundation*en;公益財団法人シオノ健康財団*ja;一般財団法人シオノ健康財団*ja,BOMU Wellness Foundation*en;公益財団法人BOMU健康財団*ja,,https://bomu.or.jp,,bomu.or.jp,2016,100020182,100020182,,,,,,,Yaizu,Japan,1848774,,,,,
,,AgelessRx (United States),active,company;funder,Ageless RX*en,AgelessRx (United States);AgelessRx*en,,https://agelessrx.com,,agelessrx.com,2019,100031625,100031625,,,,,,,Ann Arbor,United States,4984247,,,,,
,,Association of Fundraising Professionals*en,active,nonprofit;funder,AFP Global*en,Association of Fundraising Professionals*en,AFP,https://afpglobal.org,,afpglobal.org,1960,100023801,100023801,,,,,,,Arlington,United States,4744709,,,,,
,,New Hampshire Charitable Foundation*en,active,nonprofit;funder,NH Charitable Foundation*en;Fondation caritative du New Hampshire*fr;Dobrotvorna fondacija New Hampshirea*hr,New Hampshire Charitable Foundation*en;新罕布什尔州慈善基金会*zh;مؤسسة نيو هامبشاير الخيرية*ar,NHCF,https://www.nhcf.org,,nhcf.org,1962,100021462,100021462,,,,,,,Concord,United States,5084868,,,,,
,,Fondazione Banca Popolare di Lodi*it,active,nonprofit;funder,Banca Popolare di Lodi Foundation*en,Fondazione Banca Popolare di Lodi*it,,https://www.fondazionebipielle.it,,fondazionebipielle.it,2008,501100009628,501100009628,,,,,,,Lodi,Italy,3174638,,,,,
,,Niagara Community Foundation*en,active,nonprofit;funder,The Niagara Community Foundation*en,Niagara Community Foundation*en;Fondation communautaire de Niagara*fr,NCF,https://www.niagaracommunityfoundation.org,,niagaracommunityfoundation.org,2000,100021901,100021901,,,,,,,St. Catharines,Canada,6155721,,,,,
,,Ventura County Community Foundation*en,active,nonprofit;funder,The Ventura County Community Foundation*en;Ventura Foundation*en;Ventura County Gemeinschaftsstiftung*de;Fondation communautaire du comté de Ventura*fr;Fundación Comunitaria del Condado de Ventura*es,Ventura County Community Foundation*en;ベンチュラ郡コミュニティ財団*ja,VCCF,https://vccf.org,,vccf.org,1987,100029545,100029545,,,,,,,Camarillo,United States,5333180,,,,,
,,Marianne und Dr. Fritz Walter Fischer-Stiftung*de,active,nonprofit;funder,,Marianne und Dr. Fritz Walter Fischer-Stiftung*de;Marianne and Dr. Fritz Walter Fischer Foundation*en,,https://www.deutsches-stiftungszentrum.de/stiftungen/marianne-und-dr-fritz-walter-fischer-stiftung,,,1992,100031254,100031254,,,,,,,,Germany,,,,,,
,,SEW-EURODRIVE Foundation*en,active,nonprofit;funder,SEW-EURODRIVE-Foundation*en,SEW-EURODRIVE Foundation*en;SEW-EURODRIVE-Stiftung*de,,https://www.sew-eurodrive-stiftung.de,,sew-eurodrive-stiftung.de,1989,501100011726,501100011726,,,,,,,Bruchsal,Germany,,,,https://ror.org/03g3xrr94,,
,,British Association for Sexual Health and HIV*en,active,nonprofit;funder,The British Association for Sexual Health and HIV*en;British Association for Sexual Health & HIV*en,British Association for Sexual Health and HIV*en,BASHH,https://www.bashh.org,,bashh.org,2003,100013492,100013492,,,,,,,London,United Kingdom,2643743,,,,,
,,Central Australian Aboriginal Congress*en,active,healthcare;funder,Central Australian Aboriginal Congress Aboriginal Corporation*en,Central Australian Aboriginal Congress*en,CAAC;CAACongress,https://www.caac.org.au,,caac.org.au,1973,501100025311,501100025311,,,,,,,Alice Springs,Australia,2077895,,,,,
,,Stranahan Foundation*en,active,nonprofit;funder,The Stranahan Foundation*en,Stranahan Foundation*en,SF,https://www.stranahanfoundation.org,,stranahanfoundation.org,1944,100012718,100012718,,,,,,,Toledo,United States,,,,,,
,,United Way of Greater Cincinnati*en,active,nonprofit;funder,United Way Greater Cincinnati*en,United Way of Greater Cincinnati*en,UWGC,https://www.uwgc.org,,uwgc.org,1915,100026966,100026966,,,,,,,Cincinnati,United States,,,,https://ror.org/02ccnn750,,
,,Northern Territory Primary Health Network*en,active,nonprofit;funder,NT Primary Health Network*en;Primary Health Network for the Northern Territory*en;Northern Territory PHN*en,Northern Territory Primary Health Network*en;Health Network Northern Territory Ltd*en,NT PHN;PHN,https://ntphn.org.au,,ntphn.org.au,2015,100020130,100020130,,,,,,,Darwin,Australia,2073124,,,,,
,,Government of Pudong New Area*en,active,government;funder,Pudong New Area Government*en;Shanghai Pudong New Area People's Government*en;Pudong New District People's Government*en,Government of Pudong New Area*en;上海市浦东新区人民政府*zh,,https://www.pudong.gov.cn,,pudong.gov.cn,1993,100015792,100015792,,,,,,,Shanghai,China,1796236,https://ror.org/05xp2yp46,,,,
,,Charitable Leadership Foundation*en,inactive,nonprofit;funder,,Charitable Leadership Foundation*en,CLF,http://www.charitableleadership.org,,charitableleadership.org,1996,100008166,100008166,,,,,,,Clifton Park,United States,,,,,,
,,Society of Critical Care Anesthesiologists*en,active,nonprofit;funder,American Society of Critical Care Anesthesiologists*en,Society of Critical Care Anesthesiologists*en,SOCCA;ASCCA,https://www.socca.org,,socca.org,1986,100013332,100013332,,,,,,,Milwaukee,United States,5263045,,,https://ror.org/03g3kfn65,,
,,Teknofil (Turkey),active,company;funder,TEKNOFIL Ltd*en,Teknofil (Turkey);Teknofil Limited Company*en;Teknofil Limited Şirketi*tr;Teknofil*en,,https://www.teknofil.com.tr,,teknofil.com.tr,1994,501100008894,501100008894,,,,,,,Istanbul,Türkiye,,,,,,
,,Alport Foundation of Australia*en,active,nonprofit;funder,Alport Foundation of Australia Limited*en,Alport Foundation of Australia*en,,https://www.alportaustralia.com,,alportaustralia.com;alport.org.au,2008,501100020472,501100020472,,,,,,,,Australia,,,,,,
,,Swiss Lung Foundation*en,active,nonprofit;funder,Fondation Pulmonaire Suisse*fr;Fondazione Polmonare Svizzera*it,Swiss Lung Foundation*en;Schweizerische Lungenstiftung*de,,https://swisslung.org,,swisslung.org,1988,501100022798,501100022798,,,,,,,Wald,Switzerland,7287524,,,,,
,,James Beard Foundation*en,active,nonprofit;funder,The James Beard Foundation*en,James Beard Foundation*en,JBF,https://www.jamesbeard.org,,jamesbeard.org,1986,100026324,100026324,,,,,,,New York,United States,5128581,,,,,
,,Cooperative Development Foundation*en,active,nonprofit;funder,Freedom Fund*en,Cooperative Development Foundation*en,CDF,https://www.cdf.coop,https://en.wikipedia.org/wiki/Cooperative_Development_Foundation,cdf.coop,1944,100029655,100029655,,,,,,,Washington,United States,4140963,,,,,
,,Avista Foundation*en,active,nonprofit;funder,The Avista Foundation*en,Avista Foundation*en,,https://www.avistafoundation.com,,avistafoundation.com,2002,100021355,100021355,,,,,,,Spokane,United States,5811696,,,,,
,,Lyle S. Hallman Foundation*en,active,nonprofit;funder,LS Hallman Foundation*en;The Lyle Shantz Hallman Charitable Foundation*en,Lyle S. Hallman Foundation*en,LSHF,https://www.lshallmanfdn.org,,lshallmanfdn.org,2003,100027398,100027398,,,,,,,Kitchener,Canada,5992996,,,,,
,,Xinjiang Second Medical College*en,active,education;funder,,Xinjiang Second Medical College*en;新疆第二医学院*zh,,https://www.xjsmc.edu.cn,,xjsmc.edu.cn,2021,100032480,100032480,,,,,,,Karamay,China,,,,,,
,,Episcopal Health Foundation*en,active,nonprofit;funder,The Episcopal Health Foundation*en;Episcopal Health Fdn*en,Episcopal Health Foundation*en,EHF,https://www.episcopalhealth.org,,episcopalhealth.org,2013,100019234,100019234,,,,,,,Houston,United States,4699066,,,,,
,,Indiana Retired Teachers Association*en,active,nonprofit;funder,,Indiana Retired Teachers Association*en,IRTA,https://www.retiredteachers.org,,retiredteachers.org,1950,100026132,100026132,,,,,,,Plainfield,United States,4263108,,,,,
,,James S. Bower Foundation*en,active,nonprofit;funder,James S Bower Foundation*en;The James S. Bower Foundation*en,James S. Bower Foundation*en,,https://www.jsbowerfoundation.org,,jsbowerfoundation.org,1989,100025405,100025405,,,,,,,Santa Barbara,United States,5392952,,,,,
,,Golf Course Superintendents Association of America*en,active,nonprofit;funder,The Golf Course Superintendents Association of America*en;Golf Course Superintendents Assoc Of America*en,Golf Course Superintendents Association of America*en,GCSAA,https://www.gcsaa.org,,gcsaa.org,1926,100018111,100018111,,,,,,,Lawrence,United States,4274277,,,,,
,,Lanzhou Institute of Arid Meteorology*en,active,funder;other,"Lanzhou Municipal Institute of Arid Meteorology, China Meteorological Administration*en;Institute of Arid Meteorology, China Meteorological Administration*en;Institute of Arid Meteorology, CMA, Lanzhou*en",Lanzhou Institute of Arid Meteorology*en;中国气象局兰州干旱气象研究所*zh,LIAM,http://gs.cma.gov.cn/zfxxgk/zwgk/jgyzn/jgsz/zsdw/202008/t20200817_4464964.html,,,,501100011518,501100011518,,,,,,,Lanzhou,China,1808926,https://ror.org/00bx3rb98,,,,
,,"Carl C. Anderson, Sr. and Marie Jo Anderson Charitable Foundation*en",active,nonprofit;funder,Carl C. Anderson Sr. & Marie Jo Anderson Charitable Foundation*en,"Carl C. Anderson, Sr. and Marie Jo Anderson Charitable Foundation*en",,https://theandersonfoundation.org,,theandersonfoundation.org,1968,100010469,100010469,,,,,,,Dallas,United States,,,,,,
,,GC Rieber Fondene*no,active,nonprofit;funder,GC Rieber Foundation*en;GC Rieber;G.C. Rieber Foundation*en,GC Rieber Fondene*no;The GC Rieber Foundations*en,,https://www.gcrieber-fondene.no,,gcrieber-fondene.no,1929,501100022318,501100022318,,,,,,,Bergen,Norway,3161732,,,,,
,,Djavad Mowafaghian Centre for Brain Health*en,active,facility;funder,DMCBrainHealth*en;The Djavad Mowafaghian Centre*en,Djavad Mowafaghian Centre for Brain Health*en,DMCBH,https://www.centreforbrainhealth.ca,,centreforbrainhealth.ca,2014,501100025249,501100025249,,,,,,,Vancouver,Canada,6173331,https://ror.org/03rmrcq20,,,,
,,TESOL International Association*en,active,nonprofit;funder,Teachers of English to Speakers of Other Languages International Association*en;Teachers of English to Speakers of Other Languages*en,TESOL International Association*en,TESOL,https://www.tesol.org,,tesol.org,1966,100026623,100026623,,,,,,,Alexandria,United States,4744091,,,,,
,,Research Center for Green Science*en,active,facility;funder,Green Science Research Center*en;Fukuyama University Green Science Research Center*en,Research Center for Green Science*en;グリーンサイエンス研究センター*ja,GSRC,https://www.fukuyama-u.ac.jp/research/green-science-cet/,,,2004,501100013453,501100013453,,,,,,,Fukuyama,Japan,,https://ror.org/00mrjbj15,,,,
,,Community Foundation Sonoma County*en,active,nonprofit;funder,Sonoma County Community Foundation*en;Community Foundation Sonoma*en;Fundación Comunitaria del Condado de Sonoma*es,Community Foundation Sonoma County*en,CFSC,https://www.sonomacf.org,,sonomacf.org,1983,100026569,100026569,,,,,,,Santa Rosa,United States,5393287,,,,,
,,Queensland Ambulance Service*en,active,government;healthcare;funder,The Queensland Ambulance Service*en;Queensland Ambulance*en;Queensland Ambulance Service Transport Brigades*en;City Ambulance Transport Brigade*en;State of Queensland – Queensland Ambulance Service*en,Queensland Ambulance Service*en,QAS,https://www.ambulance.qld.gov.au,,ambulance.qld.gov.au,1991,100015674,100015674,,,,,,,Brisbane,Australia,,https://ror.org/00c1dt378,,,,
,,Walter and Louise Sutcliffe Foundation*en,active,nonprofit;funder,The Walter and Louise Sutcliffe Foundation*en;Walter & Louise Sutcliffe Foundation*en;Sutcliffe Foundation*en,Walter and Louise Sutcliffe Foundation*en,,https://www.wellsfargo.com/private-foundations/sutcliffe-foundation/,,,1990,100029938,100029938,,,,,,,St. Louis,United States,,,,,,
,,William I. H. and Lula E. Pitts Foundation*en,active,nonprofit;funder,The William I. H. and Lula E. Pitts Foundation*en;Pitts Foundation*en;The Pitts Foundation*en;William I. H. & Lula E. Pitts Foundation*en;Wm I H & Lula E Pitts Foundation*en;Wih and Lula E Pitts Foundation*en,William I. H. and Lula E. Pitts Foundation*en,,https://www.pittsfoundation.org,,pittsfoundation.org,1941,100029223,100029223,,,,,,,Atlanta,United States,4180439,,,,,
,,Etruscan Foundation*en,active,nonprofit;funder,The Etruscan Foundation*en,Etruscan Foundation*en,,https://www.etruscanfoundation.org,,etruscanfoundation.org,1959,100028632,100028632,,,,,,,New York,United States,5128581,,,,,
,,Mississippi Nurses Foundation*en,active,nonprofit;funder,Mississippi Nurses Foundation Inc*en,Mississippi Nurses Foundation*en,MNF,https://msnursesfoundation.com,,msnursesfoundation.com,1982,100022164,100022164,,,,,,,Madison,United States,4434663,,,,,
,,Sarah K. de Coizart Article TENTH Perpetual Charitable Trust*en,active,nonprofit;funder,Sarah K. de Coizart Perpetual Charitable Trust*en;Sarah K. DeCoizart Article TENTH Perpetual Charitable Trust*en;Sarah K. deCoizart Perpetual Charitable Trust*en;Sarah Decoizart Perpetual Charitable Trust*en;Sarah K Decoizart Perpetual Charitable Tr Art 10*en,Sarah K. de Coizart Article TENTH Perpetual Charitable Trust*en,,https://www.jpmorgan.com/private-bank/foundations/decoizart,,,1992,100001576,100001576,,,,,,,Chicago,United States,,,,,,
,,Shaanxi Key Laboratory of Surface Engineering and Remanufacturing*en,active,facility;funder,Shaanxi Provincial Key Laboratory of Surface Engineering and Remanufacturing*en,Shaanxi Key Laboratory of Surface Engineering and Remanufacturing*en;陕西省表面工程与再制造重点实验室*zh,SER,http://ser.xawl.edu.cn,,ser.xawl.edu.cn,2014,501100014891,501100014891,,,,,,,Xi'an,China,1790630,https://ror.org/01zzmf129,,,,
,,Illuminating Engineering Society*en,active,nonprofit;funder,Illuminating Engineering Society of North America*en;The IES*en;Illuminating Engineering Soc*en,Illuminating Engineering Society*en,IES;IESNA,https://ies.org,,ies.org,1906,100014306,100014306,,,,,,,New York,United States,,,,,,
,,Liberty Mutual Insurance (United States),active,company;funder,Liberty Mutual Insurance Company*en,Liberty Mutual Insurance (United States);Liberty Mutual Insurance*en,,https://www.libertymutual.com,https://en.wikipedia.org/wiki/Liberty_Mutual,libertymutual.com;libertymutualgroup.com,1912,100025219,100025219,,,,,,,Boston,United States,4930956,,,,,
,,Wood Buffalo Environmental Association*en,active,nonprofit;funder,,Wood Buffalo Environmental Association*en,WBEA,https://wbea.org,,wbea.org,1997,501100019964,501100019964,,,,,,,Fort McMurray,Canada,5955895,,,,,
,,European Cystic Fibrosis Society*en,active,nonprofit;funder,European CF Society*en,European Cystic Fibrosis Society*en,ECFS,https://www.ecfs.eu,,ecfs.eu,1997,100022854,100022854,,,,,,,Karup,Denmark,2619068,,,,,
,,Kenya Education Network*en,active,nonprofit;funder,Kenya Education Network Trust*en,Kenya Education Network*en,KENET,https://www.kenet.or.ke,,kenet.or.ke,1999,100031972,100031972,,,,,,,Nairobi,Kenya,184745,,,,,
,,Field Naturalists Society of South Australia*en,active,nonprofit;funder,Field Naturalists Society of South Australia Inc.*en;Field Naturalists' Society of South Australia*en;SA Field Naturalists Society Inc.*en,Field Naturalists Society of South Australia*en,FNSSA,https://www.fnssa.org.au,,fnssa.org.au,1883,501100023474,501100023474,,,,,,,Adelaide,Australia,2078025,,,,,
,,United Kingdom Literacy Association*en,active,nonprofit;funder,UK Literacy Association*en;United Kingdom Reading Association*en,United Kingdom Literacy Association*en,UKLA,https://ukla.org,,ukla.org,1963,100031662,100031662,,,,,,,Leicester,United Kingdom,2644668,,,,,
,,The Morris Family Foundation*en,active,nonprofit;funder,Morris Family Foundation*en,The Morris Family Foundation*en,,https://themorrisfamilyfoundation.com,,themorrisfamilyfoundation.com,1990,100025353,100025353,,,,,,,Nashville,United States,4644585,,,,,
,,icotec ag (Switzerland),active,company;funder,Icotec*en,icotec ag (Switzerland);icotec ag*en,,https://www.icotec-medical.com,,icotec-medical.com,1999,501100023797,501100023797,,,,,,,Altstätten,Switzerland,2661766,,,,,
,,National Interagency Fire Center*en,active,government;funder,,National Interagency Fire Center*en,NIFC,https://www.nifc.gov,,nifc.gov,1965,100014563,100014563,,,,,,,Boise,United States,5586437,,,,,
,,El Pomar Foundation*en,active,nonprofit;funder,El Pomar*en;Fundación El Pomar*es,El Pomar Foundation*en,,https://elpomar.org,,elpomar.org,1937,100012751,100012751,,,,,,,Colorado Springs,United States,,,,,,
,,Brain Rehabilitation Research Center*en,active,facility;funder,RR&D Brain Rehabilitation Research Center*en,Brain Rehabilitation Research Center*en,BRRC,https://www.brrc.research.va.gov,,brrc.research.va.gov,1999,100015215,100015215,,,,,,,Gainesville,United States,4156404,,,,,
,,Fox Family Foundation*en,active,nonprofit;funder,"Robert A. Fox Family Charitable Foundation*en;The Fox Family Foundation*en;Fox Family Foundation, Inc.*en",Fox Family Foundation*en,FFF,https://www.foxgiving.org,,foxgiving.org,2017,100016854,100016854,,,,,,,Jupiter,United States,4160610,,,,,
,,Stiftelsen för Medicinsk Forskning i Skellefteå*sv,active,nonprofit;funder,The Foundation for Medical Research in Skellefteå*en,Stiftelsen för Medicinsk Forskning i Skellefteå*sv,,https://medforskskelet.wordpress.com,,medforskskelet.wordpress.com,1984,501100009795,501100009795,,,,,,,Skellefteå,Sweden,602913,,,,,
,,Geneseo Foundation*en,active,nonprofit;funder,"The Geneseo Foundation*en;Geneseo Foundation, Inc.*en;Geneseo Foundation Inc.*en",Geneseo Foundation*en,,https://www.geneseo.edu/support/geneseo-foundation/,,,1971,100019372,100019372,,,,,,,Geneseo,United States,5118379,,,https://ror.org/03g1q6c06,,
,,Midwest Regional Turf Foundation*en,active,nonprofit;funder,The Midwest Regional Turf Foundation*en,Midwest Regional Turf Foundation*en,MRTF,https://mrtf.org,,mrtf.org,1945,100017216,100017216,,,,,,,West Lafayette,United States,4928096,,,,,
,,Liverpool University Hospitals NHS Foundation Trust*en,active,healthcare;funder,,Liverpool University Hospitals NHS Foundation Trust*en,LUHFT,https://www.uhliverpool.nhs.uk,,uhliverpool.nhs.uk,2019,501100021117,501100021117,,,,,,,Liverpool,United Kingdom,2644210,,,,,https://ror.org/02h67vt10;https://ror.org/009sa0g06
,,South West Water (United Kingdom),active,company;funder,South West Water Limited*en;South West Water Ltd*en,South West Water (United Kingdom),SWW,https://www.southwestwater.co.uk,,southwestwater.co.uk,1989,501100024510,501100024510,,,,,,,Exeter,United Kingdom,2649808,https://ror.org/04e7jg064,,,,
,,MedEvac Foundation International*en,active,nonprofit;funder,MedEvac Foundation*en,MedEvac Foundation International*en,MFI,https://medevacfoundation.org,,medevacfoundation.org,2000,100014329,100014329,,,,,,,Alexandria,United States,4744091,,,,,
,,Mattie Miracle Cancer Foundation*en,active,nonprofit;funder,Mattie Miracle*en,Mattie Miracle Cancer Foundation*en,MMCF,https://www.mattiemiracle.com,,mattiemiracle.com,2009,100031209,100031209,,,,,,,Arlington,United States,4744709,,,,,
,,European Society of Clinical Pharmacy*en,active,nonprofit;funder,The European Society of Clinical Pharmacy*en,European Society of Clinical Pharmacy*en,ESCP,https://escpweb.org,,escpweb.org,1979,501100011952,501100011952,,,,,,,Chaam,Netherlands,,,,,,
,,Directorate-General for Agriculture and Rural Development*en,active,government;funder,European Commission Directorate-General for Agriculture and Rural Development*en;DG for Agriculture and Rural Development*en;EU Directorate-General for Agriculture and Rural Development*en;Landbrug og udvikling af landdistrikter*da;Agriculture et développement rural*fr;Poľnohospodárstvo a rozvoj vidieka*sk,Directorate-General for Agriculture and Rural Development*en;Direction générale de l'agriculture et du développement rural*fr;Generaldirektion Landwirtschaft und ländliche Entwicklung*de;Dirección General de Agricultura y Desarrollo Rural*es;Generálne riaditeľstvo pre poľnohospodárstvo a rozvoj vidieka*sk,DG AGRI,https://agriculture.ec.europa.eu/index_en,https://en.wikipedia.org/wiki/Directorate-General_for_Agriculture_and_Rural_Development,,,100020657,100020657,,,,,,,Brussels,Belgium,2800866,https://ror.org/00k4n6c32,,,,
,,Idaho Department of Environmental Quality*en,active,government;funder,Idaho DEQ*en,Idaho Department of Environmental Quality*en,DEQ,https://www.deq.idaho.gov,https://en.wikipedia.org/wiki/Idaho_Department_of_Environmental_Quality,deq.idaho.gov,2000,100024551,100024551,,,,,,,Boise,United States,5586437,,,,,
,,Koios Medical (United States),active,company;funder,"Koios Medical Inc*en;Koios Medical, Inc.*en",Koios Medical (United States);Koios Medical*en,,https://koiosmedical.com,,koiosmedical.com,2012,100020254,100020254,,,,,,,New York,United States,,,,,,
,,The Scattergood Foundation*en,active,nonprofit;funder,Scattergood Foundation*en;Thomas Scattergood Behavioral Health Foundation*en;The Thomas Scattergood Foundation*en;Thomas Scattergood Foundation*en,The Scattergood Foundation*en,,https://www.scattergoodfoundation.org,,scattergoodfoundation.org,2005,100028837,100028837,,,,,,,Philadelphia,United States,4560349,,,,,
,,South Dakota Arts Council*en,active,government;funder,SD Arts Council*en;The South Dakota Arts Council*en,South Dakota Arts Council*en,SDAC,https://artscouncil.sd.gov,,artscouncil.sd.gov,1966,100014352,100014352,,,,,,,Pierre,United States,5767918,,,,,
,,California Victim Compensation Board*en,active,government;funder,CA Victim Compensation Board*en,California Victim Compensation Board*en,CalVCB,https://victims.ca.gov,https://en.wikipedia.org/wiki/California_Victim_Compensation_Board,victims.ca.gov,2016,100024334,100024334,,,,,,,Sacramento,United States,5389489,https://ror.org/030sa3819,,,,
,,Jiaxing Nanhu University*en,active,education;funder,"Nanhu College, Jiaxing University*en;Jiaxing University Nanhu College*en",Jiaxing Nanhu University*en;嘉兴南湖学院*zh,,https://www.jxnhu.edu.cn,,jxnhu.edu.cn,2020,501100014903,501100014903,,,,,,,Jiaxing,China,1805953,,,,,
,,Zhejiang Provincial Research Center for Cancer Intelligent Diagnosis and Molecular Technology*en,active,funder;facility,,Zhejiang Provincial Research Center for Cancer Intelligent Diagnosis and Molecular Technology*en;浙江省肿瘤智能诊断与分子技术诊治技术研究中心*zh,,https://www.zchospital.com/cn/scientific/platform/3796,,,2019,100020734,100020734,,,,,,,Hangzhou,China,1808926,,,,,
