html_url,id,names.types.ror_display,status,types,names.types.alias,names.types.label,names.types.acronym,links.type.website,links.type.wikipedia,domains,established,external_ids.type.fundref.all,external_ids.type.fundref.preferred,external_ids.type.grid.all,external_ids.type.grid.preferred,external_ids.type.isni.all,external_ids.type.isni.preferred,external_ids.type.wikidata.all,external_ids.type.wikidata.preferred,city,country,locations.geonames_id
https://github.com/ror-community/ror-updates/issues/15325,https://ror.org/001kxme72,Avantyx LLC (United States)*en,active,company,Avantyx Pharmaceuticals*en; Avantyx*en,Avantyx LLC (United States)*en; Avantyx LLC*en,,https://www.avantyxpharma.com,,avantyxpharma.com,2020,,,,,,,Q137778988,Q137778988,Miami,United States,4164138
https://github.com/ror-community/ror-updates/issues/16998,https://ror.org/02a1eyd35,The Pearl International Hospital*en,active,healthcare,Pearl International Hospital*en,The Pearl International Hospital*en; مستشفى اللؤلؤة الدولي*ar,,https://tpihospital.com,,tpihospital.com,2025,,,,,,,Q137765662,Q137765662,Doha,Qatar,290030
https://github.com/ror-community/ror-updates/issues/28512,https://ror.org/0410qm569,Universitas Bani Saleh*id,active,education,Sekolah Tinggi Manajemen Informatika dan Komputer Bani Saleh*id; STMIK Bani Saleh*id,Universitas Bani Saleh*id,UBS*id,https://ubs.ac.id,https://id.wikipedia.org/wiki/Sekolah_Tinggi_Manajemen_Informatika_dan_Komputer_Bani_Saleh,ubs.ac.id,1989,,,,,,,Q31173984,Q31173984,Bekasi,Indonesia,1649378
https://github.com/ror-community/ror-updates/issues/28516,https://ror.org/05m3f1s45,Netaji Nagar Day College*en,active,education,,Netaji Nagar Day College*en; নেতাজী নগর ডে কলেজ*bn; ನೇತಾಜಿ ನಗರ ಡೇ ಕಾಲೇಜ್*kn,NNDC*en,https://www.nndc.ac.in,https://en.wikipedia.org/wiki/Netaji_Nagar_Day_College,nndc.ac.in,1967,,,,,,,Q6998615,Q6998615,Kolkata,India,1275004
https://github.com/ror-community/ror-updates/issues/28548,https://ror.org/02rrh1r89,LifeLong Medical Care*en,active,healthcare,,LifeLong Medical Care*en,,https://lifelongmedical.org,,lifelongmedical.org,1976,,,,,,,Q137410911,Q137410911,Berkeley,United States,5327684
https://github.com/ror-community/ror-updates/issues/28555,https://ror.org/04xzpxc31,Hong Kong Centre for Logistics Robotics*en,active,facility; funder,,Hong Kong Centre for Logistics Robotics*en; 香港物流機械人研究中心*zh,HKCLR*en,https://www.hkclr.hk,,hkclr.hk,2020,100022832,100022832,,,,,,,Hong Kong,Hong Kong,1819729
https://github.com/ror-community/ror-updates/issues/26783,https://ror.org/02mqbpb72,Kaushalya the Skill University*en,active,education,,Kaushalya the Skill University*en,KSU*en,https://kaushalyaskilluniversity.ac.in,https://en.wikipedia.org/wiki/Kaushalya_Skill_University,kaushalyaskilluniversity.ac.in,2021,,,,,,,Q123003322,Q123003322,Ahembdabad,India,1279233
https://github.com/ror-community/ror-updates/issues/26777,https://ror.org/00nvd7q77,"Sanskriti University, Mathura*en",active,education,Sanskriti University*en,"Sanskriti University, Mathura*en",SU*en,https://www.sanskriti.edu.in,https://en.wikipedia.org/wiki/Sanskriti_University,edu.in,2016,,,,,0000 0005 0281 2560,0000 0005 0281 2560,Q30639323,Q30639323,Mathura,India,1263364
https://github.com/ror-community/ror-updates/issues/26772,https://ror.org/00zq1dy58,Forecasting Research Institute*en,active,nonprofit,,Forecasting Research Institute*en,FRI*en,https://forecastingresearch.org,,forecastingresearch.org,2022,,,,,,,Q122208275,Q122208275,Delaware,United States of America,4142224
https://github.com/ror-community/ror-updates/issues/26757,https://ror.org/02sk9xe88,Jain hospital*en,active,healthcare,Jain hospital & Research Centre*en,Jain hospital*en,,https://jainhospitals.com,,jainhospitals.com,2007,,,,,0000 0004 0613 6347,0000 0004 0613 6347,,,Kanpur,India,1267995
https://github.com/ror-community/ror-updates/issues/26749,https://ror.org/0126bwd54,Akademia Wojsk Lądowych imienia generała Tadeusza Kościuszki*pl,active,education,General Tadeusz Kościuszko Military University of Land Forces*en,Akademia Wojsk Lądowych imienia generała Tadeusza Kościuszki*pl,,https://www.wojsko-polskie.pl/awl/,,wojsko-polskie.pl,2002,,,,,,,Q7674488,Q7674488,Wrocław,Polska (Poland),3081368
https://github.com/ror-community/ror-updates/issues/26795,https://ror.org/01skj4p30,South African Population Research Infrastructure Network*en,active,government,,South African Population Research Infrastructure Network*en,SAPRIN*en,https://saprin.mrc.ac.za,https://en.wikipedia.org/wiki/South_African_Population_Research_Infrastructure_Network,saprin.mrc.ac.za,2017,,,,,,,Q130051477,Q130051477,Durban,South Africa,1007311
https://github.com/ror-community/ror-updates/issues/28587,https://ror.org/02w3ga484,Institute of Lutheran Theology*en,active,education,,Institute of Lutheran Theology*en,ILT*en,https://ilt.edu,https://en.wikipedia.org/wiki/Institute_of_Lutheran_Theology,ilt.edu,2009,,,,,,,Q65091076,Q65091076,Brookings,United States,5226534
https://github.com/ror-community/ror-updates/issues/26467,https://ror.org/00xvd0z96,Agrosystèmes territoires ressources Mirecourt*fr,active,facility,"ASTER Mirecourt*fr; AgroSystèmes TErritoires Ressources*fr; Département ACT Sciences pour l'action, les transitions, les territoires*fr",Agrosystèmes territoires ressources Mirecourt*fr,ACT-ASTER*fr; ASTER*fr,https://aster.nancy.hub.inrae.fr,,aster.nancy.hub.inrae.fr,1962,,,,,,,,,Mirecourt,France,2993728
https://github.com/ror-community/ror-updates/issues/25928,https://ror.org/03pveep22,"Univerzitet ""Privredna Akademija"" Brčko distrikt Bosne i Hercegovine*bs",active,education,"Univerzitet Privredna Akademija Brčko Distrikt BiH*bs; Univerzitet ""Privredna akademija"" Brčko Distrikt*bs","Univerzitet ""Privredna Akademija"" Brčko distrikt Bosne i Hercegovine*bs; University ""Economics Academy"" Brcko District of Bosnia and Herzegovina*en; Universität ""Wirtschaftsakademie"" Brcko distrikt BuH*de",UPA*bs,https://privrednaakademija.edu.ba,,privrednaakademija.edu.ba,,,,,,,,,,Brčko,Bosnia and Herzegovina,3203521
https://github.com/ror-community/ror-updates/issues/25946,https://ror.org/0546gbe85,Jigawa State College of Nursing Sciences*en,active,education,Jigawa State College of Nursing Science*en,Jigawa State College of Nursing Sciences*en,JISCONS*en,https://www.consbabura.edu.ng,,consbabura.edu.ng,,,,,,,,Q134291891,Q134291891,Babura,Nigeria,2348419
https://github.com/ror-community/ror-updates/issues/25968,https://ror.org/017e7nq37,Conservatoire d'espaces naturels des Hauts-de-France*fr,active,nonprofit,,Conservatoire d'espaces naturels des Hauts-de-France*fr,CEN HdF*fr,https://www.cen-hautsdefrance.org,https://fr.wikipedia.org/wiki/Conservatoire_d%27espaces_naturels_des_Hauts-de-France,cen-hautsdefrance.org,2020,,,,,,,Q130666973,Q130666973,Boves,France,3030659
https://github.com/ror-community/ror-updates/issues/25985,https://ror.org/052gr0y82,AIMS Research and Innovation Centre*en,active,education,African Institute for Mathematical Sciences (AIMS) Research and Innovation Centre*en; African Institute for Mathematical Sciences Research and Innovation Centre*en; AIMS Research & Innovation Centre*en,AIMS Research and Innovation Centre*en,AIMS RIC*en,https://www.aimsric.org,,aimsric.org,2023,,,,,,,,,Kigali,Rwanda,202061
https://github.com/ror-community/ror-updates/issues/25991,https://ror.org/03jsqye23,Barishal Engineering College*en,active,education,Barisal Engineering College*en,Barishal Engineering College*en; বরিশাল ইঞ্জিনিয়ারিং কলেজ*bn,BEC*en,https://bec.edu.bd,https://bn.wikipedia.org/wiki/%E0%A6%AC%E0%A6%B0%E0%A6%BF%E0%A6%B6%E0%A6%BE%E0%A6%B2_%E0%A6%87%E0%A6%9E%E0%A7%8D%E0%A6%9C%E0%A6%BF%E0%A6%A8%E0%A6%BF%E0%A6%AF%E0%A6%BC%E0%A6%BE%E0%A6%B0%E0%A6%BF%E0%A6%82_%E0%A6%95%E0%A6%B2%E0%A7%87%E0%A6%9C,bec.edu.bd,2018,,,,,,,Q25586925,Q25586925,Barishal,Bangladesh,1336137
https://github.com/ror-community/ror-updates/issues/25993,https://ror.org/00mmyvx69,Moving Magnet Technologies (France),active,company,,Moving Magnet Technologies (France); Moving Magnet Technologies*en,MMT*en,https://www.movingmagnet.com,,movingmagnet.com,1989,,,,,,,,,Besancon,France,3033123
https://github.com/ror-community/ror-updates/issues/25998,https://ror.org/02v324824,Centro Universitário FAMESC*pt,active,education,UniFAMESC*pt; Faculdade Metropolitana São Carlos*pt,Centro Universitário FAMESC*pt,FAMESC*pt,https://www.unifamesc.edu.br,,unifamesc.edu.br,2011,,,,,,,,,Bom Jesus do Itabapoana,Brazil,3469425
https://github.com/ror-community/ror-updates/issues/25999,https://ror.org/05tqdsh31,Houston Neuroscience Brain Center*en,active,healthcare,,Houston Neuroscience Brain Center*en,HNBC*en,https://www.hnbraincenter.com,,hnbraincenter.com,2019,,,,,,,,,Houston,United States,4699066
https://github.com/ror-community/ror-updates/issues/26000,https://ror.org/01q2py144,"Augustine University, Ilara*en",active,education,"Augustine University*en; Augustine University, Ilara-Epe, Lagos*en","Augustine University, Ilara*en",AUI*en,https://augustineuniversity.edu.ng,https://en.wikipedia.org/wiki/Augustine_University_Ilara,augustineuniversity.edu.ng,2015,,,,,0000 0004 7143 6717,0000 0004 7143 6717,Q21044489,Q21044489,Lagos,Nigeria,2332459
https://github.com/ror-community/ror-updates/issues/26001,https://ror.org/014q27p18,Belgrade Center for Digital Humanities*en,active,nonprofit,,Belgrade Center for Digital Humanities*en; Centar za digitalne humanističke nauke*sr,BCDH*en,https://humanistika.org,,humanistika.org,2008,,,,,,,,,Belgrade,Serbia,792680
https://github.com/ror-community/ror-updates/issues/26002,https://ror.org/00b029w83,STUDIA-Schlierbach Studienzentrum für internationale Analysen*de,active,nonprofit,STUDIA Austria*de; Schlierbach Studienzentrum für internationale Analysen*de,STUDIA-Schlierbach Studienzentrum für internationale Analysen*de,STUDIA*de,https://www.studia-austria.com,,studia-austria.com,1969,,,,,,,,,Schlierbach,Austria,2765894
https://github.com/ror-community/ror-updates/issues/26009,https://ror.org/02agj4404,Giannini Foundation of Agricultural Economics*en,active,funder,Giannini Foundation of Ag Econ*en,Giannini Foundation of Agricultural Economics*en,,https://giannini.ucop.edu,https://en.wikipedia.org/wiki/The_Giannini_Foundation_of_Agricultural_Economics,giannini.ucop.edu,1930,100009350,100009350,,,,,Q16994103,Q16994103,Davis,United States,5341704
https://github.com/ror-community/ror-updates/issues/26011,https://ror.org/039ws1812,Research Culture Society*en,active,nonprofit,RCS International Society*en,Research Culture Society*en,RCS*en,https://researchculturesociety.org,,researchculturesociety.org,2017,,,,,,,,,Vadodara; San Bernardino,India; USA,1253573; 5391710
https://github.com/ror-community/ror-updates/issues/26012,https://ror.org/02ya78342,Ragnar Frisch Centre for Economic Research*en,active,facility,Frischsenteret*no,Ragnar Frisch Centre for Economic Research*en; Stiftelsen Frischsenteret for samfunnsøkonomisk forskning*no,,https://frischsenteret.no,,frisch.uio.no; frischsenteret.no,,,,,,,,,,Oslo,Norway,3143244
https://github.com/ror-community/ror-updates/issues/26013,https://ror.org/04sqfaq74,Office for Victims of Crime*en,active,government; funder,,Office for Victims of Crime*en,OVC*en,https://ovc.ojp.gov,https://en.wikipedia.org/wiki/Office_for_Victims_of_Crime,ovc.ojp.gov,1988,100013138,100013138,,,0000 0004 0381 734X,0000 0004 0381 734X,Q7079166,Q7079166,Washington,United States,4140963
https://github.com/ror-community/ror-updates/issues/26014,https://ror.org/001jb9152,Instituto Superior Universitario Cotopaxi*es,active,education,Instituto Superior Tecnológico Cotopaxi*es,Instituto Superior Universitario Cotopaxi*es,ISUC*es,https://isuc.edu.ec,,isuc.edu.ec,2017,,,,,,,,,Latacunga,Ecuador,3654870
https://github.com/ror-community/ror-updates/issues/26039,https://ror.org/05rt4ed39,Sekolah Tinggi Ilmu Kesehatan Nasional*id,active,education,STIKES Nasional*id,Sekolah Tinggi Ilmu Kesehatan Nasional*id,,https://stikesnas.ac.id,https://id.wikipedia.org/wiki/Sekolah_Tinggi_Ilmu_Kesehatan_Nasional,stikesnas.ac.id,2016,,,,,0000 0004 8375 5379,0000 0004 8375 5379,Q109442098,Q109442098,Surakarta,Indonesia,1625812
https://github.com/ror-community/ror-updates/issues/26040,https://ror.org/04xcf6t74,Isa Kaita College of Education*en,active,education,,Isa Kaita College of Education*en,IKCOE*en,http://ikcoedm.edu.ng,,ikcoedm.edu.ng,1999,,,,,,,,,Dutsin-Ma,Nigeria,2344217
https://github.com/ror-community/ror-updates/issues/26016,https://ror.org/05kpxxt10,General Hospital Dr. Josip Benčević Slavonski Brod*en,active,healthcare,General Hospital Dr Josip Benčević*en; Opća Bolnica Dr. Josip Benčević*hr,General Hospital Dr. Josip Benčević Slavonski Brod*en; Opća Bolnica Dr. Josip Benčević Slavonski Brod*hr,,https://www.bolnicasb.hr,,bolnicasb.hr,,,,,,,,,,Slavonski Brod,Croatia,3190586
https://github.com/ror-community/ror-updates/issues/26534,https://ror.org/00ttfz090,Animal Health Institute*en,active,government,የእንስሳት ጤና እንስቲትዩት*am,Animal Health Institute*en,AHI*en,https://www.ahi.gov.et,,ahi.gov.et,2021,,,,,,,,,Sebeta,Ethiopia,329114
https://github.com/ror-community/ror-updates/issues/26042,https://ror.org/040mc9528,Floral Industry Innovation Center*en,active,government,,Floral Industry Innovation Center*en; 農業部花卉創新園區研究發展中心*zh,FIIC*en,https://www.fiic.gov.tw,,fiic.gov.tw,2025,,,,,,,,,Tainan,Taiwan,1668355
https://github.com/ror-community/ror-updates/issues/26921,https://ror.org/02j6qbz85,Sekolah Tinggi Agama Islam Muhammadiyah Tulungagung*id,active,education,STAI Muhammadiyah Tulungagung*id; STAIM Tulungagung*id,Sekolah Tinggi Agama Islam Muhammadiyah Tulungagung*id,STAIMTA*id,https://staimta.ac.id,,staimta.ac.id,1987,,,,,,,Q109913288,Q109913288,Tulungagung,Indonesia,1623080
https://github.com/ror-community/ror-updates/issues/26035,https://ror.org/04v9cqp75,"Gujarat Natural Farming Science University, Halol*en",active,education,,"Gujarat Natural Farming Science University, Halol*en",GNFSU*en,https://gnfsu.edu.in,,gnfsu.edu.in; goau.gujarat.gov.in,2017,,,,,,,,,Halol,India,1270474
https://github.com/ror-community/ror-updates/issues/28384,https://ror.org/027h8y606,"MUP Centar za forenzična ispitivanja, istraživanja i vještačenja ""Ivan Vučetić""*hr",active,facility,"Forensic Science Centre “Ivan Vučetić”*en; Centar za forenzična ispitivanja, istraživanja i vještačenja Ivan Vučetić*hr","MUP Centar za forenzična ispitivanja, istraživanja i vještačenja ""Ivan Vučetić""*hr; Ministry of the Interior, Forensic Science Centre ""Ivan Vučetić""*en",MUPCFIIV*hr,https://forenzika.gov.hr,,forenzika.gov.hr,1953,,,,,0000 0005 0181 0918,0000 0005 0181 0918,,,Zagreb,Croatia,3186886
https://github.com/ror-community/ror-updates/issues/26900,https://ror.org/00j0x4512,T.K.M Institute of Technology*en,active,education,TKM Institute of Technology*en; Thangal Kunju Musaliar Institute of Technology*en,T.K.M Institute of Technology*en,TKMIT*en,https://tkmit.ac.in,https://en.wikipedia.org/wiki/TKM_Institute_of_Technology,tkmit.ac.in,2002,,,,,0000 0004 1768 4402,0000 0004 1768 4402,Q17155660,Q17155660,Kollam,India,1259091
https://github.com/ror-community/ror-updates/issues/27301,https://ror.org/03racvd14,Modern Institute of Pharmaceutical Sciences*en,active,education,Modern Institute of Pharmaceutical Sciences Indore*en,Modern Institute of Pharmaceutical Sciences*en,MIPS*en,https://www.moderninstitutes.in,,,2007,,,,,,,,,INDORE,INDIA,1269743
https://github.com/ror-community/ror-updates/issues/26892,https://ror.org/01ek6z616,Escuela de Negocios Zegel*es,active,education,Zegel*en,Escuela de Negocios Zegel*es; Zegel Business School*en,,https://www.zegel.edu.pe,https://es.wikipedia.org/wiki/Zegel,zegel.edu.pe,,,,,,,,,,Lima,Peru,3936456
https://github.com/ror-community/ror-updates/issues/26044,https://ror.org/04jrf5w40,Institute of Fisheries of the National Academy of Agrarian Sciences of Ukraine*en,active,facility,Institute of Fisheries NAASU*en; Institute of Fisheries of the NAAS of Ukraine*en; Інститут рибного господарства НААН*uk,Institute of Fisheries of the National Academy of Agrarian Sciences of Ukraine*en; Інститут рибного господарства Національної академії аграрних наук України*uk,IF NAASU*en; IF NAAS*en,https://if.org.ua,https://en.wikipedia.org/wiki/NAASU_Institute_of_Fisheries,if.org.ua,1930,,,,,,,Q12074671,Q12074671,Kyiv,Ukraine,703448
https://github.com/ror-community/ror-updates/issues/27295,https://ror.org/049s68q83,"GCS Hospital, Medical College & Research Centre*en",active,education,"GCS Hospital, Medical College and Research Centre*en; GCS Medical College*en; Gujarat Cancer Society Medical College*en","GCS Hospital, Medical College & Research Centre*en",,https://www.gcsmc.org,,gcsmc.org,,,,,,,,,,Ahmedabad,India,1279233
https://github.com/ror-community/ror-updates/issues/26128,https://ror.org/0013zga56,FAIR Data Systems (Spain),active,company,,FAIR Data Systems (Spain); FAIR Data Systems*en; FAIR Data Systems S.L.*en,FDS*en,https://fairdata.systems/home/,,fairdata.systems,2020,,,,,,,,,Madrid,Spain,3117735
https://github.com/ror-community/ror-updates/issues/26888,https://ror.org/012dcgh52,Associação Portuguesa para o Desenvolvimento da Carreira*pt,active,nonprofit,Portuguese Association for Career Development*en,Associação Portuguesa para o Desenvolvimento da Carreira*pt,APDC*pt,https://www.apdc.eu,https://pt.wikipedia.org/wiki/Associa%C3%A7%C3%A3o_Portuguesa_para_o_Desenvolvimento_da_Carreira_(APDC),apdc.eu,2009,,,,,,,,,Braga,Portugal,2742032
https://github.com/ror-community/ror-updates/issues/26850,https://ror.org/02gqcww34,Bulgarian Air Force Academy*en,active,education,"Висше военновъздушно училище ""Георги Бенковски""*bg",Bulgarian Air Force Academy*en,BAFA*en,https://www.af-acad.bg,,af-acad.bg,2020,,,,,,,Q12297478,Q12297478,Dolna Mitropolia,Bulgaria,732122
https://github.com/ror-community/ror-updates/issues/26112,https://ror.org/027v4re97,Central Council for Research in Yoga & Naturopathy*en,active,government,Central Council for Research in Yoga and Naturopathy*en,Central Council for Research in Yoga & Naturopathy*en; केंद्रीय योग एवं प्राकृतिक चिकित्सा अनुसंधान परिषद*hi,CCRYN*en,https://ccryn.nic.in,,ccryn.nic.in,1978,,,,,,,,,New Delhi,India,1261481
https://github.com/ror-community/ror-updates/issues/26818,https://ror.org/04vvwcn96,Fergana State Technical University*en,active,education,,Fergana State Technical University*en; Farg'ona davlat texnika universiteti*uz; Ферганский государственный технический университет*ru,FSTU*en,https://fstu.uz,https://ru.wikipedia.org/wiki/%D0%A4%D0%B5%D1%80%D0%B3%D0%B0%D0%BD%D1%81%D0%BA%D0%B8%D0%B9_%D0%BF%D0%BE%D0%BB%D0%B8%D1%82%D0%B5%D1%85%D0%BD%D0%B8%D1%87%D0%B5%D1%81%D0%BA%D0%B8%D0%B9_%D0%B8%D0%BD%D1%81%D1%82%D0%B8%D1%82%D1%83%D1%82,fstu.uz,2025,,,,,,,,,Fergana,Uzbekistan,1514019
https://github.com/ror-community/ror-updates/issues/26115,https://ror.org/0313xya24,Blasenzentrum der Frau AG*de,active,healthcare,Blasenzentrum der Frau*de,Blasenzentrum der Frau AG*de,,https://www.blasenzentrum-der-frau.ch,,blasenzentrum-der-frau.ch,2025,,,,,,,,,Frauenfeld,Switzerland,2660727
https://github.com/ror-community/ror-updates/issues/26858,https://ror.org/02p7qvj25,Ilocos Sur Polytechnic State College*en,active,education,,Ilocos Sur Polytechnic State College*en,ISPSC*en,https://www.ispsc.edu.ph,,ispsc.edu.ph,1998,,,,,0000 0004 1788 2775,0000 0004 1788 2775,Q12964923,Q12964923,Santa Maria,Philippines,1688016
https://github.com/ror-community/ror-updates/issues/26813,https://ror.org/04rppyr85,Hospital Dr. Exequiel González Cortés*es,active,healthcare,Hospital Exequiel Gonzalez Cortes*es,Hospital Dr. Exequiel González Cortés*es,HEGC*es,https://www.hegc.gob.cl,,hegc.gob.cl,,,,,,0000 0004 7672 9949,0000 0004 7672 9949,Q5489373,Q5489373,Santiago,Chile,3871336
https://github.com/ror-community/ror-updates/issues/26842,https://ror.org/040ps4t96,Kompetenzzentrum Obstbau Bodensee*de,active,nonprofit,Competence Centre for Fruit Growing at Lake Constance*en; Competence Centre for Fruit Growing Lake Constance*en,Kompetenzzentrum Obstbau Bodensee*de,KOB*de,https://www.kob-bavendorf.de,,kob-bavendorf.de,2000,,,,,,,,,Ravensburg,Germany,2849802
https://github.com/ror-community/ror-updates/issues/26806,https://ror.org/0095c0g57,Rare Disease Ghana Initiative*en,active,nonprofit,,Rare Disease Ghana Initiative*en,RDGI*en,https://www.rarediseaseghana.org,,rarediseaseghana.org,2018,,,,,,,,,Accra,Ghana,2306104
https://github.com/ror-community/ror-updates/issues/26859,https://ror.org/05t5px081,Center for Applied Energy Research*en,active,nonprofit,,Center for Applied Energy Research*en,CAE*en,https://www.cae-zerocarbon.de,,cae-zerocarbon.de,2022,,,,,,,,,Würzburg,Germany,2805615
https://github.com/ror-community/ror-updates/issues/26951,https://ror.org/05hn46120,Gender Equity Policy Institute*en,active,nonprofit,,Gender Equity Policy Institute*en,GEPI*en,https://www.thegepi.org,,thegepi.org,2021,,,,,0000 0005 1229 4787,0000 0005 1229 4787,,,"Los Angeles, CA",United States of America,5368361
https://github.com/ror-community/ror-updates/issues/26810,https://ror.org/04nabyp18,Hospital de la Sociedad de Lucha Contra el Cáncer SOLCA Núcleo de Loja*es,active,healthcare,SOLCA Núcleo de Loja*es,Hospital de la Sociedad de Lucha Contra el Cáncer SOLCA Núcleo de Loja*es,,https://solcaloja.med.ec,,solcaloja.med.ec,,,,,,,,,,Loja,Ecuador,3654667
https://github.com/ror-community/ror-updates/issues/26116,https://ror.org/01477py81,Fundación Triángulo*es,active,nonprofit,,Fundación Triángulo*es,FT*es,https://fundaciontriangulo.org,https://es.wikipedia.org/wiki/Fundaci%C3%B3n_Tri%C3%A1ngulo,fundaciontriangulo.org,1996,,,,,,,Q5871508,Q5871508,Madrid,Spain,3117735
https://github.com/ror-community/ror-updates/issues/26889,https://ror.org/03wxsga24,Koitaleel Samoei University College*en,active,education,Koitalel Arap Samoei University*en,Koitaleel Samoei University College*en,KSUC*en,https://ksu.ac.ke,https://en.wikipedia.org/wiki/Koitalel_Arap_Samoei_University,ksu.ac.ke,2018,,,,,0000 0005 1449 3376,0000 0005 1449 3376,,,Eldoret,Kenya,198629
https://github.com/ror-community/ror-updates/issues/26879,https://ror.org/01mg48a35,Nootan College of Physiotherapy*en,active,education,,Nootan College of Physiotherapy*en,NCP*en,https://ncp.spu.ac.in,,ncp.spu.ac.in,2016,,,,,0000 0004 1805 3442,0000 0004 1805 3442,,,Visnagar,India,1253095
https://github.com/ror-community/ror-updates/issues/26878,https://ror.org/0219kc713,Euronovia*fr,active,company,,Euronovia*fr,EURO*en,https://euronovia.eu,,euronovia.eu,2014,,,,,,,,,Paris,France,2988507
https://github.com/ror-community/ror-updates/issues/26871,https://ror.org/04x0xky69,Gyeonggi Institute of Education*en,active,education,경기도교육연구원*ko,Gyeonggi Institute of Education*en,GIER*en,https://www.gie.re.kr,,gie.re.kr,2013,,,,,0000 0004 4654 5305,0000 0004 4654 5305,,,Suwon,South Korea,1835553
https://github.com/ror-community/ror-updates/issues/26870,https://ror.org/02jhq7089,Mathari National Teaching and Referral Hospital*en,active,government,Mathari Hospital*en,Mathari National Teaching and Referral Hospital*en,MNTRH*en,,https://en.wikipedia.org/wiki/Mathari_Hospital,mntrh.go.ke,1910,,,,,,,Q24236497,Q24236497,Nairobi,Kenya,184745
https://github.com/ror-community/ror-updates/issues/26868,https://ror.org/01vjqgk24,CID GmbH*de,active,company,Center for Integrated Diabetes Care*en; Centrum Für Integrierte Diabetesversorgung*de,CID GmbH*de,CID*de,https://www.cid-direct.de,,cid-direct.de,2008,,,,,0000 0005 0681 8943,0000 0005 0681 8943,Q84542709,Q84542709,Colonge,Germany,2886242
https://github.com/ror-community/ror-updates/issues/26867,https://ror.org/00e768d94,Nowocert*en,active,company,,Nowocert*en,,https://www.nowocert.com,,nowocert.com,2024,,,,,,,,,Dublin,Ireland,2964574
https://github.com/ror-community/ror-updates/issues/26865,https://ror.org/01azk9663,Knowledge Systems Research*en,active,company,Knowledge Systems Research LLC*en,Knowledge Systems Research*en,,,,knowledgesystemsresearch.com,2001,,,,,,,,,Sunnyvale,United States,5400075
https://github.com/ror-community/ror-updates/issues/26864,https://ror.org/032s08f35,Aarogyam (UK) CIC*en,active,nonprofit,,Aarogyam (UK) CIC*en,,https://www.aarogyamuk.com,,aarogyamuk.com,2020,,,,,,,,,Loughborough,United Kingdom,2643567
https://github.com/ror-community/ror-updates/issues/26857,https://ror.org/0473r3056,Mahamana Pandit Madan Mohan Malaviya Cancer Centre*en,active,government,,Mahamana Pandit Madan Mohan Malaviya Cancer Centre*en,MPMMCC*en,https://mpmmcc.tmc.gov.in,,mpmmcc.tmc.gov.in,2019,,,,,,,,,Varanasi,India,1253405
https://github.com/ror-community/ror-updates/issues/26856,https://ror.org/017vk0a74,LWL-Klinikum Gütersloh*de,active,healthcare,Landschaftsverband Westfalen-Lippe Klinikum Gütersloh*de; LWL-hospital Gütersloh*en; Landschaftsverband Westfalen-Lippe Hospital Gütersloh*en,LWL-Klinikum Gütersloh*de,,https://www.lwl-klinikum-guetersloh.de,https://de.wikipedia.org/wiki/LWL-Klinikum_G%C3%BCtersloh,lwl.org; lwl-klinikum-guetersloh.de,1914,,,,,0000 0005 0834 9757,0000 0005 0834 9757,Q1798472,Q1798472,Gütersloh,Germany,2913366
