html_url,id,names.types.ror_display,status,types,names.types.alias,names.types.label,names.types.acronym,links.type.website,links.type.wikipedia,domains,established,external_ids.type.fundref.all,external_ids.type.fundref.preferred,external_ids.type.grid.all,external_ids.type.grid.preferred,external_ids.type.isni.all,external_ids.type.isni.preferred,external_ids.type.wikidata.all,external_ids.type.wikidata.preferred,city,country,locations.geonames_id
https://github.com/ror-community/ror-updates/issues/27445,https://ror.org/02ke2dd77,Foundation for Chiropractic Education*en,active,nonprofit; funder,Foundation for Chiropractic Education and Research*en; Foundation for Chiropractic Education and Research Inc.*en,Foundation for Chiropractic Education*en,,https://f4ce.org,,f4ce.org,,100002882,100002882,,,,,,,"Des Moines, IA",United States,4853828
https://github.com/ror-community/ror-updates/issues/27446,https://ror.org/03vv3x922,Foundation for Opioid Response Efforts*en,active,nonprofit; funder,The Foundation for Opioid Response Efforts*en,Foundation for Opioid Response Efforts*en,FORE*en,https://forefdn.org,,forefdn.org,,100020097,100020097,,,0000 0005 0815 5004,0000 0005 0815 5004,,,"New York, NY",United States,5128581
https://github.com/ror-community/ror-updates/issues/27448,https://ror.org/047885v26,Fulbright Ireland*en,active,nonprofit; funder,Fulbright Commission in Ireland*en; Fulbright Ireland-USA*en; Fulbright Ireland Program*en,Fulbright Ireland*en,,https://fulbright.ie,,fulbright.ie,,100024073,100024073,,,,,,,Dublin,Ireland,2964574
https://github.com/ror-community/ror-updates/issues/27449,https://ror.org/05bnce492,Fundación Humanismo y Ciencia*es,active,nonprofit; funder,Humanism and Science Foundation*en,Fundación Humanismo y Ciencia*es,FHC*en,https://fundacionhumanismoyciencia.org,,fundacionhumanismoyciencia.org,,501100024239,501100024239,,,0000 0005 1127 4792,0000 0005 1127 4792,,,Madrid,Spain,3117735
https://github.com/ror-community/ror-updates/issues/27450,https://ror.org/03y00b460,Fundación Universitaria Antonio Gargallo*es,active,nonprofit; funder,University Foundation Antonio Gargallo*en,Fundación Universitaria Antonio Gargallo*es,,https://fantoniogargallo.unizar.es,,fantoniogargallo.unizar.es,,501100021099,501100021099,,,,,,,Zaragoza,Spain,3104324
https://github.com/ror-community/ror-updates/issues/27452,https://ror.org/02697d919,Gaia Fund*en,active,nonprofit; funder,,Gaia Fund*en,,https://www.gaiasf.org,,gaiasf.org,,100029094,100029094,,,,,,,"San Francisco, CA",United States,5391959
https://github.com/ror-community/ror-updates/issues/27453,https://ror.org/01ykfnp55,Gates Family Foundation*en,active,nonprofit; funder,,Gates Family Foundation*en,GFF*en,https://gatesfamilyfoundation.org,,gatesfamilyfoundation.org,1946,100021281,100021281,,,0000 0005 1229 6387,0000 0005 1229 6387,Q5527103,Q5527103,"Denver, CO",United States,5419384
https://github.com/ror-community/ror-updates/issues/27454,https://ror.org/04rx3tw33,GeoBioTec*en,active,facility; funder,,GeoBioTec*en,,https://sites.fct.unl.pt/geobiotec/home,,,,100024216,100024216,,,,,,,Lisbon,Portugal,2267057
https://github.com/ror-community/ror-updates/issues/27455,https://ror.org/020yyjw05,Fullbright Germany*en,active,nonprofit; funder,German-American Fulbright Program*en; Deutsch-Amerikanische Fulbright-Kommission*de; German-American Fulbright Commission*en,Fullbright Germany*en,,https://fulbright.de,,fulbright.de,,100023719,100023719,,,,,Q1473436,Q1473436,Berlin,Germany,2950159
https://github.com/ror-community/ror-updates/issues/27456,https://ror.org/054b4h407,Gesellschaft für Forschungsförderung Niederösterreich*de,active,nonprofit; funder,Society for Research Promotion Lower Austria*en,Gesellschaft für Forschungsförderung Niederösterreich*de; Gesellschaft für Forschungsförderung Niederösterreich m.b.H.*de,GFF*de,https://www.gff-noe.at,,gff-noe.at,,100020344,100020344,,,,,,,St. Pölten,Austria,2766429
https://github.com/ror-community/ror-updates/issues/27459,https://ror.org/04nm1xm49,Hainan Provincial Health Commission*en,active,government; funder,海南省卫生厅*zh; Hainan Health Department*en; Department of Health of Hainan Province*en; Hainan Provincial Department of Health*en,Hainan Provincial Health Commission*en; 海南省卫生健康委员会*zh,,https://wst.hainan.gov.cn,,,,501100013138,501100013138,,,,,,,Haikou,China,1809078
https://github.com/ror-community/ror-updates/issues/27460,https://ror.org/044bb5p62,Hangzhou Municipal Health Commission*en,active,government; funder,Hangzhou Health and Family Planning Commission*en; 杭州市卫生和计划生育委员会*zh,Hangzhou Municipal Health Commission*en; 杭州市卫生健康委员会*zh,,https://wsjkw.hangzhou.gov.cn,,,,100015807,100015807,,,,,,,Hangzhou,China,1808926
https://github.com/ror-community/ror-updates/issues/27461,https://ror.org/05qn5hd16,Hass Avocado Board*en,active,other; funder,HAB*en,Hass Avocado Board*en,,https://hassavocadoboard.com,,hassavocadoboard.com,,100020877,100020877,,,0000 0004 6008 0743,0000 0004 6008 0743,,,"Mission Viejo, CA",United States,5373763
https://github.com/ror-community/ror-updates/issues/27463,https://ror.org/055y1ne20,Helmholtz-Fonds e.V.*de,active,funder,Helmholtz-Fonds*de,Helmholtz-Fonds e.V.*de,,https://www.helmholtz-fonds.de,,helmholtz-fonds.de,,501100013655,501100013655,,,0000 0004 8308 4755,0000 0004 8308 4755,,,Braunschweig,Germany,2945024
https://github.com/ror-community/ror-updates/issues/27464,https://ror.org/056cbez68,Henan Zhongyuan Medical Science and Technology Innovation and Development Foundation*en,active,other; funder,Henan Medical Science and Technique Foundation*en,Henan Zhongyuan Medical Science and Technology Innovation and Development Foundation*en; 河南省中原医学科技创新发展基金会*zh,,https://www.zyycjjh.com,,zyycjjh.com,,501100019331,501100019331,,,,,,,Zhengzhou,China,1784658
https://github.com/ror-community/ror-updates/issues/27469,https://ror.org/05gepz749,Institute for the Advancement of Food and Nutrition Sciences*en,active,facility; funder,,Institute for the Advancement of Food and Nutrition Sciences*en,IAFNS*en,https://iafns.org,,iafns.org,,100020185,100020185,,,0000 0005 0848 9063,0000 0005 0848 9063,,,Washington DC,United States,4140963
https://github.com/ror-community/ror-updates/issues/27470,https://ror.org/01rq3ht76,Institute of International Studies*en,active,facility; funder,"Institute of International Studies at the University of California, Berkeley*en",Institute of International Studies*en,IIS*en,https://iis.berkeley.edu,,,,100013862,100013862,,,,,,,"Los Angeles, CA",United States,5368361
https://github.com/ror-community/ror-updates/issues/27471,https://ror.org/027mm1153,Interreg North-West Europe*en,active,other; funder,Interreg North West Europe*en; Interreg NEW*en,Interreg North-West Europe*en,,https://www.nweurope.eu,,nweurope.eu,,100020362,100020362,,,,,,,Lille,France,2998324
https://github.com/ror-community/ror-updates/issues/27472,https://ror.org/042hqe202,Breakthrough T1D UK*en,active,nonprofit; funder,Juvenile Diabetes Research Foundation UK*en; Juvenile Diabetes Research Foundation United Kingdom*en,Breakthrough T1D UK*en,JDRF UK*en,https://breakthrought1d.org.uk,,breakthrought1d.org.uk,,100022690,100022690,,,,,,,London,United Kingdom,2643743
https://github.com/ror-community/ror-updates/issues/27476,https://ror.org/020yc1y85,The LEGO Foundation*en,active,nonprofit; funder,LEGO Fonden*da; The LEGO Group*en; LEGO Foundation*en,The LEGO Foundation*en,,https://learningthroughplay.com,,learningthroughplay.com,,100018325,100018325,,,0000 0005 0388 4603,0000 0005 0388 4603,Q26934901,Q26934901,Billund,Denmark,2624144
https://github.com/ror-community/ror-updates/issues/27477,https://ror.org/04krc7206,Lemann Center for Brazilian Studies*en,active,facility; funder,Lemann Center for Brazilian Studies at the University of Illinois at Urbana-Champaign*en; The Lemann Center for Brazilian Studies*en,Lemann Center for Brazilian Studies*en,LCBS*en,https://lemann.illinois.edu,,lemann.illinois.edu,,100019068,100019068,,,,,,,Urbana,United States,4914570
https://github.com/ror-community/ror-updates/issues/27478,https://ror.org/0034k2773,Louisiana Cancer Research Consortium*en,active,other; funder,,Louisiana Cancer Research Consortium*en,LCRC*en; XU LCRC*en,,,,,100020367,100020367,,,,,,,New Orleans,United States,4335045
https://github.com/ror-community/ror-updates/issues/27479,https://ror.org/04kxx2q73,Luzhou Science and Technology Bureau*en,active,government; funder,Science and Technology Bureau of Luzhou City*en; Science and Technology Bureau of Luzhou*en; Luzhou Municipal Science and Technology Bureau*en,Luzhou Science and Technology Bureau*en; 泸州市科学技术局*zh,,,,,,501100019971,501100019971,,,,,,,Luzhou,China,1801640
https://github.com/ror-community/ror-updates/issues/27480,https://ror.org/00n2qrv22,Magistrat der Stadt Wien*de,active,government; funder,Vienna City Administration*en,Magistrat der Stadt Wien*de,,https://www.wien.gv.at/kontakt/magistratsabteilungen,https://de.wikipedia.org/wiki/Magistrat_der_Stadt_Wien,,,501100010716,501100010716,,,0000 0004 1768 4242,0000 0004 1768 4242,Q1884195,Q1884195,Vienna,Austria,2761369
https://github.com/ror-community/ror-updates/issues/27481,https://ror.org/02fapb125,Majblommans Riksförbund*sv,active,other; funder,Majblommans Association*en; Mayflower Association*en,Majblommans Riksförbund*sv,,https://majblomman.se,https://sv.wikipedia.org/wiki/Majblommans_riksf%C3%B6rbund,majblomman.se,,501100009768,501100009768,,,0000 0004 7866 3410,0000 0004 7866 3410,Q10575491,Q10575491,Göteborg,Sweden,2711537
https://github.com/ror-community/ror-updates/issues/27483,https://ror.org/04baade76,Massachusetts Gaming Commission*en,active,government; funder,MA Gaming Commission*en; MassGaming*en,Massachusetts Gaming Commission*en,MGC*en,https://massgaming.com,,massgaming.com,,100018675,100018675,,,,,,,Boston,United States,4930956
https://github.com/ror-community/ror-updates/issues/27484,https://ror.org/0511nn663,Medavie Blue Cross*en,active,nonprofit; funder,Medavie Inc.*en,Medavie Blue Cross*en; Croix Bleue Medavie*fr,,https://www.medaviebc.ca,https://en.wikipedia.org/wiki/Medavie_Blue_Cross,medaviebc.ca,1943,100023298,100023298,,,0000 0004 0429 2485,0000 0004 0429 2485,Q6805157,Q6805157,"Moncton, NB",Canada,6076211
https://github.com/ror-community/ror-updates/issues/27488,https://ror.org/03577hm03,Ministry of Agriculture of the Republic of Kazakhstan*en,active,government; funder,Қазақстан Республикасы Ауыл шаруашылығы министрлігі*kk; Министерство сельского хозяйства Республики Казахстан*ru; Ministry of Agriculture of Kazakhstan*en,Ministry of Agriculture of the Republic of Kazakhstan*en,,https://www.gov.kz/memleket/entities/moa,,,,100019644,100019644,,,,,Q1804795,Q1804795,Astana,Kazakhstan,1526273
https://github.com/ror-community/ror-updates/issues/27489,https://ror.org/02n96xt70,Misophonia Research Fund*en,active,funder,The Misophonia Research Fund*en,Misophonia Research Fund*en,MRF,https://www.misophoniaresearchfund.org,,misophoniaresearchfund.org,,100019326,100019326,,,,,,,"Buffalo Grove, IL",United States,4885955
https://github.com/ror-community/ror-updates/issues/27490,https://ror.org/00zn8rh30,National Association for the Self-Employed*en,active,other; funder,"National Association for the Self-Employed Inc*en; The National Association for the Self-Employed*en; National Association for the Self-Employed, Inc.*en",National Association for the Self-Employed*en,NASE*en,https://www.nase.org,https://en.wikipedia.org/wiki/National_Association_for_the_Self-Employed,nase.org,,100026019,100026019,,,0000 0004 4659 8941,0000 0004 4659 8941,Q6970592,Q6970592,"Annapolis, MD",United States,4347242
https://github.com/ror-community/ror-updates/issues/27491,https://ror.org/04f6s9e70,The National Center for Special Education Research*en,active,other; funder,National Center for Special Education Research*en,The National Center for Special Education Research*en,NCSER*en,https://ies.ed.gov/about/national-center-special-education-research-ncser,,,,100016395,100016395,,,0000 0004 0418 9883,0000 0004 0418 9883,,,Washington DC,United States,4140963
https://github.com/ror-community/ror-updates/issues/27492,https://ror.org/03mam0k06,National Collaborative on Gun Violence Research*en,active,other; funder,The National Collaborative on Gun Violence Research*en; National Collaborative for Gun Violence Research*en,National Collaborative on Gun Violence Research*en,NCGVR*en,https://www.ncgvr.org,,ncgvr.org,,100020175,100020175,,,0000 0005 0848 9303,0000 0005 0848 9303,,,"Santa Monica, CA",United States,5393212
https://github.com/ror-community/ror-updates/issues/27493,https://ror.org/04ypb4059,National Forest Foundation*en,active,nonprofit; funder,The National Forest Foundation*en,National Forest Foundation*en,NFF,https://www.nationalforests.org,https://en.wikipedia.org/wiki/National_Forest_Foundation,nationalforests.org,,100013903,100013903,,,0000 0004 7776 8245,0000 0004 7776 8245,Q6972767,Q6972767,"Missoula, MT",United States,5666639
https://github.com/ror-community/ror-updates/issues/27497,https://ror.org/05vdh4r44,North Carolina General Assembly*en,active,government; funder,The North Carolina General Assembly*en; N.C. General Assembly*en,North Carolina General Assembly*en,,https://www.ncleg.gov,,ncleg.gov,,100019480,100019480,,,0000 0004 0599 2870,0000 0004 0599 2870,Q10566263,Q10566263,Raleigh,United States,4487042
https://github.com/ror-community/ror-updates/issues/27465,https://ror.org/01s6y4r94,Horizons Foundation*en,active,nonprofit; funder,The Horizons Foundation*en,Horizons Foundation*en,HF*en,https://www.horizonsfoundation.org,,horizonsfoundation.org,,100021426,100021426,,,0000 0005 1229 9510,0000 0005 1229 9510,,,"San Francisco, CA",United States,5391959
https://github.com/ror-community/ror-updates/issues/25341,https://ror.org/04702m080,Mahatma Gandhi University*en,active,education,"Mahatma Gandhi University, Meghalaya*en",Mahatma Gandhi University*en,MGU*en,https://mgu.edu.in,https://en.wikipedia.org/wiki/Mahatma_Gandhi_University%2C_Meghalaya,mgu.edu.in,2011,,,,,,,Q48732096,Q48732096,Meghalaya,India,1263207
https://github.com/ror-community/ror-updates/issues/25349,https://ror.org/010aat311,Dyson Institute of Engineering and Technology*en,active,education,,Dyson Institute of Engineering and Technology*en,,https://www.dysoninstitute.ac.uk,https://en.wikipedia.org/wiki/Dyson_Institute_of_Engineering_and_Technology,dysoninstitute.ac.uk,2017,,,,,,,Q30324459,Q30324459,Malmesbury,United Kingdom,2643146
https://github.com/ror-community/ror-updates/issues/25356,https://ror.org/027kj5136,Bird Conservancy of the Rockies*en,active,nonprofit,Bird Conservancy*en,Bird Conservancy of the Rockies*en,,https://www.birdconservancy.org,https://en.wikipedia.org/wiki/Bird_Conservancy_of_the_Rockies,birdconservancy.org,1988,,,,,0000 0005 1236 2372,0000 0005 1236 2372,Q7355877,Q7355877,Brighton,United States,4986994
https://github.com/ror-community/ror-updates/issues/25457,https://ror.org/027txbv15,Graduate University of Mongolia*en,active,education,,Graduate University of Mongolia*en; Монгол Улсын Эрдмийн Их Сургууль*mn,GUM*en,https://graduate.edu.mn,,gradedu.mn; graduate.edu.mn,2016,,,,,0000 0005 1379 9744,0000 0005 1379 9744,,,Ulaanbaatar,Mongolia,2028462
https://github.com/ror-community/ror-updates/issues/26356,https://ror.org/00wrsjp90,Cephas Health Research Initiative*en,active,nonprofit,Cephas*en,Cephas Health Research Initiative*en; Cephas Health Research Initiative Inc*en,CHRI*en,https://www.cephashri.org,,cephashri.org,2016,,,,,,,,,Ilesa,Nigeria,2337704
https://github.com/ror-community/ror-updates/issues/26119,https://ror.org/0263npa52,Higher School of Social Studies and Security*en,active,education,,Higher School of Social Studies and Security*en; Wyższa Szkoła Nauk Społecznych i Bezpieczeństwa*pl; Вища Школа Соціальних Наук та Безпеки*uk,WSNSB*pl,https://wsnsb.edu.pl,,wsnsb.edu.pl,2018,,,,,,,,,Lodz,Poland,3093133
https://github.com/ror-community/ror-updates/issues/26209,https://ror.org/03s1ada23,punctum books (United Sates),active,company,,punctum books (United Sates); punctum books*en,,https://punctumbooks.com,https://en.wikipedia.org/wiki/Punctum_Books,punctumbooks.com,2011,,,,,0000 0004 9286 1624,0000 0004 9286 1624,Q28455152,Q28455152,Goleta,United States,5352963
https://github.com/ror-community/ror-updates/issues/27212,https://ror.org/0148zjm56,Nova Institute*en,active,nonprofit,"Nova*en; Nova Institute, South Africa*en",Nova Institute*en; Nova Institute NPC*en,,https://nova.org.za,,nova.org.za,1994,,,,,,,,,Pretoria,South Africa,964137
https://github.com/ror-community/ror-updates/issues/26148,https://ror.org/00zgv2r34,AKFA Medline University Hospital*en,active,healthcare,AKFA Medline Hospital*en; AKFA Medline*en,AKFA Medline University Hospital*en,AMUH*en,https://akfamedline.com,,akfamedline.uz,2017,,,,,0000 0005 2893 6369,0000 0005 2893 6369,Q125501908,Q125501908,Tashkent,Uzbekistan,1512569
https://github.com/ror-community/ror-updates/issues/26218,https://ror.org/01edayx41,Uzbek State University of Physical Culture and Sport*en,active,education,Uzbek State University of Physical Education and Sport*en; Uzbekistan State University of Physical Education and Sports*en,Uzbek State University of Physical Culture and Sport*en; Узбекский государственный университет физической культуры и спорта*ru; Oʻzbekiston davlat jismoniy tarbiya va sport universiteti*uz,УзГосИФК*ru; JTSU*uz,https://jtsu.uz,https://uz.wikipedia.org/wiki/O%CA%BBzbekiston_davlat_jismoniy_tarbiya_va_sport_universiteti,jtsu.uz,1955,,,,,0000 0004 0403 3176,0000 0004 0403 3176,Q25527783,Q25527783,Chirchiq,Uzbekistan,1514210
https://github.com/ror-community/ror-updates/issues/27336,https://ror.org/00heh5r55,Institute of Evolution*en,active,facility,,Institute of Evolution*en; Evolúciótudományi Intézet*hu,,https://ecolres.hun-ren.hu/en/intezetek/institute-of-evolution/,,ecolres.hun-ren.hu,,,,,,,,,,Budapest,Hungary,3054643
https://github.com/ror-community/ror-updates/issues/27667,https://ror.org/0044ybt68,"Future House, Inc.*en",active,nonprofit,Future House*en,"Future House, Inc.*en",,https://www.futurehouse.org,,futurehouse.org,2023,,,,,0000 0005 1284 0928,0000 0005 1284 0928,,,"San Francisco, CA",United States,5391959
https://github.com/ror-community/ror-updates/issues/27666,https://ror.org/01p9amb16,Edison Scientific Inc. (United States)*en,active,company,,Edison Scientific Inc. (United States)*en; Edison Scientific Inc.*en; Edison Scientific*en,,https://edisonscientific.com,,edisonscientific.com,,,,,,,,,,San Francisco,USA,5391959
https://github.com/ror-community/ror-updates/issues/27669,https://ror.org/0272kpg92,Meituan (China),active,company,Meituan-Dianping*en,Meituan (China); Meituan*en; 美团*zh,,https://www.meituan.com,https://en.wikipedia.org/wiki/Meituan,meituan.com,2010,,,,,,,Q15907772,Q15907772,Beijing,People's Republic of China,1816670
https://github.com/ror-community/ror-updates/issues/27670,https://ror.org/03ej19f56,Moonshot AI (China)*en,active,company,,Moonshot AI (China)*en; 月之暗面*zh; Moonshot AI*en,,https://www.moonshot.ai,https://en.wikipedia.org/wiki/Moonshot_AI,moonshot.ai; moonshot.cn,2023,,,,,,,Q130270266,Q130270266,Beijing,People's Republic of China,1816670
https://github.com/ror-community/ror-updates/issues/27671,https://ror.org/023g5ws63,01.AI (China)*en,active,company,,01.AI (China)*en; 零一万物*zh; 01.AI*en,,https://www.01.ai,https://en.wikipedia.org/wiki/01.AI,01.ai,2023,,,,,,,Q130692307,Q130692307,Beijing,People's Republic of China,1816670
https://github.com/ror-community/ror-updates/issues/27672,https://ror.org/03fwjkz17,StepFun AI (China),active,company,StepFun*en,StepFun AI (China); 阶跃AI*zh; StepFun AI*en,,https://www.stepfun.com,,stepfun.com,,,,,,,,,,Shanghai,China,1796236
https://github.com/ror-community/ror-updates/issues/27673,https://ror.org/05amsz404,Baichuan (China),active,company,"Baichuan AI*en; Beijing Baichuan Intelligent Technology Co., Ltd.*en",Baichuan (China); 百川智能*zh; Baichuan*en,,https://www.baichuan-ai.com,https://en.wikipedia.org/wiki/Baichuan,baichuan-ai.com,2023,,,,,,,Q130270689,Q130270689,Beijing,China,1816670
https://github.com/ror-community/ror-updates/issues/25351,https://ror.org/056yadh79,National Institute for Research in Education*en,active,education,,National Institute for Research in Education*en; المعهد الوطني للبحث في التربية*ar; Institut National de Recherche en Education*fr,NIRE*en; INRE*fr,https://www.inre.dz,,inre.dz,1962,,,,,,,,,Algiers,Algeria,2507480
https://github.com/ror-community/ror-updates/issues/25322,https://ror.org/02ae50943,Secretaria da Saúde do Estado da Bahia*pt,active,government,Bahia State Health Department*en; Secretaria da Saúde do Estado da Bahia – SESAB*pt,Secretaria da Saúde do Estado da Bahia*pt,SESAB*pt,https://www.saude.ba.gov.br,https://pt.wikipedia.org/wiki/Secretaria_de_Sa%C3%BAde_do_Estado_da_Bahia,saude.ba.gov.br,1966,,,,,0000 0004 4686 7814,0000 0004 4686 7814,Q67200477,Q67200477,Salvador,Brazil,3450554
https://github.com/ror-community/ror-updates/issues/25369,https://ror.org/045pp4b52,Iraqi Board for Medical Specializations*en,active,education,,Iraqi Board for Medical Specializations*en; المجلس العراقي للاختصاصات الطبية*ar,,https://www.iraqiboard.edu.iq,,iraqiboard.edu.iq,1986,,,,,,,,,Baghdad,Iraq,98182
https://github.com/ror-community/ror-updates/issues/25460,https://ror.org/04eqgej32,Instituto de Investigación en Ingeniería de Aragón*es,active,education,,Instituto de Investigación en Ingeniería de Aragón*es; Aragon Institute for Engineering Research*en,I3A*en,https://i3a.es,https://es.wikipedia.org/wiki/Instituto_de_Investigaci%C3%B3n_en_Ingenier%C3%ADa_de_Arag%C3%B3n,i3a.es,2002,,,,,,,Q5811553,Q5811553,Zaragoza,Spain,3104324
https://github.com/ror-community/ror-updates/issues/25463,https://ror.org/01vkf8q93,Altamedica Artemisia*it,active,healthcare,Altamedica*it,Altamedica Artemisia*it,,https://www.altamedica.it,,altamedica.it,1970,,,,,,,,,Rome,Italy,3169070
https://github.com/ror-community/ror-updates/issues/25480,https://ror.org/04qt95144,Rathinam College of Arts & Science*en,active,education,Rathinam College of Arts and Science*en,Rathinam College of Arts & Science*en,RCAS*en,https://rathinamcollege.ac.in,https://en.wikipedia.org/wiki/Rathinam_College_of_Arts_and_Science,rathinamcollege.ac.in,2001,,,,,0000 0005 1805 9171,0000 0005 1805 9171,Q7295639,Q7295639,Coimbatore,India,1273865
https://github.com/ror-community/ror-updates/issues/25343,https://ror.org/00x38nf67,"Nalux Co., Ltd. (Japan)",active,company,Nalux*en; ナルックス*ja,"Nalux Co., Ltd. (Japan); Nalux Co., Ltd.*en; ナルックス株式会社*ja",,https://www.nalux.co.jp,,nalux.co.jp,1948,,,,,,,,,Osaka,Japan,1853909
https://github.com/ror-community/ror-updates/issues/26511,https://ror.org/014224111,European Molecular Biology Network (EMBnet)*en,active,nonprofit,European Molecular Biology Network*en; EMBnet*en,European Molecular Biology Network (EMBnet)*en,,https://www.embnet.it,https://en.wikipedia.org/wiki/EMBnet,embnet.it,1988,,,,,,,,,Amsterdam,Netherlands,2759794
https://github.com/ror-community/ror-updates/issues/27710,https://ror.org/04vshys30,Mántum S.A.S. (Colombia)*es,active,company,,Mántum S.A.S. (Colombia)*es; Mántum S.A.S.*es; Mántum*es,,https://mantum.com.co,,mantum.com.co,,,,,,,,,,Medellín,Colombia,3674962
https://github.com/ror-community/ror-updates/issues/27713,https://ror.org/006cnep94,Inorca Seating (Colombia),active,company,Industrias Nortecaucanas*es; Industrias Nortecaucanas S.A.S.*es; Inorca*en,Inorca Seating (Colombia); Inorca Seating*en,,https://inorca.com,,inorca.com.co,,,,,,,,,,Cali,Colombia,3687925
https://github.com/ror-community/ror-updates/issues/27714,https://ror.org/020rkbe43,Brinks (Colombia),active,company,Brinks Colombia*en,Brinks (Colombia); Brinks de Colombia S.A.*es; Brinks de Colombia*es,,https://co.brinks.com,,co.brinks.com,,,,,,,,,,Bogotá,Colombia,3688689
https://github.com/ror-community/ror-updates/issues/27715,https://ror.org/02tfm9x44,Geincor S.A.S. (Colombia)*es,active,company,Geincor*es,Geincor S.A.S. (Colombia)*es; Geincor S.A.S.*es,,https://geincor.com.co,,geincor.com.co,,,,,,,,,,Bogotá,Colombia,3688689
https://github.com/ror-community/ror-updates/issues/27716,https://ror.org/00gjz3j74,Controles Empresariales (Colombia)*es,active,company,Controles Empresariales*es,Controles Empresariales (Colombia)*es; Controles Empresariales*es; Controles Empresariales S.A.S.*es,,https://www.controlesempresariales.com,,coem.co,,,,,,,,,,Bogotá,Colombia,3688689
https://github.com/ror-community/ror-updates/issues/27717,https://ror.org/04jf50h38,Socovesa (Chile)*es,active,company,Empresa Constructora Socovesa*es,Socovesa (Chile)*es; Socovesa*es; Empresa Constructora Socovesa S.A.*es,,https://www.socovesa.cl,,socovesa.cl,,,,,,,,,,Santiago de Chile,Chile,3871336
https://github.com/ror-community/ror-updates/issues/27718,https://ror.org/00fas7593,PIC Latinoamérica (Chile)*es,active,company,PIC Andina S.A.*es,PIC Latinoamérica (Chile)*es; PIC Latinoamérica*es,,https://latam.pic.com,,,,,,,,,,,,Huechuraba,Chile,8261432
https://github.com/ror-community/ror-updates/issues/27720,https://ror.org/02v5jxh60,Centro de Ciencias Ambientales EULA-Chile de la Universidad de Concepción*es,active,facility,Centro de Ciencias Ambientales EULA*es; Centro EULA*es,Centro de Ciencias Ambientales EULA-Chile de la Universidad de Concepción*es,,https://eula.udec.cl,,eula.udec.cl,,,,,,,,,,Concepción,Chile,3893894
